"No.","Time","Source","Destination","Protocol","Length","Info"
"1","0.000000000","10.60.0.1","172.16.0.211","TCP","60","56294  >  80 [SYN] Seq=0 Win=65280 Len=0 MSS=1360 SACK_PERM=1 TSval=3642513711 TSecr=0 WS=128"
"2","0.001005198","172.16.0.211","10.60.0.1","TCP","60","80  >  56294 [SYN, ACK] Seq=0 Ack=1 Win=65160 Len=0 MSS=1460 SACK_PERM=1 TSval=650694152 TSecr=3642513711 WS=128"
"3","0.002990460","10.60.0.1","172.16.0.211","TCP","52","56294  >  80 [ACK] Seq=1 Ack=1 Win=65280 Len=0 TSval=3642513713 TSecr=650694152"
"4","0.002990622","10.60.0.1","172.16.0.211","HTTP","193","GET /example-clock.mp4 HTTP/1.1 "
"5","0.004005167","172.16.0.211","10.60.0.1","TCP","52","80  >  56294 [ACK] Seq=1 Ack=142 Win=65024 Len=0 TSval=650694155 TSecr=3642513713"
"6","0.004033424","172.16.0.211","10.60.0.1","TCP","1400","80  >  56294 [ACK] Seq=1 Ack=142 Win=65024 Len=1348 TSval=650694155 TSecr=3642513713 [TCP segment of a reassembled PDU]"
"7","0.004043946","172.16.0.211","10.60.0.1","TCP","1400","80  >  56294 [ACK] Seq=1349 Ack=142 Win=65024 Len=1348 TSval=650694155 TSecr=3642513713 [TCP segment of a reassembled PDU]"
"8","0.004052979","172.16.0.211","10.60.0.1","TCP","1400","80  >  56294 [ACK] Seq=2697 Ack=142 Win=65024 Len=1348 TSval=650694155 TSecr=3642513713 [TCP segment of a reassembled PDU]"
"9","0.004062297","172.16.0.211","10.60.0.1","TCP","1400","80  >  56294 [ACK] Seq=4045 Ack=142 Win=65024 Len=1348 TSval=650694155 TSecr=3642513713 [TCP segment of a reassembled PDU]"
"10","0.004070321","172.16.0.211","10.60.0.1","TCP","1400","80  >  56294 [ACK] Seq=5393 Ack=142 Win=65024 Len=1348 TSval=650694155 TSecr=3642513713 [TCP segment of a reassembled PDU]"
"11","0.004079141","172.16.0.211","10.60.0.1","TCP","1400","80  >  56294 [ACK] Seq=6741 Ack=142 Win=65024 Len=1348 TSval=650694155 TSecr=3642513713 [TCP segment of a reassembled PDU]"
"12","0.004087523","172.16.0.211","10.60.0.1","TCP","1400","80  >  56294 [ACK] Seq=8089 Ack=142 Win=65024 Len=1348 TSval=650694155 TSecr=3642513713 [TCP segment of a reassembled PDU]"
"13","0.004096148","172.16.0.211","10.60.0.1","TCP","1400","80  >  56294 [ACK] Seq=9437 Ack=142 Win=65024 Len=1348 TSval=650694155 TSecr=3642513713 [TCP segment of a reassembled PDU]"
"14","0.004104721","172.16.0.211","10.60.0.1","TCP","1400","80  >  56294 [ACK] Seq=10785 Ack=142 Win=65024 Len=1348 TSval=650694155 TSecr=3642513713 [TCP segment of a reassembled PDU]"
"15","0.004113292","172.16.0.211","10.60.0.1","TCP","1400","80  >  56294 [ACK] Seq=12133 Ack=142 Win=65024 Len=1348 TSval=650694155 TSecr=3642513713 [TCP segment of a reassembled PDU]"
"16","0.005996921","10.60.0.1","172.16.0.211","TCP","52","56294  >  80 [ACK] Seq=142 Ack=1349 Win=64256 Len=0 TSval=3642513716 TSecr=650694155"
"17","0.005997061","10.60.0.1","172.16.0.211","TCP","52","56294  >  80 [ACK] Seq=142 Ack=2697 Win=63232 Len=0 TSval=3642513716 TSecr=650694155"
"18","0.005997092","10.60.0.1","172.16.0.211","TCP","52","56294  >  80 [ACK] Seq=142 Ack=4045 Win=64256 Len=0 TSval=3642513716 TSecr=650694155"
"19","0.005997113","10.60.0.1","172.16.0.211","TCP","52","56294  >  80 [ACK] Seq=142 Ack=5393 Win=63232 Len=0 TSval=3642513716 TSecr=650694155"
"20","0.005997139","10.60.0.1","172.16.0.211","TCP","52","56294  >  80 [ACK] Seq=142 Ack=6741 Win=62080 Len=0 TSval=3642513716 TSecr=650694155"
"21","0.007017260","172.16.0.211","10.60.0.1","TCP","1400","80  >  56294 [ACK] Seq=13481 Ack=142 Win=65024 Len=1348 TSval=650694158 TSecr=3642513716 [TCP segment of a reassembled PDU]"
"22","0.007031811","172.16.0.211","10.60.0.1","TCP","1400","80  >  56294 [ACK] Seq=14829 Ack=142 Win=65024 Len=1348 TSval=650694158 TSecr=3642513716 [TCP segment of a reassembled PDU]"
"23","0.007043089","172.16.0.211","10.60.0.1","TCP","1400","80  >  56294 [ACK] Seq=16177 Ack=142 Win=65024 Len=1348 TSval=650694158 TSecr=3642513716 [TCP segment of a reassembled PDU]"
"24","0.007055171","172.16.0.211","10.60.0.1","TCP","1400","80  >  56294 [ACK] Seq=17525 Ack=142 Win=65024 Len=1348 TSval=650694158 TSecr=3642513716 [TCP segment of a reassembled PDU]"
"25","0.007066354","172.16.0.211","10.60.0.1","TCP","1400","80  >  56294 [ACK] Seq=18873 Ack=142 Win=65024 Len=1348 TSval=650694158 TSecr=3642513716 [TCP segment of a reassembled PDU]"
"26","0.007075164","172.16.0.211","10.60.0.1","TCP","1400","80  >  56294 [ACK] Seq=20221 Ack=142 Win=65024 Len=1348 TSval=650694158 TSecr=3642513716 [TCP segment of a reassembled PDU]"
"27","0.007086598","172.16.0.211","10.60.0.1","TCP","1400","80  >  56294 [ACK] Seq=21569 Ack=142 Win=65024 Len=1348 TSval=650694158 TSecr=3642513716 [TCP segment of a reassembled PDU]"
"28","0.007097598","172.16.0.211","10.60.0.1","TCP","1400","80  >  56294 [ACK] Seq=22917 Ack=142 Win=65024 Len=1348 TSval=650694158 TSecr=3642513716 [TCP segment of a reassembled PDU]"
"29","0.007108570","172.16.0.211","10.60.0.1","TCP","1400","80  >  56294 [ACK] Seq=24265 Ack=142 Win=65024 Len=1348 TSval=650694158 TSecr=3642513716 [TCP segment of a reassembled PDU]"
"30","0.007119728","172.16.0.211","10.60.0.1","TCP","1400","80  >  56294 [ACK] Seq=25613 Ack=142 Win=65024 Len=1348 TSval=650694158 TSecr=3642513716 [TCP segment of a reassembled PDU]"
"31","0.006996184","10.60.0.1","172.16.0.211","TCP","52","56294  >  80 [ACK] Seq=142 Ack=8089 Win=60928 Len=0 TSval=3642513717 TSecr=650694155"
"32","0.006996215","10.60.0.1","172.16.0.211","TCP","52","56294  >  80 [ACK] Seq=142 Ack=9437 Win=59776 Len=0 TSval=3642513717 TSecr=650694155"
"33","0.006996236","10.60.0.1","172.16.0.211","TCP","52","56294  >  80 [ACK] Seq=142 Ack=10785 Win=58624 Len=0 TSval=3642513717 TSecr=650694155"
"34","0.006996263","10.60.0.1","172.16.0.211","TCP","52","56294  >  80 [ACK] Seq=142 Ack=12133 Win=57472 Len=0 TSval=3642513717 TSecr=650694155"
"35","0.006996284","10.60.0.1","172.16.0.211","TCP","52","56294  >  80 [ACK] Seq=142 Ack=13481 Win=56320 Len=0 TSval=3642513717 TSecr=650694155"
"36","0.009013434","172.16.0.211","10.60.0.1","TCP","1400","80  >  56294 [ACK] Seq=26961 Ack=142 Win=65024 Len=1348 TSval=650694160 TSecr=3642513717 [TCP segment of a reassembled PDU]"
"37","0.009029448","172.16.0.211","10.60.0.1","TCP","1400","80  >  56294 [ACK] Seq=28309 Ack=142 Win=65024 Len=1348 TSval=650694160 TSecr=3642513717 [TCP segment of a reassembled PDU]"
"38","0.009041816","172.16.0.211","10.60.0.1","TCP","1400","80  >  56294 [ACK] Seq=29657 Ack=142 Win=65024 Len=1348 TSval=650694160 TSecr=3642513717 [TCP segment of a reassembled PDU]"
"39","0.009053319","172.16.0.211","10.60.0.1","TCP","1400","80  >  56294 [ACK] Seq=31005 Ack=142 Win=65024 Len=1348 TSval=650694160 TSecr=3642513717 [TCP segment of a reassembled PDU]"
"40","0.009065935","172.16.0.211","10.60.0.1","TCP","1400","80  >  56294 [ACK] Seq=32353 Ack=142 Win=65024 Len=1348 TSval=650694160 TSecr=3642513717 [TCP segment of a reassembled PDU]"
"41","0.009078736","172.16.0.211","10.60.0.1","TCP","1400","80  >  56294 [ACK] Seq=33701 Ack=142 Win=65024 Len=1348 TSval=650694160 TSecr=3642513717 [TCP segment of a reassembled PDU]"
"42","0.009090860","172.16.0.211","10.60.0.1","TCP","1400","80  >  56294 [ACK] Seq=35049 Ack=142 Win=65024 Len=1348 TSval=650694160 TSecr=3642513717 [TCP segment of a reassembled PDU]"
"43","0.009102750","172.16.0.211","10.60.0.1","TCP","1400","80  >  56294 [ACK] Seq=36397 Ack=142 Win=65024 Len=1348 TSval=650694160 TSecr=3642513717 [TCP segment of a reassembled PDU]"
"44","0.009114972","172.16.0.211","10.60.0.1","TCP","1400","80  >  56294 [ACK] Seq=37745 Ack=142 Win=65024 Len=1348 TSval=650694160 TSecr=3642513717 [TCP segment of a reassembled PDU]"
"45","0.009127200","172.16.0.211","10.60.0.1","TCP","1400","80  >  56294 [ACK] Seq=39093 Ack=142 Win=65024 Len=1348 TSval=650694160 TSecr=3642513717 [TCP segment of a reassembled PDU]"
"46","0.009996425","10.60.0.1","172.16.0.211","TCP","52","56294  >  80 [ACK] Seq=142 Ack=14829 Win=55168 Len=0 TSval=3642513720 TSecr=650694158"
"47","0.009996576","10.60.0.1","172.16.0.211","TCP","52","56294  >  80 [ACK] Seq=142 Ack=16177 Win=54016 Len=0 TSval=3642513720 TSecr=650694158"
"48","0.009996600","10.60.0.1","172.16.0.211","TCP","52","56294  >  80 [ACK] Seq=142 Ack=17525 Win=52864 Len=0 TSval=3642513720 TSecr=650694158"
"49","0.009996622","10.60.0.1","172.16.0.211","TCP","52","56294  >  80 [ACK] Seq=142 Ack=18873 Win=51712 Len=0 TSval=3642513720 TSecr=650694158"
"50","0.009996644","10.60.0.1","172.16.0.211","TCP","52","56294  >  80 [ACK] Seq=142 Ack=20221 Win=50560 Len=0 TSval=3642513720 TSecr=650694158"
"51","0.009996665","10.60.0.1","172.16.0.211","TCP","52","56294  >  80 [ACK] Seq=142 Ack=21569 Win=49408 Len=0 TSval=3642513720 TSecr=650694158"
"52","0.011000240","172.16.0.211","10.60.0.1","TCP","1400","80  >  56294 [ACK] Seq=40441 Ack=142 Win=65024 Len=1348 TSval=650694162 TSecr=3642513720 [TCP segment of a reassembled PDU]"
"53","0.011986649","10.60.0.1","172.16.0.211","TCP","60","56298  >  80 [SYN] Seq=0 Win=65280 Len=0 MSS=1360 SACK_PERM=1 TSval=3642513722 TSecr=0 WS=128"
"54","0.012995233","172.16.0.211","10.60.0.1","TCP","60","80  >  56298 [SYN, ACK] Seq=0 Ack=1 Win=65160 Len=0 MSS=1460 SACK_PERM=1 TSval=650694164 TSecr=3642513722 WS=128"
"55","0.013983981","10.60.0.1","172.16.0.211","TCP","52","56298  >  80 [ACK] Seq=1 Ack=1 Win=65280 Len=0 TSval=3642513725 TSecr=650694164"
"56","0.013984056","10.60.0.1","172.16.0.211","HTTP","200","GET /example-clock.mp4 HTTP/1.1 "
"57","0.014998497","172.16.0.211","10.60.0.1","TCP","52","80  >  56298 [ACK] Seq=1 Ack=149 Win=65024 Len=0 TSval=650694166 TSecr=3642513725"
"58","0.015019893","172.16.0.211","10.60.0.1","TCP","1400","80  >  56298 [ACK] Seq=1 Ack=149 Win=65024 Len=1348 TSval=650694166 TSecr=3642513725 [TCP segment of a reassembled PDU]"
"59","0.015029616","172.16.0.211","10.60.0.1","TCP","1400","80  >  56298 [ACK] Seq=1349 Ack=149 Win=65024 Len=1348 TSval=650694166 TSecr=3642513725 [TCP segment of a reassembled PDU]"
"60","0.015038457","172.16.0.211","10.60.0.1","TCP","1400","80  >  56298 [ACK] Seq=2697 Ack=149 Win=65024 Len=1348 TSval=650694166 TSecr=3642513725 [TCP segment of a reassembled PDU]"
"61","0.015047162","172.16.0.211","10.60.0.1","TCP","1400","80  >  56298 [ACK] Seq=4045 Ack=149 Win=65024 Len=1348 TSval=650694166 TSecr=3642513725 [TCP segment of a reassembled PDU]"
"62","0.015055671","172.16.0.211","10.60.0.1","TCP","1400","80  >  56298 [ACK] Seq=5393 Ack=149 Win=65024 Len=1348 TSval=650694166 TSecr=3642513725 [TCP segment of a reassembled PDU]"
"63","0.015064412","172.16.0.211","10.60.0.1","TCP","1400","80  >  56298 [ACK] Seq=6741 Ack=149 Win=65024 Len=1348 TSval=650694166 TSecr=3642513725 [TCP segment of a reassembled PDU]"
"64","0.015076608","172.16.0.211","10.60.0.1","TCP","1400","80  >  56298 [ACK] Seq=8089 Ack=149 Win=65024 Len=1348 TSval=650694166 TSecr=3642513725 [TCP segment of a reassembled PDU]"
"65","0.015089439","172.16.0.211","10.60.0.1","TCP","1400","80  >  56298 [ACK] Seq=9437 Ack=149 Win=65024 Len=1348 TSval=650694166 TSecr=3642513725 [TCP segment of a reassembled PDU]"
"66","0.015101017","172.16.0.211","10.60.0.1","TCP","1400","80  >  56298 [ACK] Seq=10785 Ack=149 Win=65024 Len=1348 TSval=650694166 TSecr=3642513725 [TCP segment of a reassembled PDU]"
"67","0.015112866","172.16.0.211","10.60.0.1","TCP","1400","80  >  56298 [ACK] Seq=12133 Ack=149 Win=65024 Len=1348 TSval=650694166 TSecr=3642513725 [TCP segment of a reassembled PDU]"
"68","0.016985284","10.60.0.1","172.16.0.211","TCP","52","56298  >  80 [ACK] Seq=149 Ack=1349 Win=64256 Len=0 TSval=3642513727 TSecr=650694166"
"69","0.016985366","10.60.0.1","172.16.0.211","TCP","52","56298  >  80 [ACK] Seq=149 Ack=2697 Win=63232 Len=0 TSval=3642513727 TSecr=650694166"
"70","0.016985394","10.60.0.1","172.16.0.211","TCP","52","56298  >  80 [ACK] Seq=149 Ack=4045 Win=62080 Len=0 TSval=3642513727 TSecr=650694166"
"71","0.018010474","172.16.0.211","10.60.0.1","TCP","1400","80  >  56298 [ACK] Seq=13481 Ack=149 Win=65024 Len=1348 TSval=650694169 TSecr=3642513727 [TCP segment of a reassembled PDU]"
"72","0.018023757","172.16.0.211","10.60.0.1","TCP","1400","80  >  56298 [ACK] Seq=14829 Ack=149 Win=65024 Len=1348 TSval=650694169 TSecr=3642513727 [TCP segment of a reassembled PDU]"
"73","0.017984579","10.60.0.1","172.16.0.211","TCP","52","56298  >  80 [ACK] Seq=149 Ack=5393 Win=60928 Len=0 TSval=3642513728 TSecr=650694166"
"74","0.017984656","10.60.0.1","172.16.0.211","TCP","52","56298  >  80 [ACK] Seq=149 Ack=6741 Win=59776 Len=0 TSval=3642513728 TSecr=650694166"
"75","0.017984677","10.60.0.1","172.16.0.211","TCP","52","56298  >  80 [ACK] Seq=149 Ack=8089 Win=58624 Len=0 TSval=3642513728 TSecr=650694166"
"76","0.017984708","10.60.0.1","172.16.0.211","TCP","52","56298  >  80 [ACK] Seq=149 Ack=9437 Win=57472 Len=0 TSval=3642513728 TSecr=650694166"
"77","0.017984731","10.60.0.1","172.16.0.211","TCP","52","56298  >  80 [ACK] Seq=149 Ack=10785 Win=56320 Len=0 TSval=3642513728 TSecr=650694166"
"78","0.017984752","10.60.0.1","172.16.0.211","TCP","52","56298  >  80 [ACK] Seq=149 Ack=12133 Win=55168 Len=0 TSval=3642513728 TSecr=650694166"
"79","0.017984773","10.60.0.1","172.16.0.211","TCP","52","56298  >  80 [ACK] Seq=149 Ack=13481 Win=54016 Len=0 TSval=3642513728 TSecr=650694166"
"80","0.017984794","10.60.0.1","172.16.0.211","TCP","52","56294  >  80 [RST, ACK] Seq=142 Ack=41789 Win=64256 Len=0 TSval=3642513729 TSecr=650694158"
"81","0.019004743","172.16.0.211","10.60.0.1","TCP","1400","80  >  56298 [ACK] Seq=16177 Ack=149 Win=65024 Len=1348 TSval=650694170 TSecr=3642513728 [TCP segment of a reassembled PDU]"
"82","0.019017579","172.16.0.211","10.60.0.1","TCP","1400","80  >  56298 [ACK] Seq=17525 Ack=149 Win=65024 Len=1348 TSval=650694170 TSecr=3642513728 [TCP segment of a reassembled PDU]"
"83","0.019026954","172.16.0.211","10.60.0.1","TCP","1400","80  >  56298 [ACK] Seq=18873 Ack=149 Win=65024 Len=1348 TSval=650694170 TSecr=3642513728 [TCP segment of a reassembled PDU]"
"84","0.019035695","172.16.0.211","10.60.0.1","TCP","1400","80  >  56298 [ACK] Seq=20221 Ack=149 Win=65024 Len=1348 TSval=650694170 TSecr=3642513728 [TCP segment of a reassembled PDU]"
"85","0.019044259","172.16.0.211","10.60.0.1","TCP","1400","80  >  56298 [ACK] Seq=21569 Ack=149 Win=65024 Len=1348 TSval=650694170 TSecr=3642513728 [TCP segment of a reassembled PDU]"
"86","0.019052866","172.16.0.211","10.60.0.1","TCP","1400","80  >  56298 [ACK] Seq=22917 Ack=149 Win=65024 Len=1348 TSval=650694170 TSecr=3642513728 [TCP segment of a reassembled PDU]"
"87","0.019061327","172.16.0.211","10.60.0.1","TCP","1400","80  >  56298 [ACK] Seq=24265 Ack=149 Win=65024 Len=1348 TSval=650694170 TSecr=3642513728 [TCP segment of a reassembled PDU]"
"88","0.019069798","172.16.0.211","10.60.0.1","TCP","1400","80  >  56298 [ACK] Seq=25613 Ack=149 Win=65024 Len=1348 TSval=650694170 TSecr=3642513728 [TCP segment of a reassembled PDU]"
"89","0.018992748","10.60.0.1","172.16.0.211","TCP","52","56298  >  80 [ACK] Seq=149 Ack=14829 Win=64256 Len=0 TSval=3642513730 TSecr=650694169"
"90","0.018992813","10.60.0.1","172.16.0.211","TCP","52","56298  >  80 [ACK] Seq=149 Ack=16177 Win=63232 Len=0 TSval=3642513730 TSecr=650694169"
"91","0.020005267","172.16.0.211","10.60.0.1","TCP","1400","80  >  56298 [ACK] Seq=26961 Ack=149 Win=65024 Len=1348 TSval=650694171 TSecr=3642513728 [TCP segment of a reassembled PDU]"
"92","0.020019840","172.16.0.211","10.60.0.1","TCP","1400","80  >  56298 [ACK] Seq=28309 Ack=149 Win=65024 Len=1348 TSval=650694171 TSecr=3642513728 [TCP segment of a reassembled PDU]"
"93","0.020029184","172.16.0.211","10.60.0.1","TCP","1400","80  >  56298 [ACK] Seq=29657 Ack=149 Win=65024 Len=1348 TSval=650694171 TSecr=3642513728 [TCP segment of a reassembled PDU]"
"94","0.020038178","172.16.0.211","10.60.0.1","TCP","1400","80  >  56298 [ACK] Seq=31005 Ack=149 Win=65024 Len=1348 TSval=650694171 TSecr=3642513728 [TCP segment of a reassembled PDU]"
"95","0.020046150","172.16.0.211","10.60.0.1","TCP","1400","80  >  56298 [ACK] Seq=32353 Ack=149 Win=65024 Len=1348 TSval=650694171 TSecr=3642513728 [TCP segment of a reassembled PDU]"
"96","0.020054951","172.16.0.211","10.60.0.1","TCP","1400","80  >  56298 [ACK] Seq=33701 Ack=149 Win=65024 Len=1348 TSval=650694171 TSecr=3642513728 [TCP segment of a reassembled PDU]"
"97","0.021012796","172.16.0.211","10.60.0.1","TCP","1400","80  >  56298 [ACK] Seq=35049 Ack=149 Win=65024 Len=1348 TSval=650694172 TSecr=3642513730 [TCP segment of a reassembled PDU]"
"98","0.021025819","172.16.0.211","10.60.0.1","TCP","1400","80  >  56298 [ACK] Seq=36397 Ack=149 Win=65024 Len=1348 TSval=650694172 TSecr=3642513730 [TCP segment of a reassembled PDU]"
"99","0.021034891","172.16.0.211","10.60.0.1","TCP","1400","80  >  56298 [ACK] Seq=37745 Ack=149 Win=65024 Len=1348 TSval=650694172 TSecr=3642513730 [TCP segment of a reassembled PDU]"
"100","0.021043602","172.16.0.211","10.60.0.1","TCP","1400","80  >  56298 [ACK] Seq=39093 Ack=149 Win=65024 Len=1348 TSval=650694172 TSecr=3642513730 [TCP segment of a reassembled PDU]"
"101","0.021052200","172.16.0.211","10.60.0.1","TCP","1400","80  >  56298 [ACK] Seq=40441 Ack=149 Win=65024 Len=1348 TSval=650694172 TSecr=3642513730 [TCP segment of a reassembled PDU]"
"102","0.021060914","172.16.0.211","10.60.0.1","TCP","1400","80  >  56298 [ACK] Seq=41789 Ack=149 Win=65024 Len=1348 TSval=650694172 TSecr=3642513730 [TCP segment of a reassembled PDU]"
"103","0.021069561","172.16.0.211","10.60.0.1","TCP","1400","80  >  56298 [ACK] Seq=43137 Ack=149 Win=65024 Len=1348 TSval=650694172 TSecr=3642513730 [TCP segment of a reassembled PDU]"
"104","0.021078286","172.16.0.211","10.60.0.1","TCP","1400","80  >  56298 [ACK] Seq=44485 Ack=149 Win=65024 Len=1348 TSval=650694172 TSecr=3642513730 [TCP segment of a reassembled PDU]"
"105","0.020998661","10.60.0.1","172.16.0.211","TCP","52","56298  >  80 [ACK] Seq=149 Ack=17525 Win=64256 Len=0 TSval=3642513731 TSecr=650694170"
"106","0.020998740","10.60.0.1","172.16.0.211","TCP","52","56298  >  80 [ACK] Seq=149 Ack=18873 Win=63232 Len=0 TSval=3642513731 TSecr=650694170"
"107","0.020998770","10.60.0.1","172.16.0.211","TCP","52","56298  >  80 [ACK] Seq=149 Ack=20221 Win=62080 Len=0 TSval=3642513732 TSecr=650694170"
"108","0.020998793","10.60.0.1","172.16.0.211","TCP","52","56298  >  80 [ACK] Seq=149 Ack=21569 Win=60928 Len=0 TSval=3642513732 TSecr=650694170"
"109","0.022999819","172.16.0.211","10.60.0.1","TCP","1400","80  >  56298 [ACK] Seq=45833 Ack=149 Win=65024 Len=1348 TSval=650694174 TSecr=3642513731 [TCP segment of a reassembled PDU]"
"110","0.022990616","10.60.0.1","172.16.0.211","TCP","52","56298  >  80 [ACK] Seq=149 Ack=44485 Win=64256 Len=0 TSval=3642513734 TSecr=650694170"
"111","0.024006403","172.16.0.211","10.60.0.1","TCP","1400","80  >  56298 [ACK] Seq=47181 Ack=149 Win=65024 Len=1348 TSval=650694175 TSecr=3642513734 [TCP segment of a reassembled PDU]"
"112","0.024020279","172.16.0.211","10.60.0.1","TCP","1400","80  >  56298 [ACK] Seq=48529 Ack=149 Win=65024 Len=1348 TSval=650694175 TSecr=3642513734 [TCP segment of a reassembled PDU]"
"113","0.024029299","172.16.0.211","10.60.0.1","TCP","1400","80  >  56298 [ACK] Seq=49877 Ack=149 Win=65024 Len=1348 TSval=650694175 TSecr=3642513734 [TCP segment of a reassembled PDU]"
"114","0.024037881","172.16.0.211","10.60.0.1","TCP","1400","80  >  56298 [ACK] Seq=51225 Ack=149 Win=65024 Len=1348 TSval=650694175 TSecr=3642513734 [TCP segment of a reassembled PDU]"
"115","0.024046350","172.16.0.211","10.60.0.1","TCP","1400","80  >  56298 [ACK] Seq=52573 Ack=149 Win=65024 Len=1348 TSval=650694175 TSecr=3642513734 [TCP segment of a reassembled PDU]"
"116","0.024055145","172.16.0.211","10.60.0.1","TCP","1400","80  >  56298 [ACK] Seq=53921 Ack=149 Win=65024 Len=1348 TSval=650694175 TSecr=3642513734 [TCP segment of a reassembled PDU]"
"117","0.024063872","172.16.0.211","10.60.0.1","TCP","1400","80  >  56298 [ACK] Seq=55269 Ack=149 Win=65024 Len=1348 TSval=650694175 TSecr=3642513734 [TCP segment of a reassembled PDU]"
"118","0.023993158","10.60.0.1","172.16.0.211","TCP","52","56298  >  80 [ACK] Seq=149 Ack=47181 Win=64256 Len=0 TSval=3642513735 TSecr=650694172"
"119","0.024998324","172.16.0.211","10.60.0.1","TCP","1400","80  >  56298 [ACK] Seq=56617 Ack=149 Win=65024 Len=1348 TSval=650694176 TSecr=3642513734 [TCP segment of a reassembled PDU]"
"120","0.025009708","172.16.0.211","10.60.0.1","TCP","1400","80  >  56298 [ACK] Seq=57965 Ack=149 Win=65024 Len=1348 TSval=650694176 TSecr=3642513734 [TCP segment of a reassembled PDU]"
"121","0.025018667","172.16.0.211","10.60.0.1","TCP","1400","80  >  56298 [ACK] Seq=59313 Ack=149 Win=65024 Len=1348 TSval=650694176 TSecr=3642513734 [TCP segment of a reassembled PDU]"
"122","0.025027114","172.16.0.211","10.60.0.1","TCP","1400","80  >  56298 [ACK] Seq=60661 Ack=149 Win=65024 Len=1348 TSval=650694176 TSecr=3642513734 [TCP segment of a reassembled PDU]"
"123","0.025035711","172.16.0.211","10.60.0.1","TCP","1400","80  >  56298 [ACK] Seq=62009 Ack=149 Win=65024 Len=1348 TSval=650694176 TSecr=3642513734 [TCP segment of a reassembled PDU]"
"124","0.025046978","172.16.0.211","10.60.0.1","TCP","1400","80  >  56298 [ACK] Seq=63357 Ack=149 Win=65024 Len=1348 TSval=650694176 TSecr=3642513734 [TCP segment of a reassembled PDU]"
"125","0.025059597","172.16.0.211","10.60.0.1","TCP","1400","80  >  56298 [ACK] Seq=64705 Ack=149 Win=65024 Len=1348 TSval=650694176 TSecr=3642513734 [TCP segment of a reassembled PDU]"
"126","0.025072140","172.16.0.211","10.60.0.1","TCP","1400","80  >  56298 [ACK] Seq=66053 Ack=149 Win=65024 Len=1348 TSval=650694176 TSecr=3642513734 [TCP segment of a reassembled PDU]"
"127","0.025084052","172.16.0.211","10.60.0.1","TCP","1400","80  >  56298 [ACK] Seq=67401 Ack=149 Win=65024 Len=1348 TSval=650694176 TSecr=3642513734 [TCP segment of a reassembled PDU]"
"128","0.025999975","172.16.0.211","10.60.0.1","TCP","1400","80  >  56298 [ACK] Seq=68749 Ack=149 Win=65024 Len=1348 TSval=650694177 TSecr=3642513735 [TCP segment of a reassembled PDU]"
"129","0.026012240","172.16.0.211","10.60.0.1","TCP","1400","80  >  56298 [ACK] Seq=70097 Ack=149 Win=65024 Len=1348 TSval=650694177 TSecr=3642513735 [TCP segment of a reassembled PDU]"
"130","0.026021188","172.16.0.211","10.60.0.1","TCP","1400","80  >  56298 [ACK] Seq=71445 Ack=149 Win=65024 Len=1348 TSval=650694177 TSecr=3642513735 [TCP segment of a reassembled PDU]"
"131","0.026029675","172.16.0.211","10.60.0.1","TCP","1400","80  >  56298 [ACK] Seq=72793 Ack=149 Win=65024 Len=1348 TSval=650694177 TSecr=3642513735 [TCP segment of a reassembled PDU]"
"132","0.026038514","172.16.0.211","10.60.0.1","TCP","1400","80  >  56298 [ACK] Seq=74141 Ack=149 Win=65024 Len=1348 TSval=650694177 TSecr=3642513735 [TCP segment of a reassembled PDU]"
"133","0.026050669","172.16.0.211","10.60.0.1","TCP","1400","80  >  56298 [ACK] Seq=75489 Ack=149 Win=65024 Len=1348 TSval=650694177 TSecr=3642513735 [TCP segment of a reassembled PDU]"
"134","0.025989867","10.60.0.1","172.16.0.211","TCP","52","56298  >  80 [ACK] Seq=149 Ack=53921 Win=64256 Len=0 TSval=3642513736 TSecr=650694175"
"135","0.028001924","172.16.0.211","10.60.0.1","TCP","1400","80  >  56298 [ACK] Seq=76837 Ack=149 Win=65024 Len=1348 TSval=650694179 TSecr=3642513736 [TCP segment of a reassembled PDU]"
"136","0.028014644","172.16.0.211","10.60.0.1","TCP","1400","80  >  56298 [ACK] Seq=78185 Ack=149 Win=65024 Len=1348 TSval=650694179 TSecr=3642513736 [TCP segment of a reassembled PDU]"
"137","0.028023713","172.16.0.211","10.60.0.1","TCP","1400","80  >  56298 [ACK] Seq=79533 Ack=149 Win=65024 Len=1348 TSval=650694179 TSecr=3642513736 [TCP segment of a reassembled PDU]"
"138","0.028032350","172.16.0.211","10.60.0.1","TCP","1400","80  >  56298 [ACK] Seq=80881 Ack=149 Win=65024 Len=1348 TSval=650694179 TSecr=3642513736 [TCP segment of a reassembled PDU]"
"139","0.028041103","172.16.0.211","10.60.0.1","TCP","1400","80  >  56298 [ACK] Seq=82229 Ack=149 Win=65024 Len=1348 TSval=650694179 TSecr=3642513736 [TCP segment of a reassembled PDU]"
"140","0.028049598","172.16.0.211","10.60.0.1","TCP","1400","80  >  56298 [ACK] Seq=83577 Ack=149 Win=65024 Len=1348 TSval=650694179 TSecr=3642513736 [TCP segment of a reassembled PDU]"
"141","0.027990566","10.60.0.1","172.16.0.211","TCP","52","56298  >  80 [ACK] Seq=149 Ack=76837 Win=64256 Len=0 TSval=3642513738 TSecr=650694175"
"142","0.030026196","172.16.0.211","10.60.0.1","TCP","1400","80  >  56298 [ACK] Seq=84925 Ack=149 Win=65024 Len=1348 TSval=650694181 TSecr=3642513738 [TCP segment of a reassembled PDU]"
"143","0.030039617","172.16.0.211","10.60.0.1","TCP","1400","80  >  56298 [ACK] Seq=86273 Ack=149 Win=65024 Len=1348 TSval=650694181 TSecr=3642513738 [TCP segment of a reassembled PDU]"
"144","0.030048831","172.16.0.211","10.60.0.1","TCP","1400","80  >  56298 [ACK] Seq=87621 Ack=149 Win=65024 Len=1348 TSval=650694181 TSecr=3642513738 [TCP segment of a reassembled PDU]"
"145","0.030057331","172.16.0.211","10.60.0.1","TCP","1400","80  >  56298 [ACK] Seq=88969 Ack=149 Win=65024 Len=1348 TSval=650694181 TSecr=3642513738 [TCP segment of a reassembled PDU]"
"146","0.030065845","172.16.0.211","10.60.0.1","TCP","1400","80  >  56298 [ACK] Seq=90317 Ack=149 Win=65024 Len=1348 TSval=650694181 TSecr=3642513738 [TCP segment of a reassembled PDU]"
"147","0.030074392","172.16.0.211","10.60.0.1","TCP","1400","80  >  56298 [ACK] Seq=91665 Ack=149 Win=65024 Len=1348 TSval=650694181 TSecr=3642513738 [TCP segment of a reassembled PDU]"
"148","0.030082916","172.16.0.211","10.60.0.1","TCP","1400","80  >  56298 [ACK] Seq=93013 Ack=149 Win=65024 Len=1348 TSval=650694181 TSecr=3642513738 [TCP segment of a reassembled PDU]"
"149","0.030091470","172.16.0.211","10.60.0.1","TCP","1400","80  >  56298 [ACK] Seq=94361 Ack=149 Win=65024 Len=1348 TSval=650694181 TSecr=3642513738 [TCP segment of a reassembled PDU]"
"150","0.030100374","172.16.0.211","10.60.0.1","TCP","1400","80  >  56298 [ACK] Seq=95709 Ack=149 Win=65024 Len=1348 TSval=650694181 TSecr=3642513738 [TCP segment of a reassembled PDU]"
"151","0.030109074","172.16.0.211","10.60.0.1","TCP","1400","80  >  56298 [ACK] Seq=97057 Ack=149 Win=65024 Len=1348 TSval=650694181 TSecr=3642513738 [TCP segment of a reassembled PDU]"
"152","0.030118285","172.16.0.211","10.60.0.1","TCP","1400","80  >  56298 [ACK] Seq=98405 Ack=149 Win=65024 Len=1348 TSval=650694181 TSecr=3642513738 [TCP segment of a reassembled PDU]"
"153","0.030126925","172.16.0.211","10.60.0.1","TCP","1400","80  >  56298 [ACK] Seq=99753 Ack=149 Win=65024 Len=1348 TSval=650694181 TSecr=3642513738 [TCP segment of a reassembled PDU]"
"154","0.030135397","172.16.0.211","10.60.0.1","TCP","1400","80  >  56298 [ACK] Seq=101101 Ack=149 Win=65024 Len=1348 TSval=650694181 TSecr=3642513738 [TCP segment of a reassembled PDU]"
"155","0.030143905","172.16.0.211","10.60.0.1","TCP","1400","80  >  56298 [ACK] Seq=102449 Ack=149 Win=65024 Len=1348 TSval=650694181 TSecr=3642513738 [TCP segment of a reassembled PDU]"
"156","0.030152391","172.16.0.211","10.60.0.1","TCP","1400","80  >  56298 [ACK] Seq=103797 Ack=149 Win=65024 Len=1348 TSval=650694181 TSecr=3642513738 [TCP segment of a reassembled PDU]"
"157","0.030160893","172.16.0.211","10.60.0.1","TCP","1400","80  >  56298 [ACK] Seq=105145 Ack=149 Win=65024 Len=1348 TSval=650694181 TSecr=3642513738 [TCP segment of a reassembled PDU]"
"158","0.030169407","172.16.0.211","10.60.0.1","TCP","1400","80  >  56298 [ACK] Seq=106493 Ack=149 Win=65024 Len=1348 TSval=650694181 TSecr=3642513738 [TCP segment of a reassembled PDU]"
"159","0.030005097","10.60.0.1","172.16.0.211","TCP","52","56298  >  80 [ACK] Seq=149 Ack=78185 Win=66944 Len=0 TSval=3642513740 TSecr=650694179"
"160","0.030005163","10.60.0.1","172.16.0.211","TCP","52","56298  >  80 [ACK] Seq=149 Ack=79533 Win=69632 Len=0 TSval=3642513740 TSecr=650694179"
"161","0.030005189","10.60.0.1","172.16.0.211","TCP","52","56298  >  80 [ACK] Seq=149 Ack=80881 Win=72320 Len=0 TSval=3642513740 TSecr=650694179"
"162","0.030005210","10.60.0.1","172.16.0.211","TCP","52","56298  >  80 [ACK] Seq=149 Ack=82229 Win=75008 Len=0 TSval=3642513740 TSecr=650694179"
"163","0.030005232","10.60.0.1","172.16.0.211","TCP","52","56298  >  80 [ACK] Seq=149 Ack=83577 Win=77696 Len=0 TSval=3642513740 TSecr=650694179"
"164","0.030005253","10.60.0.1","172.16.0.211","TCP","52","56298  >  80 [ACK] Seq=149 Ack=84925 Win=80384 Len=0 TSval=3642513740 TSecr=650694179"
"165","0.030993164","172.16.0.211","10.60.0.1","TCP","1400","80  >  56298 [ACK] Seq=107841 Ack=149 Win=65024 Len=1348 TSval=650694182 TSecr=3642513738 [TCP segment of a reassembled PDU]"
"166","0.032024711","172.16.0.211","10.60.0.1","TCP","1400","80  >  56298 [ACK] Seq=109189 Ack=149 Win=65024 Len=1348 TSval=650694183 TSecr=3642513740 [TCP segment of a reassembled PDU]"
"167","0.032041553","172.16.0.211","10.60.0.1","TCP","1400","80  >  56298 [ACK] Seq=110537 Ack=149 Win=65024 Len=1348 TSval=650694183 TSecr=3642513740 [TCP segment of a reassembled PDU]"
"168","0.032056317","172.16.0.211","10.60.0.1","TCP","1400","80  >  56298 [ACK] Seq=111885 Ack=149 Win=65024 Len=1348 TSval=650694183 TSecr=3642513740 [TCP segment of a reassembled PDU]"
"169","0.032069439","172.16.0.211","10.60.0.1","TCP","1400","80  >  56298 [ACK] Seq=113233 Ack=149 Win=65024 Len=1348 TSval=650694183 TSecr=3642513740 [TCP segment of a reassembled PDU]"
"170","0.032081958","172.16.0.211","10.60.0.1","TCP","1400","80  >  56298 [ACK] Seq=114581 Ack=149 Win=65024 Len=1348 TSval=650694183 TSecr=3642513740 [TCP segment of a reassembled PDU]"
"171","0.032093903","172.16.0.211","10.60.0.1","TCP","1400","80  >  56298 [ACK] Seq=115929 Ack=149 Win=65024 Len=1348 TSval=650694183 TSecr=3642513740 [TCP segment of a reassembled PDU]"
"172","0.033985530","10.60.0.1","172.16.0.211","TCP","52","56298  >  80 [ACK] Seq=149 Ack=86273 Win=83072 Len=0 TSval=3642513744 TSecr=650694181"
"173","0.033985612","10.60.0.1","172.16.0.211","TCP","52","56298  >  80 [ACK] Seq=149 Ack=87621 Win=85760 Len=0 TSval=3642513744 TSecr=650694181"
"174","0.033985659","10.60.0.1","172.16.0.211","TCP","52","56298  >  80 [ACK] Seq=149 Ack=88969 Win=88576 Len=0 TSval=3642513744 TSecr=650694181"
"175","0.033985680","10.60.0.1","172.16.0.211","TCP","52","56298  >  80 [ACK] Seq=149 Ack=90317 Win=91264 Len=0 TSval=3642513744 TSecr=650694181"
"176","0.033985702","10.60.0.1","172.16.0.211","TCP","52","56298  >  80 [ACK] Seq=149 Ack=91665 Win=93952 Len=0 TSval=3642513744 TSecr=650694181"
"177","0.033985723","10.60.0.1","172.16.0.211","TCP","52","56298  >  80 [ACK] Seq=149 Ack=93013 Win=96640 Len=0 TSval=3642513744 TSecr=650694181"
"178","0.033985745","10.60.0.1","172.16.0.211","TCP","52","56298  >  80 [ACK] Seq=149 Ack=94361 Win=99328 Len=0 TSval=3642513744 TSecr=650694181"
"179","0.033985765","10.60.0.1","172.16.0.211","TCP","52","56298  >  80 [ACK] Seq=149 Ack=95709 Win=102016 Len=0 TSval=3642513744 TSecr=650694181"
"180","0.034016732","10.60.0.1","172.16.0.211","TCP","52","56298  >  80 [ACK] Seq=149 Ack=97057 Win=104704 Len=0 TSval=3642513744 TSecr=650694181"
"181","0.034016754","10.60.0.1","172.16.0.211","TCP","52","56298  >  80 [ACK] Seq=149 Ack=98405 Win=107392 Len=0 TSval=3642513744 TSecr=650694181"
"182","0.034016775","10.60.0.1","172.16.0.211","TCP","52","56298  >  80 [ACK] Seq=149 Ack=99753 Win=110080 Len=0 TSval=3642513744 TSecr=650694181"
"183","0.034016805","10.60.0.1","172.16.0.211","TCP","52","56298  >  80 [ACK] Seq=149 Ack=101101 Win=112768 Len=0 TSval=3642513744 TSecr=650694181"
"184","0.034016827","10.60.0.1","172.16.0.211","TCP","52","56298  >  80 [ACK] Seq=149 Ack=102449 Win=115456 Len=0 TSval=3642513744 TSecr=650694181"
"185","0.034016849","10.60.0.1","172.16.0.211","TCP","52","56298  >  80 [ACK] Seq=149 Ack=103797 Win=118144 Len=0 TSval=3642513744 TSecr=650694181"
"186","0.034016870","10.60.0.1","172.16.0.211","TCP","52","56298  >  80 [ACK] Seq=149 Ack=105145 Win=120832 Len=0 TSval=3642513744 TSecr=650694181"
"187","0.034016891","10.60.0.1","172.16.0.211","TCP","52","56298  >  80 [ACK] Seq=149 Ack=106493 Win=123520 Len=0 TSval=3642513744 TSecr=650694181"
"188","0.034035051","10.60.0.1","172.16.0.211","TCP","52","56298  >  80 [ACK] Seq=149 Ack=107841 Win=126208 Len=0 TSval=3642513744 TSecr=650694181"
"189","0.035018240","172.16.0.211","10.60.0.1","TCP","1400","80  >  56298 [ACK] Seq=117277 Ack=149 Win=65024 Len=1348 TSval=650694186 TSecr=3642513744 [TCP segment of a reassembled PDU]"
"190","0.035032820","172.16.0.211","10.60.0.1","TCP","1400","80  >  56298 [ACK] Seq=118625 Ack=149 Win=65024 Len=1348 TSval=650694186 TSecr=3642513744 [TCP segment of a reassembled PDU]"
"191","0.035042245","172.16.0.211","10.60.0.1","TCP","1400","80  >  56298 [ACK] Seq=119973 Ack=149 Win=65024 Len=1348 TSval=650694186 TSecr=3642513744 [TCP segment of a reassembled PDU]"
"192","0.035050926","172.16.0.211","10.60.0.1","TCP","1400","80  >  56298 [ACK] Seq=121321 Ack=149 Win=65024 Len=1348 TSval=650694186 TSecr=3642513744 [TCP segment of a reassembled PDU]"
"193","0.035059550","172.16.0.211","10.60.0.1","TCP","1400","80  >  56298 [ACK] Seq=122669 Ack=149 Win=65024 Len=1348 TSval=650694186 TSecr=3642513744 [TCP segment of a reassembled PDU]"
"194","0.035068160","172.16.0.211","10.60.0.1","TCP","1400","80  >  56298 [ACK] Seq=124017 Ack=149 Win=65024 Len=1348 TSval=650694186 TSecr=3642513744 [TCP segment of a reassembled PDU]"
"195","0.035078889","172.16.0.211","10.60.0.1","TCP","1400","80  >  56298 [ACK] Seq=125365 Ack=149 Win=65024 Len=1348 TSval=650694186 TSecr=3642513744 [TCP segment of a reassembled PDU]"
"196","0.035090867","172.16.0.211","10.60.0.1","TCP","1400","80  >  56298 [ACK] Seq=126713 Ack=149 Win=65024 Len=1348 TSval=650694186 TSecr=3642513744 [TCP segment of a reassembled PDU]"
"197","0.035102728","172.16.0.211","10.60.0.1","TCP","1400","80  >  56298 [ACK] Seq=128061 Ack=149 Win=65024 Len=1348 TSval=650694186 TSecr=3642513744 [TCP segment of a reassembled PDU]"
"198","0.035115214","172.16.0.211","10.60.0.1","TCP","1400","80  >  56298 [ACK] Seq=129409 Ack=149 Win=65024 Len=1348 TSval=650694186 TSecr=3642513744 [TCP segment of a reassembled PDU]"
"199","0.035127171","172.16.0.211","10.60.0.1","TCP","1400","80  >  56298 [ACK] Seq=130757 Ack=149 Win=65024 Len=1348 TSval=650694186 TSecr=3642513744 [TCP segment of a reassembled PDU]"
"200","0.035001510","10.60.0.1","172.16.0.211","TCP","52","56298  >  80 [ACK] Seq=149 Ack=109189 Win=128896 Len=0 TSval=3642513746 TSecr=650694182"
"201","0.035001645","10.60.0.1","172.16.0.211","TCP","52","56298  >  80 [ACK] Seq=149 Ack=110537 Win=131712 Len=0 TSval=3642513746 TSecr=650694183"
"202","0.036002404","172.16.0.211","10.60.0.1","TCP","1400","80  >  56298 [ACK] Seq=132105 Ack=149 Win=65024 Len=1348 TSval=650694187 TSecr=3642513744 [TCP segment of a reassembled PDU]"
"203","0.036033033","172.16.0.211","10.60.0.1","TCP","1400","80  >  56298 [ACK] Seq=133453 Ack=149 Win=65024 Len=1348 TSval=650694187 TSecr=3642513744 [TCP segment of a reassembled PDU]"
"204","0.036043270","172.16.0.211","10.60.0.1","TCP","1400","80  >  56298 [ACK] Seq=134801 Ack=149 Win=65024 Len=1348 TSval=650694187 TSecr=3642513744 [TCP segment of a reassembled PDU]"
"205","0.036051991","172.16.0.211","10.60.0.1","TCP","1400","80  >  56298 [ACK] Seq=136149 Ack=149 Win=65024 Len=1348 TSval=650694187 TSecr=3642513744 [TCP segment of a reassembled PDU]"
"206","0.036060656","172.16.0.211","10.60.0.1","TCP","1400","80  >  56298 [ACK] Seq=137497 Ack=149 Win=65024 Len=1348 TSval=650694187 TSecr=3642513744 [TCP segment of a reassembled PDU]"
"207","0.037027838","172.16.0.211","10.60.0.1","TCP","1400","80  >  56298 [ACK] Seq=138845 Ack=149 Win=65024 Len=1348 TSval=650694188 TSecr=3642513746 [TCP segment of a reassembled PDU]"
"208","0.037041367","172.16.0.211","10.60.0.1","TCP","1400","80  >  56298 [ACK] Seq=140193 Ack=149 Win=65024 Len=1348 TSval=650694188 TSecr=3642513746 [TCP segment of a reassembled PDU]"
"209","0.037053165","172.16.0.211","10.60.0.1","TCP","1400","80  >  56298 [ACK] Seq=141541 Ack=149 Win=65024 Len=1348 TSval=650694188 TSecr=3642513746 [TCP segment of a reassembled PDU]"
"210","0.036997764","10.60.0.1","172.16.0.211","TCP","52","56298  >  80 [ACK] Seq=149 Ack=111885 Win=134400 Len=0 TSval=3642513746 TSecr=650694183"
"211","0.036997842","10.60.0.1","172.16.0.211","TCP","52","56298  >  80 [ACK] Seq=149 Ack=113233 Win=137088 Len=0 TSval=3642513747 TSecr=650694183"
"212","0.036997876","10.60.0.1","172.16.0.211","TCP","52","56298  >  80 [ACK] Seq=149 Ack=114581 Win=139776 Len=0 TSval=3642513747 TSecr=650694183"
"213","0.036997898","10.60.0.1","172.16.0.211","TCP","52","56298  >  80 [ACK] Seq=149 Ack=115929 Win=142464 Len=0 TSval=3642513747 TSecr=650694183"
"214","0.036997920","10.60.0.1","172.16.0.211","TCP","52","56298  >  80 [ACK] Seq=149 Ack=117277 Win=145152 Len=0 TSval=3642513747 TSecr=650694183"
"215","0.038056726","172.16.0.211","10.60.0.1","TCP","1400","80  >  56298 [ACK] Seq=142889 Ack=149 Win=65024 Len=1348 TSval=650694189 TSecr=3642513747 [TCP segment of a reassembled PDU]"
"216","0.038075904","172.16.0.211","10.60.0.1","TCP","1400","80  >  56298 [ACK] Seq=144237 Ack=149 Win=65024 Len=1348 TSval=650694189 TSecr=3642513747 [TCP segment of a reassembled PDU]"
"217","0.038091255","172.16.0.211","10.60.0.1","TCP","1400","80  >  56298 [ACK] Seq=145585 Ack=149 Win=65024 Len=1348 TSval=650694189 TSecr=3642513747 [TCP segment of a reassembled PDU]"
"218","0.038105428","172.16.0.211","10.60.0.1","TCP","1400","80  >  56298 [ACK] Seq=146933 Ack=149 Win=65024 Len=1348 TSval=650694189 TSecr=3642513747 [TCP segment of a reassembled PDU]"
"219","0.038119662","172.16.0.211","10.60.0.1","TCP","1400","80  >  56298 [ACK] Seq=148281 Ack=149 Win=65024 Len=1348 TSval=650694189 TSecr=3642513747 [TCP segment of a reassembled PDU]"
"220","0.038035979","10.60.0.1","172.16.0.211","TCP","52","56298  >  80 [ACK] Seq=149 Ack=118625 Win=147840 Len=0 TSval=3642513748 TSecr=650694186"
"221","0.038036152","10.60.0.1","172.16.0.211","TCP","52","56298  >  80 [ACK] Seq=149 Ack=119973 Win=150528 Len=0 TSval=3642513748 TSecr=650694186"
"222","0.038036193","10.60.0.1","172.16.0.211","TCP","52","56298  >  80 [ACK] Seq=149 Ack=121321 Win=153216 Len=0 TSval=3642513748 TSecr=650694186"
"223","0.038036225","10.60.0.1","172.16.0.211","TCP","52","56298  >  80 [ACK] Seq=149 Ack=122669 Win=155904 Len=0 TSval=3642513748 TSecr=650694186"
"224","0.038036259","10.60.0.1","172.16.0.211","TCP","52","56298  >  80 [ACK] Seq=149 Ack=124017 Win=158592 Len=0 TSval=3642513748 TSecr=650694186"
"225","0.039004012","10.60.0.1","172.16.0.211","TCP","52","56298  >  80 [ACK] Seq=149 Ack=125365 Win=161280 Len=0 TSval=3642513748 TSecr=650694186"
"226","0.039004097","10.60.0.1","172.16.0.211","TCP","52","56298  >  80 [ACK] Seq=149 Ack=126713 Win=163968 Len=0 TSval=3642513748 TSecr=650694186"
"227","0.039004136","10.60.0.1","172.16.0.211","TCP","52","56298  >  80 [ACK] Seq=149 Ack=128061 Win=166656 Len=0 TSval=3642513748 TSecr=650694186"
"228","0.039004158","10.60.0.1","172.16.0.211","TCP","52","56298  >  80 [ACK] Seq=149 Ack=129409 Win=169344 Len=0 TSval=3642513748 TSecr=650694186"
"229","0.039004180","10.60.0.1","172.16.0.211","TCP","52","56298  >  80 [ACK] Seq=149 Ack=130757 Win=172032 Len=0 TSval=3642513748 TSecr=650694186"
"230","0.039004201","10.60.0.1","172.16.0.211","TCP","52","56298  >  80 [ACK] Seq=149 Ack=132105 Win=174848 Len=0 TSval=3642513748 TSecr=650694186"
"231","0.040034861","172.16.0.211","10.60.0.1","TCP","1400","80  >  56298 [ACK] Seq=149629 Ack=149 Win=65024 Len=1348 TSval=650694191 TSecr=3642513748 [TCP segment of a reassembled PDU]"
"232","0.040053163","172.16.0.211","10.60.0.1","MP4","428",""
"233","0.040000993","10.60.0.1","172.16.0.211","TCP","52","56298  >  80 [ACK] Seq=149 Ack=133453 Win=177536 Len=0 TSval=3642513750 TSecr=650694187"
"234","0.040001121","10.60.0.1","172.16.0.211","TCP","52","56298  >  80 [ACK] Seq=149 Ack=134801 Win=180224 Len=0 TSval=3642513750 TSecr=650694187"
"235","0.040001173","10.60.0.1","172.16.0.211","TCP","52","56298  >  80 [ACK] Seq=149 Ack=136149 Win=182912 Len=0 TSval=3642513750 TSecr=650694187"
