"No.","Time","Source","Destination","Protocol","Length","Info"
"1","0.000000000","10.60.0.1","172.16.0.212","TCP","60","54796  >  8000 [SYN] Seq=0 Win=65280 Len=0 MSS=1360 SACK_PERM=1 TSval=11592716 TSecr=0 WS=128"
"2","0.001010198","172.16.0.212","10.60.0.1","TCP","60","8000  >  54796 [SYN, ACK] Seq=0 Ack=1 Win=65160 Len=0 MSS=1460 SACK_PERM=1 TSval=2014173744 TSecr=11592716 WS=128"
"3","0.002983435","10.60.0.1","172.16.0.212","TCP","52","54796  >  8000 [ACK] Seq=1 Ack=1 Win=65280 Len=0 TSval=11592719 TSecr=2014173744"
"4","0.002983562","10.60.0.1","172.16.0.212","HTTP","190","GET /guide/ HTTP/1.1 "
"5","0.003989605","172.16.0.212","10.60.0.1","TCP","52","8000  >  54796 [ACK] Seq=1 Ack=139 Win=65024 Len=0 TSval=2014173747 TSecr=11592719"
"6","0.007098381","172.16.0.212","10.60.0.1","TCP","69","8000  >  54796 [PSH, ACK] Seq=1 Ack=139 Win=65024 Len=17 TSval=2014173751 TSecr=11592719 [TCP segment of a reassembled PDU]"
"7","0.008113072","172.16.0.212","10.60.0.1","TCP","1400","8000  >  54796 [ACK] Seq=18 Ack=139 Win=65024 Len=1348 TSval=2014173751 TSecr=11592719 [TCP segment of a reassembled PDU]"
"8","0.008134996","172.16.0.212","10.60.0.1","TCP","1400","8000  >  54796 [ACK] Seq=1366 Ack=139 Win=65024 Len=1348 TSval=2014173751 TSecr=11592719 [TCP segment of a reassembled PDU]"
"9","0.008149948","172.16.0.212","10.60.0.1","TCP","1400","8000  >  54796 [ACK] Seq=2714 Ack=139 Win=65024 Len=1348 TSval=2014173751 TSecr=11592719 [TCP segment of a reassembled PDU]"
"10","0.008162187","172.16.0.212","10.60.0.1","TCP","1400","8000  >  54796 [ACK] Seq=4062 Ack=139 Win=65024 Len=1348 TSval=2014173751 TSecr=11592719 [TCP segment of a reassembled PDU]"
"11","0.008173358","172.16.0.212","10.60.0.1","TCP","1400","8000  >  54796 [ACK] Seq=5410 Ack=139 Win=65024 Len=1348 TSval=2014173751 TSecr=11592719 [TCP segment of a reassembled PDU]"
"12","0.008185000","172.16.0.212","10.60.0.1","TCP","1400","8000  >  54796 [ACK] Seq=6758 Ack=139 Win=65024 Len=1348 TSval=2014173751 TSecr=11592719 [TCP segment of a reassembled PDU]"
"13","0.009125677","172.16.0.212","10.60.0.1","TCP","1400","8000  >  54796 [ACK] Seq=8106 Ack=139 Win=65024 Len=1348 TSval=2014173752 TSecr=11592719 [TCP segment of a reassembled PDU]"
"14","0.009143824","172.16.0.212","10.60.0.1","TCP","1400","8000  >  54796 [ACK] Seq=9454 Ack=139 Win=65024 Len=1348 TSval=2014173752 TSecr=11592719 [TCP segment of a reassembled PDU]"
"15","0.009156965","172.16.0.212","10.60.0.1","TCP","1400","8000  >  54796 [ACK] Seq=10802 Ack=139 Win=65024 Len=1348 TSval=2014173752 TSecr=11592719 [TCP segment of a reassembled PDU]"
"16","0.009105952","10.60.0.1","172.16.0.212","TCP","52","54796  >  8000 [ACK] Seq=139 Ack=18 Win=65280 Len=0 TSval=11592725 TSecr=2014173751"
"17","0.010083627","10.60.0.1","172.16.0.212","TCP","52","54796  >  8000 [ACK] Seq=139 Ack=1366 Win=64256 Len=0 TSval=11592726 TSecr=2014173751"
"18","0.010083712","10.60.0.1","172.16.0.212","TCP","52","54796  >  8000 [ACK] Seq=139 Ack=2714 Win=63232 Len=0 TSval=11592726 TSecr=2014173751"
"19","0.010083734","10.60.0.1","172.16.0.212","TCP","52","54796  >  8000 [ACK] Seq=139 Ack=4062 Win=64256 Len=0 TSval=11592727 TSecr=2014173751"
"20","0.010083761","10.60.0.1","172.16.0.212","TCP","52","54796  >  8000 [ACK] Seq=139 Ack=5410 Win=64256 Len=0 TSval=11592727 TSecr=2014173751"
"21","0.011092405","172.16.0.212","10.60.0.1","TCP","1400","8000  >  54796 [ACK] Seq=12150 Ack=139 Win=65024 Len=1348 TSval=2014173754 TSecr=11592725 [TCP segment of a reassembled PDU]"
"22","0.011106659","172.16.0.212","10.60.0.1","TCP","1400","8000  >  54796 [ACK] Seq=13498 Ack=139 Win=65024 Len=1348 TSval=2014173754 TSecr=11592725 [TCP segment of a reassembled PDU]"
"23","0.011081186","10.60.0.1","172.16.0.212","TCP","52","54796  >  8000 [ACK] Seq=139 Ack=6758 Win=64256 Len=0 TSval=11592727 TSecr=2014173751"
"24","0.011081250","10.60.0.1","172.16.0.212","TCP","52","54796  >  8000 [ACK] Seq=139 Ack=8106 Win=64256 Len=0 TSval=11592727 TSecr=2014173751"
"25","0.011081276","10.60.0.1","172.16.0.212","TCP","52","54796  >  8000 [ACK] Seq=139 Ack=9454 Win=64256 Len=0 TSval=11592728 TSecr=2014173752"
"26","0.012094651","172.16.0.212","10.60.0.1","TCP","1400","8000  >  54796 [ACK] Seq=14846 Ack=139 Win=65024 Len=1348 TSval=2014173755 TSecr=11592727 [TCP segment of a reassembled PDU]"
"27","0.012106309","172.16.0.212","10.60.0.1","TCP","1400","8000  >  54796 [ACK] Seq=16194 Ack=139 Win=65024 Len=1348 TSval=2014173755 TSecr=11592727 [TCP segment of a reassembled PDU]"
"28","0.012115321","172.16.0.212","10.60.0.1","TCP","1400","8000  >  54796 [ACK] Seq=17542 Ack=139 Win=65024 Len=1348 TSval=2014173755 TSecr=11592727 [TCP segment of a reassembled PDU]"
"29","0.012123642","172.16.0.212","10.60.0.1","TCP","1400","8000  >  54796 [ACK] Seq=18890 Ack=139 Win=65024 Len=1348 TSval=2014173755 TSecr=11592727 [TCP segment of a reassembled PDU]"
"30","0.012132179","172.16.0.212","10.60.0.1","TCP","1400","8000  >  54796 [ACK] Seq=20238 Ack=139 Win=65024 Len=1348 TSval=2014173755 TSecr=11592727 [TCP segment of a reassembled PDU]"
"31","0.012140514","172.16.0.212","10.60.0.1","TCP","1400","8000  >  54796 [ACK] Seq=21586 Ack=139 Win=65024 Len=1348 TSval=2014173755 TSecr=11592727 [TCP segment of a reassembled PDU]"
"32","0.012084272","10.60.0.1","172.16.0.212","TCP","52","54796  >  8000 [ACK] Seq=139 Ack=10802 Win=64256 Len=0 TSval=11592728 TSecr=2014173752"
"33","0.012084340","10.60.0.1","172.16.0.212","TCP","52","54796  >  8000 [ACK] Seq=139 Ack=12150 Win=64256 Len=0 TSval=11592728 TSecr=2014173752"
"34","0.012084366","10.60.0.1","172.16.0.212","TCP","52","54796  >  8000 [ACK] Seq=139 Ack=13498 Win=64256 Len=0 TSval=11592729 TSecr=2014173754"
"35","0.012084392","10.60.0.1","172.16.0.212","TCP","52","54796  >  8000 [ACK] Seq=139 Ack=14846 Win=64256 Len=0 TSval=11592729 TSecr=2014173754"
"36","0.013091491","172.16.0.212","10.60.0.1","TCP","1400","8000  >  54796 [ACK] Seq=22934 Ack=139 Win=65024 Len=1348 TSval=2014173756 TSecr=11592727 [TCP segment of a reassembled PDU]"
"37","0.013102091","172.16.0.212","10.60.0.1","TCP","1400","8000  >  54796 [ACK] Seq=24282 Ack=139 Win=65024 Len=1348 TSval=2014173756 TSecr=11592727 [TCP segment of a reassembled PDU]"
"38","0.013110039","172.16.0.212","10.60.0.1","TCP","1400","8000  >  54796 [ACK] Seq=25630 Ack=139 Win=65024 Len=1348 TSval=2014173756 TSecr=11592727 [TCP segment of a reassembled PDU]"
"39","0.013118601","172.16.0.212","10.60.0.1","HTTP","581","HTTP/1.0 200 OK  (text/html)"
"40","0.013085411","10.60.0.1","172.16.0.212","TCP","52","54796  >  8000 [ACK] Seq=139 Ack=16194 Win=64256 Len=0 TSval=11592730 TSecr=2014173755"
"41","0.014074207","10.60.0.1","172.16.0.212","TCP","52","54796  >  8000 [ACK] Seq=139 Ack=17542 Win=64256 Len=0 TSval=11592730 TSecr=2014173755"
"42","0.014074257","10.60.0.1","172.16.0.212","TCP","52","54796  >  8000 [ACK] Seq=139 Ack=18890 Win=64256 Len=0 TSval=11592730 TSecr=2014173755"
"43","0.015072732","10.60.0.1","172.16.0.212","TCP","52","54796  >  8000 [ACK] Seq=139 Ack=20238 Win=64256 Len=0 TSval=11592731 TSecr=2014173755"
"44","0.015072785","10.60.0.1","172.16.0.212","TCP","52","54796  >  8000 [ACK] Seq=139 Ack=22934 Win=64256 Len=0 TSval=11592731 TSecr=2014173755"
"45","0.015072812","10.60.0.1","172.16.0.212","TCP","52","54796  >  8000 [ACK] Seq=139 Ack=25630 Win=64256 Len=0 TSval=11592732 TSecr=2014173756"
"46","0.016079907","10.60.0.1","172.16.0.212","TCP","52","54796  >  8000 [ACK] Seq=139 Ack=27507 Win=64256 Len=0 TSval=11592732 TSecr=2014173756"
"47","0.016079979","10.60.0.1","172.16.0.212","HTTP","199","GET /guide/features/ HTTP/1.1 "
"48","0.018098809","172.16.0.212","10.60.0.1","TCP","40","8000  >  54796 [RST] Seq=27507 Win=0 Len=0"
"49","1.019641794","10.60.0.1","172.16.0.212","TCP","60","54802  >  8000 [SYN] Seq=0 Win=65280 Len=0 MSS=1360 SACK_PERM=1 TSval=11593736 TSecr=0 WS=128"
"50","1.020653323","172.16.0.212","10.60.0.1","TCP","60","8000  >  54802 [SYN, ACK] Seq=0 Ack=1 Win=65160 Len=0 MSS=1460 SACK_PERM=1 TSval=2014174764 TSecr=11593736 WS=128"
"51","1.022654502","10.60.0.1","172.16.0.212","TCP","52","54802  >  8000 [ACK] Seq=1 Ack=1 Win=65280 Len=0 TSval=11593739 TSecr=2014174764"
"52","1.022654683","10.60.0.1","172.16.0.212","HTTP","199","GET /guide/features/ HTTP/1.1 "
"53","1.023676205","172.16.0.212","10.60.0.1","TCP","52","8000  >  54802 [ACK] Seq=1 Ack=148 Win=65024 Len=0 TSval=2014174767 TSecr=11593739"
"54","1.024673589","172.16.0.212","10.60.0.1","TCP","69","8000  >  54802 [PSH, ACK] Seq=1 Ack=148 Win=65024 Len=17 TSval=2014174768 TSecr=11593739 [TCP segment of a reassembled PDU]"
"55","1.024702057","172.16.0.212","10.60.0.1","TCP","1400","8000  >  54802 [ACK] Seq=18 Ack=148 Win=65024 Len=1348 TSval=2014174768 TSecr=11593739 [TCP segment of a reassembled PDU]"
"56","1.024716645","172.16.0.212","10.60.0.1","TCP","1400","8000  >  54802 [ACK] Seq=1366 Ack=148 Win=65024 Len=1348 TSval=2014174768 TSecr=11593739 [TCP segment of a reassembled PDU]"
"57","1.024727697","172.16.0.212","10.60.0.1","TCP","1400","8000  >  54802 [ACK] Seq=2714 Ack=148 Win=65024 Len=1348 TSval=2014174768 TSecr=11593739 [TCP segment of a reassembled PDU]"
"58","1.024736963","172.16.0.212","10.60.0.1","TCP","1400","8000  >  54802 [ACK] Seq=4062 Ack=148 Win=65024 Len=1348 TSval=2014174768 TSecr=11593739 [TCP segment of a reassembled PDU]"
"59","1.024745854","172.16.0.212","10.60.0.1","TCP","1400","8000  >  54802 [ACK] Seq=5410 Ack=148 Win=65024 Len=1348 TSval=2014174768 TSecr=11593739 [TCP segment of a reassembled PDU]"
"60","1.025674603","172.16.0.212","10.60.0.1","TCP","1400","8000  >  54802 [ACK] Seq=6758 Ack=148 Win=65024 Len=1348 TSval=2014174769 TSecr=11593739 [TCP segment of a reassembled PDU]"
"61","1.025693975","172.16.0.212","10.60.0.1","TCP","1400","8000  >  54802 [ACK] Seq=8106 Ack=148 Win=65024 Len=1348 TSval=2014174769 TSecr=11593739 [TCP segment of a reassembled PDU]"
"62","1.025707251","172.16.0.212","10.60.0.1","TCP","1400","8000  >  54802 [ACK] Seq=9454 Ack=148 Win=65024 Len=1348 TSval=2014174769 TSecr=11593739 [TCP segment of a reassembled PDU]"
"63","1.025720381","172.16.0.212","10.60.0.1","TCP","1400","8000  >  54802 [ACK] Seq=10802 Ack=148 Win=65024 Len=1348 TSval=2014174769 TSecr=11593739 [TCP segment of a reassembled PDU]"
"64","1.026637926","10.60.0.1","172.16.0.212","TCP","52","54802  >  8000 [ACK] Seq=148 Ack=18 Win=65280 Len=0 TSval=11593743 TSecr=2014174768"
"65","1.026638009","10.60.0.1","172.16.0.212","TCP","52","54802  >  8000 [ACK] Seq=148 Ack=1366 Win=64000 Len=0 TSval=11593743 TSecr=2014174768"
"66","1.026638034","10.60.0.1","172.16.0.212","TCP","52","54802  >  8000 [ACK] Seq=148 Ack=2714 Win=62848 Len=0 TSval=11593743 TSecr=2014174768"
"67","1.027660858","172.16.0.212","10.60.0.1","TCP","1400","8000  >  54802 [ACK] Seq=12150 Ack=148 Win=65024 Len=1348 TSval=2014174771 TSecr=11593743 [TCP segment of a reassembled PDU]"
"68","1.027674439","172.16.0.212","10.60.0.1","TCP","1400","8000  >  54802 [ACK] Seq=13498 Ack=148 Win=65024 Len=1348 TSval=2014174771 TSecr=11593743 [TCP segment of a reassembled PDU]"
"69","1.027644772","10.60.0.1","172.16.0.212","TCP","52","54802  >  8000 [ACK] Seq=148 Ack=4062 Win=61696 Len=0 TSval=11593743 TSecr=2014174768"
"70","1.027644832","10.60.0.1","172.16.0.212","TCP","52","54802  >  8000 [ACK] Seq=148 Ack=5410 Win=60544 Len=0 TSval=11593743 TSecr=2014174768"
"71","1.027644857","10.60.0.1","172.16.0.212","TCP","52","54802  >  8000 [ACK] Seq=148 Ack=6758 Win=59776 Len=0 TSval=11593744 TSecr=2014174768"
"72","1.027644878","10.60.0.1","172.16.0.212","TCP","52","54802  >  8000 [ACK] Seq=148 Ack=8106 Win=58624 Len=0 TSval=11593744 TSecr=2014174769"
"73","1.027644900","10.60.0.1","172.16.0.212","TCP","52","54802  >  8000 [ACK] Seq=148 Ack=9454 Win=57472 Len=0 TSval=11593744 TSecr=2014174769"
"74","1.027644921","10.60.0.1","172.16.0.212","TCP","52","54802  >  8000 [ACK] Seq=148 Ack=10802 Win=56320 Len=0 TSval=11593744 TSecr=2014174769"
"75","1.027644943","10.60.0.1","172.16.0.212","TCP","52","54802  >  8000 [ACK] Seq=148 Ack=12150 Win=55168 Len=0 TSval=11593745 TSecr=2014174769"
"76","1.028668658","172.16.0.212","10.60.0.1","TCP","1400","8000  >  54802 [ACK] Seq=14846 Ack=148 Win=65024 Len=1348 TSval=2014174772 TSecr=11593743 [TCP segment of a reassembled PDU]"
"77","1.028686507","172.16.0.212","10.60.0.1","TCP","1400","8000  >  54802 [ACK] Seq=16194 Ack=148 Win=65024 Len=1348 TSval=2014174772 TSecr=11593743 [TCP segment of a reassembled PDU]"
"78","1.028699787","172.16.0.212","10.60.0.1","TCP","1400","8000  >  54802 [ACK] Seq=17542 Ack=148 Win=65024 Len=1348 TSval=2014174772 TSecr=11593743 [TCP segment of a reassembled PDU]"
"79","1.028711885","172.16.0.212","10.60.0.1","TCP","1400","8000  >  54802 [ACK] Seq=18890 Ack=148 Win=65024 Len=1348 TSval=2014174772 TSecr=11593743 [TCP segment of a reassembled PDU]"
"80","1.028722662","172.16.0.212","10.60.0.1","TCP","1400","8000  >  54802 [ACK] Seq=20238 Ack=148 Win=65024 Len=1348 TSval=2014174772 TSecr=11593743 [TCP segment of a reassembled PDU]"
"81","1.028731755","172.16.0.212","10.60.0.1","TCP","1400","8000  >  54802 [ACK] Seq=21586 Ack=148 Win=65024 Len=1348 TSval=2014174772 TSecr=11593743 [TCP segment of a reassembled PDU]"
"82","1.028744521","172.16.0.212","10.60.0.1","TCP","1400","8000  >  54802 [ACK] Seq=22934 Ack=148 Win=65024 Len=1348 TSval=2014174772 TSecr=11593744 [TCP segment of a reassembled PDU]"
"83","1.028753472","172.16.0.212","10.60.0.1","TCP","1400","8000  >  54802 [ACK] Seq=24282 Ack=148 Win=65024 Len=1348 TSval=2014174772 TSecr=11593744 [TCP segment of a reassembled PDU]"
"84","1.028762014","172.16.0.212","10.60.0.1","TCP","1400","8000  >  54802 [ACK] Seq=25630 Ack=148 Win=65024 Len=1348 TSval=2014174772 TSecr=11593744 [TCP segment of a reassembled PDU]"
"85","1.028770620","172.16.0.212","10.60.0.1","HTTP","93","HTTP/1.0 200 OK  (text/html)"
"86","1.029632085","10.60.0.1","172.16.0.212","TCP","52","54802  >  8000 [ACK] Seq=148 Ack=13498 Win=64256 Len=0 TSval=11593746 TSecr=2014174771"
"87","1.029632135","10.60.0.1","172.16.0.212","TCP","52","54802  >  8000 [ACK] Seq=148 Ack=14846 Win=63232 Len=0 TSval=11593746 TSecr=2014174771"
"88","1.030641746","10.60.0.1","172.16.0.212","TCP","52","54802  >  8000 [ACK] Seq=148 Ack=16194 Win=64256 Len=0 TSval=11593747 TSecr=2014174772"
"89","1.030641823","10.60.0.1","172.16.0.212","TCP","52","54802  >  8000 [ACK] Seq=148 Ack=17542 Win=63232 Len=0 TSval=11593747 TSecr=2014174772"
"90","1.030641844","10.60.0.1","172.16.0.212","TCP","52","54802  >  8000 [ACK] Seq=148 Ack=18890 Win=64256 Len=0 TSval=11593747 TSecr=2014174772"
"91","1.030641872","10.60.0.1","172.16.0.212","TCP","52","54802  >  8000 [ACK] Seq=148 Ack=20238 Win=63232 Len=0 TSval=11593747 TSecr=2014174772"
"92","1.030641893","10.60.0.1","172.16.0.212","TCP","52","54802  >  8000 [ACK] Seq=148 Ack=22934 Win=64256 Len=0 TSval=11593748 TSecr=2014174772"
"93","1.031632995","10.60.0.1","172.16.0.212","TCP","52","54802  >  8000 [ACK] Seq=148 Ack=25630 Win=64256 Len=0 TSval=11593748 TSecr=2014174772"
"94","1.031633064","10.60.0.1","172.16.0.212","TCP","52","54802  >  8000 [ACK] Seq=148 Ack=27019 Win=64256 Len=0 TSval=11593748 TSecr=2014174772"
"95","1.032645704","10.60.0.1","172.16.0.212","HTTP","201","GET /guide/SMF-Config/ HTTP/1.1 "
"96","1.033637499","172.16.0.212","10.60.0.1","TCP","40","8000  >  54802 [RST] Seq=27019 Win=0 Len=0"
"97","2.035690680","10.60.0.1","172.16.0.212","TCP","60","54810  >  8000 [SYN] Seq=0 Win=65280 Len=0 MSS=1360 SACK_PERM=1 TSval=11594753 TSecr=0 WS=128"
"98","2.036713657","172.16.0.212","10.60.0.1","TCP","60","8000  >  54810 [SYN, ACK] Seq=0 Ack=1 Win=65160 Len=0 MSS=1460 SACK_PERM=1 TSval=2014175780 TSecr=11594753 WS=128"
"99","2.038687041","10.60.0.1","172.16.0.212","TCP","52","54810  >  8000 [ACK] Seq=1 Ack=1 Win=65280 Len=0 TSval=11594756 TSecr=2014175780"
"100","2.038687262","10.60.0.1","172.16.0.212","HTTP","201","GET /guide/SMF-Config/ HTTP/1.1 "
"101","2.039701332","172.16.0.212","10.60.0.1","TCP","52","8000  >  54810 [ACK] Seq=1 Ack=150 Win=65024 Len=0 TSval=2014175783 TSecr=11594756"
"102","2.040700004","172.16.0.212","10.60.0.1","TCP","69","8000  >  54810 [PSH, ACK] Seq=1 Ack=150 Win=65024 Len=17 TSval=2014175784 TSecr=11594756 [TCP segment of a reassembled PDU]"
"103","2.040721400","172.16.0.212","10.60.0.1","TCP","1400","8000  >  54810 [ACK] Seq=18 Ack=150 Win=65024 Len=1348 TSval=2014175784 TSecr=11594756 [TCP segment of a reassembled PDU]"
"104","2.040731355","172.16.0.212","10.60.0.1","TCP","1400","8000  >  54810 [ACK] Seq=1366 Ack=150 Win=65024 Len=1348 TSval=2014175784 TSecr=11594756 [TCP segment of a reassembled PDU]"
"105","2.040740277","172.16.0.212","10.60.0.1","TCP","1400","8000  >  54810 [ACK] Seq=2714 Ack=150 Win=65024 Len=1348 TSval=2014175784 TSecr=11594756 [TCP segment of a reassembled PDU]"
"106","2.040750710","172.16.0.212","10.60.0.1","TCP","1400","8000  >  54810 [ACK] Seq=4062 Ack=150 Win=65024 Len=1348 TSval=2014175784 TSecr=11594756 [TCP segment of a reassembled PDU]"
"107","2.040763862","172.16.0.212","10.60.0.1","TCP","1400","8000  >  54810 [ACK] Seq=5410 Ack=150 Win=65024 Len=1348 TSval=2014175784 TSecr=11594756 [TCP segment of a reassembled PDU]"
"108","2.040777643","172.16.0.212","10.60.0.1","TCP","1400","8000  >  54810 [ACK] Seq=6758 Ack=150 Win=65024 Len=1348 TSval=2014175784 TSecr=11594756 [TCP segment of a reassembled PDU]"
"109","2.041695043","172.16.0.212","10.60.0.1","TCP","1400","8000  >  54810 [ACK] Seq=8106 Ack=150 Win=65024 Len=1348 TSval=2014175785 TSecr=11594756 [TCP segment of a reassembled PDU]"
"110","2.041709479","172.16.0.212","10.60.0.1","TCP","1400","8000  >  54810 [ACK] Seq=9454 Ack=150 Win=65024 Len=1348 TSval=2014175785 TSecr=11594756 [TCP segment of a reassembled PDU]"
"111","2.041722925","172.16.0.212","10.60.0.1","TCP","1400","8000  >  54810 [ACK] Seq=10802 Ack=150 Win=65024 Len=1348 TSval=2014175785 TSecr=11594756 [TCP segment of a reassembled PDU]"
"112","2.042683562","10.60.0.1","172.16.0.212","TCP","52","54810  >  8000 [ACK] Seq=150 Ack=18 Win=65280 Len=0 TSval=11594760 TSecr=2014175784"
"113","2.042683641","10.60.0.1","172.16.0.212","TCP","52","54810  >  8000 [ACK] Seq=150 Ack=1366 Win=64000 Len=0 TSval=11594760 TSecr=2014175784"
"114","2.042683671","10.60.0.1","172.16.0.212","TCP","52","54810  >  8000 [ACK] Seq=150 Ack=2714 Win=62848 Len=0 TSval=11594760 TSecr=2014175784"
"115","2.042683693","10.60.0.1","172.16.0.212","TCP","52","54810  >  8000 [ACK] Seq=150 Ack=4062 Win=61696 Len=0 TSval=11594760 TSecr=2014175784"
"116","2.042683718","10.60.0.1","172.16.0.212","TCP","52","54810  >  8000 [ACK] Seq=150 Ack=5410 Win=60416 Len=0 TSval=11594760 TSecr=2014175784"
"117","2.043717316","172.16.0.212","10.60.0.1","TCP","1400","8000  >  54810 [ACK] Seq=12150 Ack=150 Win=65024 Len=1348 TSval=2014175787 TSecr=11594760 [TCP segment of a reassembled PDU]"
"118","2.043731793","172.16.0.212","10.60.0.1","TCP","1400","8000  >  54810 [ACK] Seq=13498 Ack=150 Win=65024 Len=1348 TSval=2014175787 TSecr=11594760 [TCP segment of a reassembled PDU]"
"119","2.043740000","172.16.0.212","10.60.0.1","TCP","1400","8000  >  54810 [ACK] Seq=14846 Ack=150 Win=65024 Len=1348 TSval=2014175787 TSecr=11594760 [TCP segment of a reassembled PDU]"
"120","2.043748437","172.16.0.212","10.60.0.1","TCP","1400","8000  >  54810 [ACK] Seq=16194 Ack=150 Win=65024 Len=1348 TSval=2014175787 TSecr=11594760 [TCP segment of a reassembled PDU]"
"121","2.043760536","172.16.0.212","10.60.0.1","TCP","1400","8000  >  54810 [ACK] Seq=17542 Ack=150 Win=65024 Len=1348 TSval=2014175787 TSecr=11594760 [TCP segment of a reassembled PDU]"
"122","2.043772217","172.16.0.212","10.60.0.1","TCP","1400","8000  >  54810 [ACK] Seq=18890 Ack=150 Win=65024 Len=1348 TSval=2014175787 TSecr=11594760 [TCP segment of a reassembled PDU]"
"123","2.043783729","172.16.0.212","10.60.0.1","TCP","1400","8000  >  54810 [ACK] Seq=20238 Ack=150 Win=65024 Len=1348 TSval=2014175787 TSecr=11594760 [TCP segment of a reassembled PDU]"
"124","2.043795011","172.16.0.212","10.60.0.1","TCP","1400","8000  >  54810 [ACK] Seq=21586 Ack=150 Win=65024 Len=1348 TSval=2014175787 TSecr=11594760 [TCP segment of a reassembled PDU]"
"125","2.043699608","10.60.0.1","172.16.0.212","TCP","52","54810  >  8000 [ACK] Seq=150 Ack=6758 Win=59136 Len=0 TSval=11594760 TSecr=2014175784"
"126","2.043699669","10.60.0.1","172.16.0.212","TCP","52","54810  >  8000 [ACK] Seq=150 Ack=8106 Win=57856 Len=0 TSval=11594760 TSecr=2014175784"
"127","2.043699704","10.60.0.1","172.16.0.212","TCP","52","54810  >  8000 [ACK] Seq=150 Ack=9454 Win=57472 Len=0 TSval=11594761 TSecr=2014175785"
"128","2.043699724","10.60.0.1","172.16.0.212","TCP","52","54810  >  8000 [ACK] Seq=150 Ack=10802 Win=56320 Len=0 TSval=11594761 TSecr=2014175785"
"129","2.043699746","10.60.0.1","172.16.0.212","TCP","52","54810  >  8000 [ACK] Seq=150 Ack=12150 Win=55168 Len=0 TSval=11594761 TSecr=2014175785"
"130","2.045704388","172.16.0.212","10.60.0.1","TCP","1400","8000  >  54810 [ACK] Seq=22934 Ack=150 Win=65024 Len=1348 TSval=2014175789 TSecr=11594760 [TCP segment of a reassembled PDU]"
"131","2.045718741","172.16.0.212","10.60.0.1","TCP","1400","8000  >  54810 [ACK] Seq=24282 Ack=150 Win=65024 Len=1348 TSval=2014175789 TSecr=11594760 [TCP segment of a reassembled PDU]"
"132","2.045728052","172.16.0.212","10.60.0.1","TCP","1400","8000  >  54810 [ACK] Seq=25630 Ack=150 Win=65024 Len=1348 TSval=2014175789 TSecr=11594760 [TCP segment of a reassembled PDU]"
"133","2.045736697","172.16.0.212","10.60.0.1","TCP","1400","8000  >  54810 [ACK] Seq=26978 Ack=150 Win=65024 Len=1348 TSval=2014175789 TSecr=11594760 [TCP segment of a reassembled PDU]"
"134","2.045745137","172.16.0.212","10.60.0.1","HTTP","454","HTTP/1.0 200 OK  (text/html)"
"135","2.045692233","10.60.0.1","172.16.0.212","TCP","52","54810  >  8000 [ACK] Seq=150 Ack=13498 Win=64256 Len=0 TSval=11594763 TSecr=2014175787"
"136","2.045692266","10.60.0.1","172.16.0.212","TCP","52","54810  >  8000 [ACK] Seq=150 Ack=14846 Win=63232 Len=0 TSval=11594763 TSecr=2014175787"
"137","2.046680697","10.60.0.1","172.16.0.212","TCP","52","54810  >  8000 [ACK] Seq=150 Ack=16194 Win=64256 Len=0 TSval=11594763 TSecr=2014175787"
"138","2.046680806","10.60.0.1","172.16.0.212","TCP","52","54810  >  8000 [ACK] Seq=150 Ack=17542 Win=63232 Len=0 TSval=11594763 TSecr=2014175787"
"139","2.046680849","10.60.0.1","172.16.0.212","TCP","52","54810  >  8000 [ACK] Seq=150 Ack=18890 Win=62080 Len=0 TSval=11594763 TSecr=2014175787"
"140","2.046680871","10.60.0.1","172.16.0.212","TCP","52","54810  >  8000 [ACK] Seq=150 Ack=20238 Win=60928 Len=0 TSval=11594764 TSecr=2014175787"
"141","2.046680893","10.60.0.1","172.16.0.212","TCP","52","54810  >  8000 [ACK] Seq=150 Ack=22934 Win=64256 Len=0 TSval=11594764 TSecr=2014175787"
"142","2.047679542","10.60.0.1","172.16.0.212","TCP","52","54810  >  8000 [ACK] Seq=150 Ack=25630 Win=64256 Len=0 TSval=11594765 TSecr=2014175789"
"143","2.047679620","10.60.0.1","172.16.0.212","TCP","52","54810  >  8000 [ACK] Seq=150 Ack=28326 Win=64256 Len=0 TSval=11594765 TSecr=2014175789"
"144","2.048679829","10.60.0.1","172.16.0.212","TCP","52","54810  >  8000 [FIN, ACK] Seq=150 Ack=28729 Win=64256 Len=0 TSval=11594766 TSecr=2014175789"
"145","2.048679913","10.60.0.1","172.16.0.212","TCP","60","54822  >  8000 [SYN] Seq=0 Win=65280 Len=0 MSS=1360 SACK_PERM=1 TSval=11594766 TSecr=0 WS=128"
"146","2.049684863","172.16.0.212","10.60.0.1","TCP","52","8000  >  54810 [ACK] Seq=28729 Ack=151 Win=65024 Len=0 TSval=2014175793 TSecr=11594766"
"147","2.049699762","172.16.0.212","10.60.0.1","TCP","60","8000  >  54822 [SYN, ACK] Seq=0 Ack=1 Win=65160 Len=0 MSS=1460 SACK_PERM=1 TSval=2014175793 TSecr=11594766 WS=128"
"148","2.051673193","10.60.0.1","172.16.0.212","TCP","52","54822  >  8000 [ACK] Seq=1 Ack=1 Win=65280 Len=0 TSval=11594769 TSecr=2014175793"
"149","2.051673283","10.60.0.1","172.16.0.212","HTTP","189","GET /blog/ HTTP/1.1 "
"150","2.052683122","172.16.0.212","10.60.0.1","TCP","52","8000  >  54822 [ACK] Seq=1 Ack=138 Win=65024 Len=0 TSval=2014175796 TSecr=11594769"
"151","2.052697126","172.16.0.212","10.60.0.1","TCP","69","8000  >  54822 [PSH, ACK] Seq=1 Ack=138 Win=65024 Len=17 TSval=2014175797 TSecr=11594769 [TCP segment of a reassembled PDU]"
"152","2.052709917","172.16.0.212","10.60.0.1","TCP","1400","8000  >  54822 [ACK] Seq=18 Ack=138 Win=65024 Len=1348 TSval=2014175797 TSecr=11594769 [TCP segment of a reassembled PDU]"
"153","2.052718983","172.16.0.212","10.60.0.1","TCP","1400","8000  >  54822 [ACK] Seq=1366 Ack=138 Win=65024 Len=1348 TSval=2014175797 TSecr=11594769 [TCP segment of a reassembled PDU]"
"154","2.052727789","172.16.0.212","10.60.0.1","TCP","1400","8000  >  54822 [ACK] Seq=2714 Ack=138 Win=65024 Len=1348 TSval=2014175797 TSecr=11594769 [TCP segment of a reassembled PDU]"
"155","2.052736029","172.16.0.212","10.60.0.1","TCP","1400","8000  >  54822 [ACK] Seq=4062 Ack=138 Win=65024 Len=1348 TSval=2014175797 TSecr=11594769 [TCP segment of a reassembled PDU]"
"156","2.052744683","172.16.0.212","10.60.0.1","TCP","1400","8000  >  54822 [ACK] Seq=5410 Ack=138 Win=65024 Len=1348 TSval=2014175797 TSecr=11594769 [TCP segment of a reassembled PDU]"
"157","2.053677618","172.16.0.212","10.60.0.1","TCP","1400","8000  >  54822 [ACK] Seq=6758 Ack=138 Win=65024 Len=1348 TSval=2014175797 TSecr=11594769 [TCP segment of a reassembled PDU]"
"158","2.053688601","172.16.0.212","10.60.0.1","TCP","1400","8000  >  54822 [ACK] Seq=8106 Ack=138 Win=65024 Len=1348 TSval=2014175797 TSecr=11594769 [TCP segment of a reassembled PDU]"
"159","2.053697459","172.16.0.212","10.60.0.1","TCP","1400","8000  >  54822 [ACK] Seq=9454 Ack=138 Win=65024 Len=1348 TSval=2014175797 TSecr=11594769 [TCP segment of a reassembled PDU]"
"160","2.053706053","172.16.0.212","10.60.0.1","TCP","1400","8000  >  54822 [ACK] Seq=10802 Ack=138 Win=65024 Len=1348 TSval=2014175797 TSecr=11594769 [TCP segment of a reassembled PDU]"
"161","2.054684406","10.60.0.1","172.16.0.212","TCP","52","54822  >  8000 [ACK] Seq=138 Ack=18 Win=65280 Len=0 TSval=11594772 TSecr=2014175797"
"162","2.055691946","172.16.0.212","10.60.0.1","TCP","1400","8000  >  54822 [ACK] Seq=12150 Ack=138 Win=65024 Len=1348 TSval=2014175799 TSecr=11594772 [TCP segment of a reassembled PDU]"
"163","2.055704761","172.16.0.212","10.60.0.1","TCP","1400","8000  >  54822 [ACK] Seq=13498 Ack=138 Win=65024 Len=1348 TSval=2014175799 TSecr=11594772 [TCP segment of a reassembled PDU]"
"164","2.055679758","10.60.0.1","172.16.0.212","TCP","52","54822  >  8000 [ACK] Seq=138 Ack=1366 Win=64000 Len=0 TSval=11594772 TSecr=2014175797"
"165","2.055679821","10.60.0.1","172.16.0.212","TCP","52","54822  >  8000 [ACK] Seq=138 Ack=2714 Win=63232 Len=0 TSval=11594772 TSecr=2014175797"
"166","2.055679854","10.60.0.1","172.16.0.212","TCP","52","54822  >  8000 [ACK] Seq=138 Ack=4062 Win=62080 Len=0 TSval=11594773 TSecr=2014175797"
"167","2.055679880","10.60.0.1","172.16.0.212","TCP","52","54822  >  8000 [ACK] Seq=138 Ack=5410 Win=60928 Len=0 TSval=11594773 TSecr=2014175797"
"168","2.055679901","10.60.0.1","172.16.0.212","TCP","52","54822  >  8000 [ACK] Seq=138 Ack=6758 Win=59776 Len=0 TSval=11594773 TSecr=2014175797"
"169","2.055679922","10.60.0.1","172.16.0.212","TCP","52","54822  >  8000 [ACK] Seq=138 Ack=8106 Win=58624 Len=0 TSval=11594773 TSecr=2014175797"
"170","2.056684177","172.16.0.212","10.60.0.1","TCP","1400","8000  >  54822 [ACK] Seq=14846 Ack=138 Win=65024 Len=1348 TSval=2014175800 TSecr=11594772 [TCP segment of a reassembled PDU]"
"171","2.056698688","172.16.0.212","10.60.0.1","TCP","1400","8000  >  54822 [ACK] Seq=16194 Ack=138 Win=65024 Len=1348 TSval=2014175800 TSecr=11594772 [TCP segment of a reassembled PDU]"
"172","2.056717840","172.16.0.212","10.60.0.1","TCP","1400","8000  >  54822 [ACK] Seq=17542 Ack=138 Win=65024 Len=1348 TSval=2014175800 TSecr=11594773 [TCP segment of a reassembled PDU]"
"173","2.056728245","172.16.0.212","10.60.0.1","TCP","1400","8000  >  54822 [ACK] Seq=18890 Ack=138 Win=65024 Len=1348 TSval=2014175800 TSecr=11594773 [TCP segment of a reassembled PDU]"
"174","2.056740400","172.16.0.212","10.60.0.1","TCP","1400","8000  >  54822 [ACK] Seq=20238 Ack=138 Win=65024 Len=1348 TSval=2014175800 TSecr=11594773 [TCP segment of a reassembled PDU]"
"175","2.056752559","172.16.0.212","10.60.0.1","TCP","1400","8000  >  54822 [ACK] Seq=21586 Ack=138 Win=65024 Len=1348 TSval=2014175800 TSecr=11594773 [TCP segment of a reassembled PDU]"
"176","2.056764347","172.16.0.212","10.60.0.1","TCP","1400","8000  >  54822 [ACK] Seq=22934 Ack=138 Win=65024 Len=1348 TSval=2014175800 TSecr=11594773 [TCP segment of a reassembled PDU]"
"177","2.056776439","172.16.0.212","10.60.0.1","TCP","1400","8000  >  54822 [ACK] Seq=24282 Ack=138 Win=65024 Len=1348 TSval=2014175800 TSecr=11594773 [TCP segment of a reassembled PDU]"
"178","2.056788762","172.16.0.212","10.60.0.1","TCP","1400","8000  >  54822 [ACK] Seq=25630 Ack=138 Win=65024 Len=1348 TSval=2014175800 TSecr=11594773 [TCP segment of a reassembled PDU]"
"179","2.056801944","172.16.0.212","10.60.0.1","HTTP","892","HTTP/1.0 200 OK  (text/html)"
"180","2.056827128","10.60.0.1","172.16.0.212","TCP","52","54822  >  8000 [ACK] Seq=138 Ack=9454 Win=57472 Len=0 TSval=11594773 TSecr=2014175797"
"181","2.056827201","10.60.0.1","172.16.0.212","TCP","52","54822  >  8000 [ACK] Seq=138 Ack=10802 Win=56320 Len=0 TSval=11594773 TSecr=2014175797"
"182","2.056827245","10.60.0.1","172.16.0.212","TCP","52","54822  >  8000 [ACK] Seq=138 Ack=12150 Win=55168 Len=0 TSval=11594774 TSecr=2014175797"
"183","2.057677775","10.60.0.1","172.16.0.212","TCP","52","54822  >  8000 [ACK] Seq=138 Ack=13498 Win=64256 Len=0 TSval=11594775 TSecr=2014175799"
"184","2.057677879","10.60.0.1","172.16.0.212","TCP","52","54822  >  8000 [ACK] Seq=138 Ack=14846 Win=63232 Len=0 TSval=11594775 TSecr=2014175799"
"185","2.058672478","10.60.0.1","172.16.0.212","TCP","52","54822  >  8000 [ACK] Seq=138 Ack=16194 Win=64256 Len=0 TSval=11594776 TSecr=2014175800"
"186","2.058672553","10.60.0.1","172.16.0.212","TCP","52","54822  >  8000 [ACK] Seq=138 Ack=17542 Win=63232 Len=0 TSval=11594776 TSecr=2014175800"
"187","2.058672576","10.60.0.1","172.16.0.212","TCP","52","54822  >  8000 [ACK] Seq=138 Ack=18890 Win=64256 Len=0 TSval=11594776 TSecr=2014175800"
"188","2.058672607","10.60.0.1","172.16.0.212","TCP","52","54822  >  8000 [ACK] Seq=138 Ack=20238 Win=63232 Len=0 TSval=11594776 TSecr=2014175800"
"189","2.059670138","10.60.0.1","172.16.0.212","TCP","52","54822  >  8000 [ACK] Seq=138 Ack=22934 Win=64256 Len=0 TSval=11594777 TSecr=2014175800"
"190","2.059670202","10.60.0.1","172.16.0.212","TCP","52","54822  >  8000 [ACK] Seq=138 Ack=25630 Win=64256 Len=0 TSval=11594777 TSecr=2014175800"
"191","2.059670224","10.60.0.1","172.16.0.212","TCP","52","54822  >  8000 [ACK] Seq=138 Ack=27818 Win=64256 Len=0 TSval=11594777 TSecr=2014175800"
"192","2.060670709","10.60.0.1","172.16.0.212","HTTP","223","GET /blog/20231115/free5GC_OAuth2_Procedure/ HTTP/1.1 "
"193","2.061671755","172.16.0.212","10.60.0.1","TCP","40","8000  >  54822 [RST] Seq=27818 Win=0 Len=0"
"194","3.068693369","10.60.0.1","172.16.0.212","TCP","60","54836  >  8000 [SYN] Seq=0 Win=65280 Len=0 MSS=1360 SACK_PERM=1 TSval=11595786 TSecr=0 WS=128"
"195","3.069700301","172.16.0.212","10.60.0.1","TCP","60","8000  >  54836 [SYN, ACK] Seq=0 Ack=1 Win=65160 Len=0 MSS=1460 SACK_PERM=1 TSval=2014176814 TSecr=11595786 WS=128"
"196","3.071682962","10.60.0.1","172.16.0.212","TCP","52","54836  >  8000 [ACK] Seq=1 Ack=1 Win=65280 Len=0 TSval=11595789 TSecr=2014176814"
"197","3.071683115","10.60.0.1","172.16.0.212","HTTP","223","GET /blog/20231115/free5GC_OAuth2_Procedure/ HTTP/1.1 "
"198","3.072707556","172.16.0.212","10.60.0.1","TCP","52","8000  >  54836 [ACK] Seq=1 Ack=172 Win=65024 Len=0 TSval=2014176817 TSecr=11595789"
"199","3.073705566","172.16.0.212","10.60.0.1","TCP","69","8000  >  54836 [PSH, ACK] Seq=1 Ack=172 Win=65024 Len=17 TSval=2014176818 TSecr=11595789 [TCP segment of a reassembled PDU]"
"200","3.073729990","172.16.0.212","10.60.0.1","TCP","1400","8000  >  54836 [ACK] Seq=18 Ack=172 Win=65024 Len=1348 TSval=2014176818 TSecr=11595789 [TCP segment of a reassembled PDU]"
"201","3.073740291","172.16.0.212","10.60.0.1","TCP","1400","8000  >  54836 [ACK] Seq=1366 Ack=172 Win=65024 Len=1348 TSval=2014176818 TSecr=11595789 [TCP segment of a reassembled PDU]"
"202","3.073751795","172.16.0.212","10.60.0.1","TCP","1400","8000  >  54836 [ACK] Seq=2714 Ack=172 Win=65024 Len=1348 TSval=2014176818 TSecr=11595789 [TCP segment of a reassembled PDU]"
"203","3.073764297","172.16.0.212","10.60.0.1","TCP","1400","8000  >  54836 [ACK] Seq=4062 Ack=172 Win=65024 Len=1348 TSval=2014176818 TSecr=11595789 [TCP segment of a reassembled PDU]"
"204","3.073777315","172.16.0.212","10.60.0.1","TCP","1400","8000  >  54836 [ACK] Seq=5410 Ack=172 Win=65024 Len=1348 TSval=2014176818 TSecr=11595789 [TCP segment of a reassembled PDU]"
"205","3.073789586","172.16.0.212","10.60.0.1","TCP","1400","8000  >  54836 [ACK] Seq=6758 Ack=172 Win=65024 Len=1348 TSval=2014176818 TSecr=11595789 [TCP segment of a reassembled PDU]"
"206","3.074710364","172.16.0.212","10.60.0.1","TCP","1400","8000  >  54836 [ACK] Seq=8106 Ack=172 Win=65024 Len=1348 TSval=2014176819 TSecr=11595789 [TCP segment of a reassembled PDU]"
"207","3.074724419","172.16.0.212","10.60.0.1","TCP","1400","8000  >  54836 [ACK] Seq=9454 Ack=172 Win=65024 Len=1348 TSval=2014176819 TSecr=11595789 [TCP segment of a reassembled PDU]"
"208","3.074733604","172.16.0.212","10.60.0.1","TCP","1400","8000  >  54836 [ACK] Seq=10802 Ack=172 Win=65024 Len=1348 TSval=2014176819 TSecr=11595789 [TCP segment of a reassembled PDU]"
"209","3.075700034","10.60.0.1","172.16.0.212","TCP","52","54836  >  8000 [ACK] Seq=172 Ack=18 Win=65280 Len=0 TSval=11595793 TSecr=2014176818"
"210","3.075700125","10.60.0.1","172.16.0.212","TCP","52","54836  >  8000 [ACK] Seq=172 Ack=1366 Win=64256 Len=0 TSval=11595793 TSecr=2014176818"
"211","3.075700162","10.60.0.1","172.16.0.212","TCP","52","54836  >  8000 [ACK] Seq=172 Ack=2714 Win=63232 Len=0 TSval=11595793 TSecr=2014176818"
"212","3.075700202","10.60.0.1","172.16.0.212","TCP","52","54836  >  8000 [ACK] Seq=172 Ack=4062 Win=62080 Len=0 TSval=11595793 TSecr=2014176818"
"213","3.075700239","10.60.0.1","172.16.0.212","TCP","52","54836  >  8000 [ACK] Seq=172 Ack=5410 Win=60928 Len=0 TSval=11595793 TSecr=2014176818"
"214","3.075700276","10.60.0.1","172.16.0.212","TCP","52","54836  >  8000 [ACK] Seq=172 Ack=6758 Win=59776 Len=0 TSval=11595793 TSecr=2014176818"
"215","3.076702837","172.16.0.212","10.60.0.1","TCP","1400","8000  >  54836 [ACK] Seq=12150 Ack=172 Win=65024 Len=1348 TSval=2014176821 TSecr=11595793 [TCP segment of a reassembled PDU]"
"216","3.076717727","172.16.0.212","10.60.0.1","TCP","1400","8000  >  54836 [ACK] Seq=13498 Ack=172 Win=65024 Len=1348 TSval=2014176821 TSecr=11595793 [TCP segment of a reassembled PDU]"
"217","3.076683951","10.60.0.1","172.16.0.212","TCP","52","54836  >  8000 [ACK] Seq=172 Ack=8106 Win=58624 Len=0 TSval=11595794 TSecr=2014176818"
"218","3.076684050","10.60.0.1","172.16.0.212","TCP","52","54836  >  8000 [ACK] Seq=172 Ack=9454 Win=64256 Len=0 TSval=11595794 TSecr=2014176819"
"219","3.076684074","10.60.0.1","172.16.0.212","TCP","52","54836  >  8000 [ACK] Seq=172 Ack=10802 Win=64256 Len=0 TSval=11595794 TSecr=2014176819"
"220","3.076684095","10.60.0.1","172.16.0.212","TCP","52","54836  >  8000 [ACK] Seq=172 Ack=12150 Win=63232 Len=0 TSval=11595794 TSecr=2014176819"
"221","3.077688867","172.16.0.212","10.60.0.1","TCP","1400","8000  >  54836 [ACK] Seq=14846 Ack=172 Win=65024 Len=1348 TSval=2014176822 TSecr=11595793 [TCP segment of a reassembled PDU]"
"222","3.077703797","172.16.0.212","10.60.0.1","TCP","1400","8000  >  54836 [ACK] Seq=16194 Ack=172 Win=65024 Len=1348 TSval=2014176822 TSecr=11595793 [TCP segment of a reassembled PDU]"
"223","3.077715539","172.16.0.212","10.60.0.1","TCP","1400","8000  >  54836 [ACK] Seq=17542 Ack=172 Win=65024 Len=1348 TSval=2014176822 TSecr=11595793 [TCP segment of a reassembled PDU]"
"224","3.077725137","172.16.0.212","10.60.0.1","TCP","1400","8000  >  54836 [ACK] Seq=18890 Ack=172 Win=65024 Len=1348 TSval=2014176822 TSecr=11595793 [TCP segment of a reassembled PDU]"
"225","3.077733750","172.16.0.212","10.60.0.1","TCP","1400","8000  >  54836 [ACK] Seq=20238 Ack=172 Win=65024 Len=1348 TSval=2014176822 TSecr=11595793 [TCP segment of a reassembled PDU]"
"226","3.077742425","172.16.0.212","10.60.0.1","TCP","1400","8000  >  54836 [ACK] Seq=21586 Ack=172 Win=65024 Len=1348 TSval=2014176822 TSecr=11595793 [TCP segment of a reassembled PDU]"
"227","3.077757923","172.16.0.212","10.60.0.1","TCP","1400","8000  >  54836 [ACK] Seq=22934 Ack=172 Win=65024 Len=1348 TSval=2014176822 TSecr=11595794 [TCP segment of a reassembled PDU]"
"228","3.077769373","172.16.0.212","10.60.0.1","TCP","1400","8000  >  54836 [ACK] Seq=24282 Ack=172 Win=65024 Len=1348 TSval=2014176822 TSecr=11595794 [TCP segment of a reassembled PDU]"
"229","3.077780386","172.16.0.212","10.60.0.1","TCP","1400","8000  >  54836 [ACK] Seq=25630 Ack=172 Win=65024 Len=1348 TSval=2014176822 TSecr=11595794 [TCP segment of a reassembled PDU]"
"230","3.077791263","172.16.0.212","10.60.0.1","TCP","1400","8000  >  54836 [ACK] Seq=26978 Ack=172 Win=65024 Len=1348 TSval=2014176822 TSecr=11595794 [TCP segment of a reassembled PDU]"
"231","3.077802323","172.16.0.212","10.60.0.1","HTTP","247","HTTP/1.0 200 OK  (text/html)"
"232","3.078676448","10.60.0.1","172.16.0.212","TCP","52","54836  >  8000 [ACK] Seq=172 Ack=13498 Win=64256 Len=0 TSval=11595796 TSecr=2014176821"
"233","3.078676513","10.60.0.1","172.16.0.212","TCP","52","54836  >  8000 [ACK] Seq=172 Ack=14846 Win=63232 Len=0 TSval=11595796 TSecr=2014176821"
"234","3.080680791","10.60.0.1","172.16.0.212","TCP","52","54836  >  8000 [ACK] Seq=172 Ack=16194 Win=64256 Len=0 TSval=11595797 TSecr=2014176822"
"235","3.080680873","10.60.0.1","172.16.0.212","TCP","52","54836  >  8000 [ACK] Seq=172 Ack=17542 Win=63232 Len=0 TSval=11595797 TSecr=2014176822"
"236","3.080680903","10.60.0.1","172.16.0.212","TCP","52","54836  >  8000 [ACK] Seq=172 Ack=18890 Win=64256 Len=0 TSval=11595798 TSecr=2014176822"
"237","3.080680932","10.60.0.1","172.16.0.212","TCP","52","54836  >  8000 [ACK] Seq=172 Ack=20238 Win=63232 Len=0 TSval=11595798 TSecr=2014176822"
"238","3.080680953","10.60.0.1","172.16.0.212","TCP","52","54836  >  8000 [ACK] Seq=172 Ack=22934 Win=62080 Len=0 TSval=11595798 TSecr=2014176822"
"239","3.080680975","10.60.0.1","172.16.0.212","TCP","52","54836  >  8000 [ACK] Seq=172 Ack=28521 Win=63232 Len=0 TSval=11595798 TSecr=2014176822"
"240","3.081677027","10.60.0.1","172.16.0.212","TCP","52","54836  >  8000 [FIN, ACK] Seq=172 Ack=28521 Win=64256 Len=0 TSval=11595799 TSecr=2014176822"
"241","3.082674261","172.16.0.212","10.60.0.1","TCP","52","[TCP Previous segment not captured] 8000  >  54836 [ACK] Seq=28522 Ack=173 Win=65024 Len=0 TSval=2014176827 TSecr=11595799"
"242","3.287802321","172.16.0.212","10.60.0.1","TCP","52","[TCP Retransmission] 8000  >  54836 [FIN, PSH, ACK] Seq=28521 Ack=173 Win=65024 Len=0 TSval=2014177033 TSecr=11595799"
"243","3.289772388","10.60.0.1","172.16.0.212","TCP","52","54836  >  8000 [ACK] Seq=173 Ack=28522 Win=64256 Len=0 TSval=11596007 TSecr=2014177033"
"244","22.650254348","10.60.0.1","172.16.0.212","TCP","60","56124  >  8000 [SYN] Seq=0 Win=65280 Len=0 MSS=1360 SACK_PERM=1 TSval=11615374 TSecr=0 WS=128"
"245","22.651257776","172.16.0.212","10.60.0.1","TCP","60","8000  >  56124 [SYN, ACK] Seq=0 Ack=1 Win=65160 Len=0 MSS=1460 SACK_PERM=1 TSval=2014196402 TSecr=11615374 WS=128"
"246","22.653243359","10.60.0.1","172.16.0.212","TCP","52","56124  >  8000 [ACK] Seq=1 Ack=1 Win=65280 Len=0 TSval=11615377 TSecr=2014196402"
"247","22.653243513","10.60.0.1","172.16.0.212","HTTP","190","GET /guide/ HTTP/1.1 "
"248","22.654255358","172.16.0.212","10.60.0.1","TCP","52","8000  >  56124 [ACK] Seq=1 Ack=139 Win=65024 Len=0 TSval=2014196405 TSecr=11615377"
