"No.","Time","Source","Destination","Protocol","Length","Info"
"1","0.000000000","10.60.0.1","172.16.0.211","TCP","60","53818  >  80 [SYN] Seq=0 Win=65280 Len=0 MSS=1360 SACK_PERM TSval=3284595647 TSecr=0 WS=128"
"2","0.001009912","172.16.0.211","10.60.0.1","TCP","60","80  >  53818 [SYN, ACK] Seq=0 Ack=1 Win=65160 Len=0 MSS=1460 SACK_PERM TSval=292776082 TSecr=3284595647 WS=128"
"3","0.001991482","10.60.0.1","172.16.0.211","TCP","52","53818  >  80 [ACK] Seq=1 Ack=1 Win=65280 Len=0 TSval=3284595649 TSecr=292776082"
"4","0.001991610","10.60.0.1","172.16.0.211","HTTP","193","GET /example-clock.mp4 HTTP/1.1 "
"5","0.003021128","172.16.0.211","10.60.0.1","TCP","52","80  >  53818 [ACK] Seq=1 Ack=142 Win=65024 Len=0 TSval=292776084 TSecr=3284595649"
"6","0.003051578","172.16.0.211","10.60.0.1","TCP","1400","80  >  53818 [ACK] Seq=1 Ack=142 Win=65024 Len=1348 TSval=292776084 TSecr=3284595649 [TCP segment of a reassembled PDU]"
"7","0.003066651","172.16.0.211","10.60.0.1","TCP","1400","80  >  53818 [ACK] Seq=1349 Ack=142 Win=65024 Len=1348 TSval=292776084 TSecr=3284595649 [TCP segment of a reassembled PDU]"
"8","0.003079077","172.16.0.211","10.60.0.1","TCP","1400","80  >  53818 [ACK] Seq=2697 Ack=142 Win=65024 Len=1348 TSval=292776084 TSecr=3284595649 [TCP segment of a reassembled PDU]"
"9","0.003091588","172.16.0.211","10.60.0.1","TCP","1400","80  >  53818 [ACK] Seq=4045 Ack=142 Win=65024 Len=1348 TSval=292776084 TSecr=3284595649 [TCP segment of a reassembled PDU]"
"10","0.003104371","172.16.0.211","10.60.0.1","TCP","1400","80  >  53818 [ACK] Seq=5393 Ack=142 Win=65024 Len=1348 TSval=292776084 TSecr=3284595649 [TCP segment of a reassembled PDU]"
"11","0.003117029","172.16.0.211","10.60.0.1","TCP","1400","80  >  53818 [ACK] Seq=6741 Ack=142 Win=65024 Len=1348 TSval=292776084 TSecr=3284595649 [TCP segment of a reassembled PDU]"
"12","0.003130204","172.16.0.211","10.60.0.1","TCP","1400","80  >  53818 [ACK] Seq=8089 Ack=142 Win=65024 Len=1348 TSval=292776084 TSecr=3284595649 [TCP segment of a reassembled PDU]"
"13","0.003142329","172.16.0.211","10.60.0.1","TCP","1400","80  >  53818 [ACK] Seq=9437 Ack=142 Win=65024 Len=1348 TSval=292776084 TSecr=3284595649 [TCP segment of a reassembled PDU]"
"14","0.003154997","172.16.0.211","10.60.0.1","TCP","1400","80  >  53818 [ACK] Seq=10785 Ack=142 Win=65024 Len=1348 TSval=292776084 TSecr=3284595649 [TCP segment of a reassembled PDU]"
"15","0.003168159","172.16.0.211","10.60.0.1","TCP","1400","80  >  53818 [ACK] Seq=12133 Ack=142 Win=65024 Len=1348 TSval=292776084 TSecr=3284595649 [TCP segment of a reassembled PDU]"
"16","0.004992437","10.60.0.1","172.16.0.211","TCP","52","53818  >  80 [ACK] Seq=142 Ack=1349 Win=64256 Len=0 TSval=3284595652 TSecr=292776084"
"17","0.004992638","10.60.0.1","172.16.0.211","TCP","52","53818  >  80 [ACK] Seq=142 Ack=2697 Win=63232 Len=0 TSval=3284595652 TSecr=292776084"
"18","0.004992670","10.60.0.1","172.16.0.211","TCP","52","53818  >  80 [ACK] Seq=142 Ack=4045 Win=62080 Len=0 TSval=3284595652 TSecr=292776084"
"19","0.004992692","10.60.0.1","172.16.0.211","TCP","52","53818  >  80 [ACK] Seq=142 Ack=5393 Win=60928 Len=0 TSval=3284595652 TSecr=292776084"
"20","0.004992713","10.60.0.1","172.16.0.211","TCP","52","53818  >  80 [ACK] Seq=142 Ack=6741 Win=59776 Len=0 TSval=3284595652 TSecr=292776084"
"21","0.006018532","172.16.0.211","10.60.0.1","TCP","1400","80  >  53818 [ACK] Seq=13481 Ack=142 Win=65024 Len=1348 TSval=292776086 TSecr=3284595652 [TCP segment of a reassembled PDU]"
"22","0.006032201","172.16.0.211","10.60.0.1","TCP","1400","80  >  53818 [ACK] Seq=14829 Ack=142 Win=65024 Len=1348 TSval=292776086 TSecr=3284595652 [TCP segment of a reassembled PDU]"
"23","0.006046905","172.16.0.211","10.60.0.1","TCP","1400","80  >  53818 [ACK] Seq=16177 Ack=142 Win=65024 Len=1348 TSval=292776087 TSecr=3284595652 [TCP segment of a reassembled PDU]"
"24","0.006058070","172.16.0.211","10.60.0.1","TCP","1400","80  >  53818 [ACK] Seq=17525 Ack=142 Win=65024 Len=1348 TSval=292776087 TSecr=3284595652 [TCP segment of a reassembled PDU]"
"25","0.006067387","172.16.0.211","10.60.0.1","TCP","1400","80  >  53818 [ACK] Seq=18873 Ack=142 Win=65024 Len=1348 TSval=292776087 TSecr=3284595652 [TCP segment of a reassembled PDU]"
"26","0.006075280","172.16.0.211","10.60.0.1","TCP","1400","80  >  53818 [ACK] Seq=20221 Ack=142 Win=65024 Len=1348 TSval=292776087 TSecr=3284595652 [TCP segment of a reassembled PDU]"
"27","0.006083960","172.16.0.211","10.60.0.1","TCP","1400","80  >  53818 [ACK] Seq=21569 Ack=142 Win=65024 Len=1348 TSval=292776087 TSecr=3284595652 [TCP segment of a reassembled PDU]"
"28","0.006092552","172.16.0.211","10.60.0.1","TCP","1400","80  >  53818 [ACK] Seq=22917 Ack=142 Win=65024 Len=1348 TSval=292776087 TSecr=3284595652 [TCP segment of a reassembled PDU]"
"29","0.006101210","172.16.0.211","10.60.0.1","TCP","1400","80  >  53818 [ACK] Seq=24265 Ack=142 Win=65024 Len=1348 TSval=292776087 TSecr=3284595652 [TCP segment of a reassembled PDU]"
"30","0.006109808","172.16.0.211","10.60.0.1","TCP","1400","80  >  53818 [ACK] Seq=25613 Ack=142 Win=65024 Len=1348 TSval=292776087 TSecr=3284595652 [TCP segment of a reassembled PDU]"
"31","0.006002551","10.60.0.1","172.16.0.211","TCP","52","53818  >  80 [ACK] Seq=142 Ack=8089 Win=64256 Len=0 TSval=3284595652 TSecr=292776084"
"32","0.006002679","10.60.0.1","172.16.0.211","TCP","52","53818  >  80 [ACK] Seq=142 Ack=9437 Win=63232 Len=0 TSval=3284595652 TSecr=292776084"
"33","0.006002715","10.60.0.1","172.16.0.211","TCP","52","53818  >  80 [ACK] Seq=142 Ack=10785 Win=62080 Len=0 TSval=3284595652 TSecr=292776084"
"34","0.006002737","10.60.0.1","172.16.0.211","TCP","52","53818  >  80 [ACK] Seq=142 Ack=12133 Win=60928 Len=0 TSval=3284595652 TSecr=292776084"
"35","0.006002779","10.60.0.1","172.16.0.211","TCP","52","53818  >  80 [ACK] Seq=142 Ack=13481 Win=59776 Len=0 TSval=3284595652 TSecr=292776084"
"36","0.008019547","172.16.0.211","10.60.0.1","TCP","1400","80  >  53818 [ACK] Seq=26961 Ack=142 Win=65024 Len=1348 TSval=292776088 TSecr=3284595652 [TCP segment of a reassembled PDU]"
"37","0.008034110","172.16.0.211","10.60.0.1","TCP","1400","80  >  53818 [ACK] Seq=28309 Ack=142 Win=65024 Len=1348 TSval=292776088 TSecr=3284595652 [TCP segment of a reassembled PDU]"
"38","0.008043209","172.16.0.211","10.60.0.1","TCP","1400","80  >  53818 [ACK] Seq=29657 Ack=142 Win=65024 Len=1348 TSval=292776088 TSecr=3284595652 [TCP segment of a reassembled PDU]"
"39","0.008055022","172.16.0.211","10.60.0.1","TCP","1400","80  >  53818 [ACK] Seq=31005 Ack=142 Win=65024 Len=1348 TSval=292776088 TSecr=3284595652 [TCP segment of a reassembled PDU]"
"40","0.008067110","172.16.0.211","10.60.0.1","TCP","1400","80  >  53818 [ACK] Seq=32353 Ack=142 Win=65024 Len=1348 TSval=292776088 TSecr=3284595652 [TCP segment of a reassembled PDU]"
"41","0.008080643","172.16.0.211","10.60.0.1","TCP","1400","80  >  53818 [ACK] Seq=33701 Ack=142 Win=65024 Len=1348 TSval=292776088 TSecr=3284595652 [TCP segment of a reassembled PDU]"
"42","0.008094424","172.16.0.211","10.60.0.1","TCP","1400","80  >  53818 [ACK] Seq=35049 Ack=142 Win=65024 Len=1348 TSval=292776088 TSecr=3284595652 [TCP segment of a reassembled PDU]"
"43","0.008108034","172.16.0.211","10.60.0.1","TCP","1400","80  >  53818 [ACK] Seq=36397 Ack=142 Win=65024 Len=1348 TSval=292776088 TSecr=3284595652 [TCP segment of a reassembled PDU]"
"44","0.008120060","172.16.0.211","10.60.0.1","TCP","1400","80  >  53818 [ACK] Seq=37745 Ack=142 Win=65024 Len=1348 TSval=292776088 TSecr=3284595652 [TCP segment of a reassembled PDU]"
"45","0.008129141","172.16.0.211","10.60.0.1","TCP","1400","80  >  53818 [ACK] Seq=39093 Ack=142 Win=65024 Len=1348 TSval=292776088 TSecr=3284595652 [TCP segment of a reassembled PDU]"
"46","0.007999534","10.60.0.1","172.16.0.211","TCP","52","53818  >  80 [ACK] Seq=142 Ack=14829 Win=58624 Len=0 TSval=3284595654 TSecr=292776086"
"47","0.007999656","10.60.0.1","172.16.0.211","TCP","52","53818  >  80 [ACK] Seq=142 Ack=16177 Win=57472 Len=0 TSval=3284595654 TSecr=292776086"
"48","0.007999691","10.60.0.1","172.16.0.211","TCP","52","53818  >  80 [ACK] Seq=142 Ack=17525 Win=56320 Len=0 TSval=3284595655 TSecr=292776087"
"49","0.007999713","10.60.0.1","172.16.0.211","TCP","52","53818  >  80 [ACK] Seq=142 Ack=18873 Win=55168 Len=0 TSval=3284595655 TSecr=292776087"
"50","0.007999734","10.60.0.1","172.16.0.211","TCP","52","53818  >  80 [ACK] Seq=142 Ack=20221 Win=54016 Len=0 TSval=3284595655 TSecr=292776087"
"51","0.007999755","10.60.0.1","172.16.0.211","TCP","52","53818  >  80 [ACK] Seq=142 Ack=21569 Win=52864 Len=0 TSval=3284595655 TSecr=292776087"
"52","0.009996584","172.16.0.211","10.60.0.1","TCP","1400","80  >  53818 [ACK] Seq=40441 Ack=142 Win=65024 Len=1348 TSval=292776090 TSecr=3284595654 [TCP segment of a reassembled PDU]"
"53","0.010988175","10.60.0.1","172.16.0.211","TCP","60","53832  >  80 [SYN] Seq=0 Win=65280 Len=0 MSS=1360 SACK_PERM TSval=3284595658 TSecr=0 WS=128"
"54","0.011993458","172.16.0.211","10.60.0.1","TCP","60","80  >  53832 [SYN, ACK] Seq=0 Ack=1 Win=65160 Len=0 MSS=1460 SACK_PERM TSval=292776092 TSecr=3284595658 WS=128"
"55","0.012986823","10.60.0.1","172.16.0.211","TCP","52","53832  >  80 [ACK] Seq=1 Ack=1 Win=65280 Len=0 TSval=3284595660 TSecr=292776092"
"56","0.012986889","10.60.0.1","172.16.0.211","HTTP","200","GET /example-clock.mp4 HTTP/1.1 "
"57","0.014005611","172.16.0.211","10.60.0.1","TCP","52","80  >  53832 [ACK] Seq=1 Ack=149 Win=65024 Len=0 TSval=292776094 TSecr=3284595660"
"58","0.014026332","172.16.0.211","10.60.0.1","TCP","1400","80  >  53832 [ACK] Seq=1 Ack=149 Win=65024 Len=1348 TSval=292776095 TSecr=3284595660 [TCP segment of a reassembled PDU]"
"59","0.014035957","172.16.0.211","10.60.0.1","TCP","1400","80  >  53832 [ACK] Seq=1349 Ack=149 Win=65024 Len=1348 TSval=292776095 TSecr=3284595660 [TCP segment of a reassembled PDU]"
"60","0.014044815","172.16.0.211","10.60.0.1","TCP","1400","80  >  53832 [ACK] Seq=2697 Ack=149 Win=65024 Len=1348 TSval=292776095 TSecr=3284595660 [TCP segment of a reassembled PDU]"
"61","0.014055200","172.16.0.211","10.60.0.1","TCP","1400","80  >  53832 [ACK] Seq=4045 Ack=149 Win=65024 Len=1348 TSval=292776095 TSecr=3284595660 [TCP segment of a reassembled PDU]"
"62","0.014063980","172.16.0.211","10.60.0.1","TCP","1400","80  >  53832 [ACK] Seq=5393 Ack=149 Win=65024 Len=1348 TSval=292776095 TSecr=3284595660 [TCP segment of a reassembled PDU]"
"63","0.014072528","172.16.0.211","10.60.0.1","TCP","1400","80  >  53832 [ACK] Seq=6741 Ack=149 Win=65024 Len=1348 TSval=292776095 TSecr=3284595660 [TCP segment of a reassembled PDU]"
"64","0.014081044","172.16.0.211","10.60.0.1","TCP","1400","80  >  53832 [ACK] Seq=8089 Ack=149 Win=65024 Len=1348 TSval=292776095 TSecr=3284595660 [TCP segment of a reassembled PDU]"
"65","0.014089667","172.16.0.211","10.60.0.1","TCP","1400","80  >  53832 [ACK] Seq=9437 Ack=149 Win=65024 Len=1348 TSval=292776095 TSecr=3284595660 [TCP segment of a reassembled PDU]"
"66","0.014098210","172.16.0.211","10.60.0.1","TCP","1400","80  >  53832 [ACK] Seq=10785 Ack=149 Win=65024 Len=1348 TSval=292776095 TSecr=3284595660 [TCP segment of a reassembled PDU]"
"67","0.014106712","172.16.0.211","10.60.0.1","TCP","1400","80  >  53832 [ACK] Seq=12133 Ack=149 Win=65024 Len=1348 TSval=292776095 TSecr=3284595660 [TCP segment of a reassembled PDU]"
"68","0.016041022","10.60.0.1","172.16.0.211","TCP","52","53832  >  80 [ACK] Seq=149 Ack=1349 Win=64256 Len=0 TSval=3284595662 TSecr=292776095"
"69","0.016041104","10.60.0.1","172.16.0.211","TCP","52","53832  >  80 [ACK] Seq=149 Ack=2697 Win=63232 Len=0 TSval=3284595662 TSecr=292776095"
"70","0.016041134","10.60.0.1","172.16.0.211","TCP","52","53832  >  80 [ACK] Seq=149 Ack=4045 Win=62080 Len=0 TSval=3284595663 TSecr=292776095"
"71","0.016041154","10.60.0.1","172.16.0.211","TCP","52","53832  >  80 [ACK] Seq=149 Ack=5393 Win=60928 Len=0 TSval=3284595663 TSecr=292776095"
"72","0.016041176","10.60.0.1","172.16.0.211","TCP","52","53818  >  80 [RST, ACK] Seq=142 Ack=41789 Win=64256 Len=0 TSval=3284595663 TSecr=292776087"
"73","0.016041197","10.60.0.1","172.16.0.211","TCP","52","53832  >  80 [ACK] Seq=149 Ack=6741 Win=64256 Len=0 TSval=3284595663 TSecr=292776095"
"74","0.016041219","10.60.0.1","172.16.0.211","TCP","52","53832  >  80 [ACK] Seq=149 Ack=8089 Win=63232 Len=0 TSval=3284595663 TSecr=292776095"
"75","0.017013744","172.16.0.211","10.60.0.1","TCP","1400","80  >  53832 [ACK] Seq=13481 Ack=149 Win=65024 Len=1348 TSval=292776098 TSecr=3284595662 [TCP segment of a reassembled PDU]"
"76","0.017029431","172.16.0.211","10.60.0.1","TCP","1400","80  >  53832 [ACK] Seq=14829 Ack=149 Win=65024 Len=1348 TSval=292776098 TSecr=3284595662 [TCP segment of a reassembled PDU]"
"77","0.017048048","172.16.0.211","10.60.0.1","TCP","1400","80  >  53832 [ACK] Seq=16177 Ack=149 Win=65024 Len=1348 TSval=292776098 TSecr=3284595663 [TCP segment of a reassembled PDU]"
"78","0.017057525","172.16.0.211","10.60.0.1","TCP","1400","80  >  53832 [ACK] Seq=17525 Ack=149 Win=65024 Len=1348 TSval=292776098 TSecr=3284595663 [TCP segment of a reassembled PDU]"
"79","0.017066175","172.16.0.211","10.60.0.1","TCP","1400","80  >  53832 [ACK] Seq=18873 Ack=149 Win=65024 Len=1348 TSval=292776098 TSecr=3284595663 [TCP segment of a reassembled PDU]"
"80","0.017074772","172.16.0.211","10.60.0.1","TCP","1400","80  >  53832 [ACK] Seq=20221 Ack=149 Win=65024 Len=1348 TSval=292776098 TSecr=3284595663 [TCP segment of a reassembled PDU]"
"81","0.017083281","172.16.0.211","10.60.0.1","TCP","1400","80  >  53832 [ACK] Seq=21569 Ack=149 Win=65024 Len=1348 TSval=292776098 TSecr=3284595663 [TCP segment of a reassembled PDU]"
"82","0.017091758","172.16.0.211","10.60.0.1","TCP","1400","80  >  53832 [ACK] Seq=22917 Ack=149 Win=65024 Len=1348 TSval=292776098 TSecr=3284595663 [TCP segment of a reassembled PDU]"
"83","0.017100316","172.16.0.211","10.60.0.1","TCP","1400","80  >  53832 [ACK] Seq=24265 Ack=149 Win=65024 Len=1348 TSval=292776098 TSecr=3284595663 [TCP segment of a reassembled PDU]"
"84","0.017110372","172.16.0.211","10.60.0.1","TCP","1400","80  >  53832 [ACK] Seq=25613 Ack=149 Win=65024 Len=1348 TSval=292776098 TSecr=3284595663 [TCP segment of a reassembled PDU]"
"85","0.017119603","172.16.0.211","10.60.0.1","TCP","1400","80  >  53832 [ACK] Seq=26961 Ack=149 Win=65024 Len=1348 TSval=292776098 TSecr=3284595663 [TCP segment of a reassembled PDU]"
"86","0.017128083","172.16.0.211","10.60.0.1","TCP","1400","80  >  53832 [ACK] Seq=28309 Ack=149 Win=65024 Len=1348 TSval=292776098 TSecr=3284595663 [TCP segment of a reassembled PDU]"
"87","0.017000268","10.60.0.1","172.16.0.211","TCP","52","53832  >  80 [ACK] Seq=149 Ack=9437 Win=64256 Len=0 TSval=3284595664 TSecr=292776095"
"88","0.017000290","10.60.0.1","172.16.0.211","TCP","52","53832  >  80 [ACK] Seq=149 Ack=10785 Win=63232 Len=0 TSval=3284595664 TSecr=292776095"
"89","0.017000311","10.60.0.1","172.16.0.211","TCP","52","53832  >  80 [ACK] Seq=149 Ack=12133 Win=62080 Len=0 TSval=3284595664 TSecr=292776095"
"90","0.017000332","10.60.0.1","172.16.0.211","TCP","52","53832  >  80 [ACK] Seq=149 Ack=13481 Win=60928 Len=0 TSval=3284595664 TSecr=292776095"
"91","0.019005768","172.16.0.211","10.60.0.1","TCP","1400","80  >  53832 [ACK] Seq=29657 Ack=149 Win=65024 Len=1348 TSval=292776100 TSecr=3284595664 [TCP segment of a reassembled PDU]"
"92","0.019018376","172.16.0.211","10.60.0.1","TCP","1400","80  >  53832 [ACK] Seq=31005 Ack=149 Win=65024 Len=1348 TSval=292776100 TSecr=3284595664 [TCP segment of a reassembled PDU]"
"93","0.018984074","10.60.0.1","172.16.0.211","TCP","52","53832  >  80 [ACK] Seq=149 Ack=14829 Win=64256 Len=0 TSval=3284595665 TSecr=292776098"
"94","0.018984156","10.60.0.1","172.16.0.211","TCP","52","53832  >  80 [ACK] Seq=149 Ack=16177 Win=63232 Len=0 TSval=3284595665 TSecr=292776098"
"95","0.018984195","10.60.0.1","172.16.0.211","TCP","52","53832  >  80 [ACK] Seq=149 Ack=17525 Win=62080 Len=0 TSval=3284595665 TSecr=292776098"
"96","0.018984226","10.60.0.1","172.16.0.211","TCP","52","53832  >  80 [ACK] Seq=149 Ack=18873 Win=60928 Len=0 TSval=3284595665 TSecr=292776098"
"97","0.018984248","10.60.0.1","172.16.0.211","TCP","52","53832  >  80 [ACK] Seq=149 Ack=20221 Win=59776 Len=0 TSval=3284595665 TSecr=292776098"
"98","0.018984269","10.60.0.1","172.16.0.211","TCP","52","53832  >  80 [ACK] Seq=149 Ack=21569 Win=58624 Len=0 TSval=3284595666 TSecr=292776098"
"99","0.018984290","10.60.0.1","172.16.0.211","TCP","52","53832  >  80 [ACK] Seq=149 Ack=26961 Win=64256 Len=0 TSval=3284595666 TSecr=292776098"
"100","0.018984311","10.60.0.1","172.16.0.211","TCP","52","53832  >  80 [ACK] Seq=149 Ack=29657 Win=64256 Len=0 TSval=3284595666 TSecr=292776098"
"101","0.019996257","172.16.0.211","10.60.0.1","TCP","1400","80  >  53832 [ACK] Seq=32353 Ack=149 Win=65024 Len=1348 TSval=292776101 TSecr=3284595665 [TCP segment of a reassembled PDU]"
"102","0.020010448","172.16.0.211","10.60.0.1","TCP","1400","80  >  53832 [ACK] Seq=33701 Ack=149 Win=65024 Len=1348 TSval=292776101 TSecr=3284595665 [TCP segment of a reassembled PDU]"
"103","0.020019516","172.16.0.211","10.60.0.1","TCP","1400","80  >  53832 [ACK] Seq=35049 Ack=149 Win=65024 Len=1348 TSval=292776101 TSecr=3284595665 [TCP segment of a reassembled PDU]"
"104","0.020028294","172.16.0.211","10.60.0.1","TCP","1400","80  >  53832 [ACK] Seq=36397 Ack=149 Win=65024 Len=1348 TSval=292776101 TSecr=3284595665 [TCP segment of a reassembled PDU]"
"105","0.020036870","172.16.0.211","10.60.0.1","TCP","1400","80  >  53832 [ACK] Seq=37745 Ack=149 Win=65024 Len=1348 TSval=292776101 TSecr=3284595665 [TCP segment of a reassembled PDU]"
"106","0.020045541","172.16.0.211","10.60.0.1","TCP","1400","80  >  53832 [ACK] Seq=39093 Ack=149 Win=65024 Len=1348 TSval=292776101 TSecr=3284595665 [TCP segment of a reassembled PDU]"
"107","0.020054030","172.16.0.211","10.60.0.1","TCP","1400","80  >  53832 [ACK] Seq=40441 Ack=149 Win=65024 Len=1348 TSval=292776101 TSecr=3284595665 [TCP segment of a reassembled PDU]"
"108","0.020062584","172.16.0.211","10.60.0.1","TCP","1400","80  >  53832 [ACK] Seq=41789 Ack=149 Win=65024 Len=1348 TSval=292776101 TSecr=3284595665 [TCP segment of a reassembled PDU]"
"109","0.020107936","172.16.0.211","10.60.0.1","TCP","1400","80  >  53832 [ACK] Seq=43137 Ack=149 Win=65024 Len=1348 TSval=292776101 TSecr=3284595666 [TCP segment of a reassembled PDU]"
"110","0.020118149","172.16.0.211","10.60.0.1","TCP","1400","80  >  53832 [ACK] Seq=44485 Ack=149 Win=65024 Len=1348 TSval=292776101 TSecr=3284595666 [TCP segment of a reassembled PDU]"
"111","0.020126935","172.16.0.211","10.60.0.1","TCP","1400","80  >  53832 [ACK] Seq=45833 Ack=149 Win=65024 Len=1348 TSval=292776101 TSecr=3284595666 [TCP segment of a reassembled PDU]"
"112","0.020135529","172.16.0.211","10.60.0.1","TCP","1400","80  >  53832 [ACK] Seq=47181 Ack=149 Win=65024 Len=1348 TSval=292776101 TSecr=3284595666 [TCP segment of a reassembled PDU]"
"113","0.020144009","172.16.0.211","10.60.0.1","TCP","1400","80  >  53832 [ACK] Seq=48529 Ack=149 Win=65024 Len=1348 TSval=292776101 TSecr=3284595666 [TCP segment of a reassembled PDU]"
"114","0.020152553","172.16.0.211","10.60.0.1","TCP","1400","80  >  53832 [ACK] Seq=49877 Ack=149 Win=65024 Len=1348 TSval=292776101 TSecr=3284595666 [TCP segment of a reassembled PDU]"
"115","0.020161220","172.16.0.211","10.60.0.1","TCP","1400","80  >  53832 [ACK] Seq=51225 Ack=149 Win=65024 Len=1348 TSval=292776101 TSecr=3284595666 [TCP segment of a reassembled PDU]"
"116","0.020169766","172.16.0.211","10.60.0.1","TCP","1400","80  >  53832 [ACK] Seq=52573 Ack=149 Win=65024 Len=1348 TSval=292776101 TSecr=3284595666 [TCP segment of a reassembled PDU]"
"117","0.020178482","172.16.0.211","10.60.0.1","TCP","1400","80  >  53832 [ACK] Seq=53921 Ack=149 Win=65024 Len=1348 TSval=292776101 TSecr=3284595666 [TCP segment of a reassembled PDU]"
"118","0.020187124","172.16.0.211","10.60.0.1","TCP","1400","80  >  53832 [ACK] Seq=55269 Ack=149 Win=65024 Len=1348 TSval=292776101 TSecr=3284595666 [TCP segment of a reassembled PDU]"
"119","0.020196037","172.16.0.211","10.60.0.1","TCP","1400","80  >  53832 [ACK] Seq=56617 Ack=149 Win=65024 Len=1348 TSval=292776101 TSecr=3284595666 [TCP segment of a reassembled PDU]"
"120","0.020204217","172.16.0.211","10.60.0.1","TCP","1400","80  >  53832 [ACK] Seq=57965 Ack=149 Win=65024 Len=1348 TSval=292776101 TSecr=3284595666 [TCP segment of a reassembled PDU]"
"121","0.020213078","172.16.0.211","10.60.0.1","TCP","1400","80  >  53832 [ACK] Seq=59313 Ack=149 Win=65024 Len=1348 TSval=292776101 TSecr=3284595666 [TCP segment of a reassembled PDU]"
"122","0.020221723","172.16.0.211","10.60.0.1","TCP","1400","80  >  53832 [ACK] Seq=60661 Ack=149 Win=65024 Len=1348 TSval=292776101 TSecr=3284595666 [TCP segment of a reassembled PDU]"
"123","0.020093300","10.60.0.1","172.16.0.211","TCP","52","53832  >  80 [ACK] Seq=149 Ack=32353 Win=64256 Len=0 TSval=3284595667 TSecr=292776100"
"124","0.021021177","172.16.0.211","10.60.0.1","TCP","1400","80  >  53832 [ACK] Seq=62009 Ack=149 Win=65024 Len=1348 TSval=292776102 TSecr=3284595666 [TCP segment of a reassembled PDU]"
"125","0.021037430","172.16.0.211","10.60.0.1","TCP","1400","80  >  53832 [ACK] Seq=63357 Ack=149 Win=65024 Len=1348 TSval=292776102 TSecr=3284595666 [TCP segment of a reassembled PDU]"
"126","0.021050443","172.16.0.211","10.60.0.1","TCP","1400","80  >  53832 [ACK] Seq=64705 Ack=149 Win=65024 Len=1348 TSval=292776102 TSecr=3284595666 [TCP segment of a reassembled PDU]"
"127","0.021062737","172.16.0.211","10.60.0.1","TCP","1400","80  >  53832 [ACK] Seq=66053 Ack=149 Win=65024 Len=1348 TSval=292776102 TSecr=3284595666 [TCP segment of a reassembled PDU]"
"128","0.021075488","172.16.0.211","10.60.0.1","TCP","1400","80  >  53832 [ACK] Seq=67401 Ack=149 Win=65024 Len=1348 TSval=292776102 TSecr=3284595666 [TCP segment of a reassembled PDU]"
"129","0.021087877","172.16.0.211","10.60.0.1","TCP","1400","80  >  53832 [ACK] Seq=68749 Ack=149 Win=65024 Len=1348 TSval=292776102 TSecr=3284595666 [TCP segment of a reassembled PDU]"
"130","0.021100596","172.16.0.211","10.60.0.1","TCP","1400","80  >  53832 [ACK] Seq=70097 Ack=149 Win=65024 Len=1348 TSval=292776102 TSecr=3284595666 [TCP segment of a reassembled PDU]"
"131","0.021112895","172.16.0.211","10.60.0.1","TCP","1400","80  >  53832 [ACK] Seq=71445 Ack=149 Win=65024 Len=1348 TSval=292776102 TSecr=3284595666 [TCP segment of a reassembled PDU]"
"132","0.021987016","10.60.0.1","172.16.0.211","TCP","52","53832  >  80 [ACK] Seq=149 Ack=39093 Win=64256 Len=0 TSval=3284595669 TSecr=292776101"
"133","0.023009221","172.16.0.211","10.60.0.1","TCP","1400","80  >  53832 [ACK] Seq=72793 Ack=149 Win=65024 Len=1348 TSval=292776104 TSecr=3284595669 [TCP segment of a reassembled PDU]"
"134","0.023021766","172.16.0.211","10.60.0.1","TCP","1400","80  >  53832 [ACK] Seq=74141 Ack=149 Win=65024 Len=1348 TSval=292776104 TSecr=3284595669 [TCP segment of a reassembled PDU]"
"135","0.023030870","172.16.0.211","10.60.0.1","TCP","1400","80  >  53832 [ACK] Seq=75489 Ack=149 Win=65024 Len=1348 TSval=292776104 TSecr=3284595669 [TCP segment of a reassembled PDU]"
"136","0.023039478","172.16.0.211","10.60.0.1","TCP","1400","80  >  53832 [ACK] Seq=76837 Ack=149 Win=65024 Len=1348 TSval=292776104 TSecr=3284595669 [TCP segment of a reassembled PDU]"
"137","0.023047950","172.16.0.211","10.60.0.1","TCP","1400","80  >  53832 [ACK] Seq=78185 Ack=149 Win=65024 Len=1348 TSval=292776104 TSecr=3284595669 [TCP segment of a reassembled PDU]"
"138","0.023056556","172.16.0.211","10.60.0.1","TCP","1400","80  >  53832 [ACK] Seq=79533 Ack=149 Win=65024 Len=1348 TSval=292776104 TSecr=3284595669 [TCP segment of a reassembled PDU]"
"139","0.023065104","172.16.0.211","10.60.0.1","TCP","1400","80  >  53832 [ACK] Seq=80881 Ack=149 Win=65024 Len=1348 TSval=292776104 TSecr=3284595669 [TCP segment of a reassembled PDU]"
"140","0.023073653","172.16.0.211","10.60.0.1","TCP","1400","80  >  53832 [ACK] Seq=82229 Ack=149 Win=65024 Len=1348 TSval=292776104 TSecr=3284595669 [TCP segment of a reassembled PDU]"
"141","0.023082237","172.16.0.211","10.60.0.1","TCP","1400","80  >  53832 [ACK] Seq=83577 Ack=149 Win=65024 Len=1348 TSval=292776104 TSecr=3284595669 [TCP segment of a reassembled PDU]"
"142","0.023090701","172.16.0.211","10.60.0.1","TCP","1400","80  >  53832 [ACK] Seq=84925 Ack=149 Win=65024 Len=1348 TSval=292776104 TSecr=3284595669 [TCP segment of a reassembled PDU]"
"143","0.023099165","172.16.0.211","10.60.0.1","TCP","1400","80  >  53832 [ACK] Seq=86273 Ack=149 Win=65024 Len=1348 TSval=292776104 TSecr=3284595669 [TCP segment of a reassembled PDU]"
"144","0.023109037","172.16.0.211","10.60.0.1","TCP","1400","80  >  53832 [ACK] Seq=87621 Ack=149 Win=65024 Len=1348 TSval=292776104 TSecr=3284595669 [TCP segment of a reassembled PDU]"
"145","0.023119775","172.16.0.211","10.60.0.1","TCP","1400","80  >  53832 [ACK] Seq=88969 Ack=149 Win=65024 Len=1348 TSval=292776104 TSecr=3284595669 [TCP segment of a reassembled PDU]"
"146","0.023128576","172.16.0.211","10.60.0.1","TCP","1400","80  >  53832 [ACK] Seq=90317 Ack=149 Win=65024 Len=1348 TSval=292776104 TSecr=3284595669 [TCP segment of a reassembled PDU]"
"147","0.022994296","10.60.0.1","172.16.0.211","TCP","52","53832  >  80 [ACK] Seq=149 Ack=51225 Win=64256 Len=0 TSval=3284595669 TSecr=292776101"
"148","0.022994360","10.60.0.1","172.16.0.211","TCP","52","53832  >  80 [ACK] Seq=149 Ack=52573 Win=66944 Len=0 TSval=3284595669 TSecr=292776101"
"149","0.023983833","10.60.0.1","172.16.0.211","TCP","52","53832  >  80 [ACK] Seq=149 Ack=53921 Win=69632 Len=0 TSval=3284595670 TSecr=292776101"
"150","0.023983915","10.60.0.1","172.16.0.211","TCP","52","53832  >  80 [ACK] Seq=149 Ack=55269 Win=72320 Len=0 TSval=3284595670 TSecr=292776101"
"151","0.023983951","10.60.0.1","172.16.0.211","TCP","52","53832  >  80 [ACK] Seq=149 Ack=56617 Win=75008 Len=0 TSval=3284595670 TSecr=292776101"
"152","0.023983972","10.60.0.1","172.16.0.211","TCP","52","53832  >  80 [ACK] Seq=149 Ack=57965 Win=77696 Len=0 TSval=3284595670 TSecr=292776101"
"153","0.023983993","10.60.0.1","172.16.0.211","TCP","52","53832  >  80 [ACK] Seq=149 Ack=59313 Win=80384 Len=0 TSval=3284595670 TSecr=292776101"
"154","0.023984014","10.60.0.1","172.16.0.211","TCP","52","53832  >  80 [ACK] Seq=149 Ack=60661 Win=83072 Len=0 TSval=3284595670 TSecr=292776101"
"155","0.023984036","10.60.0.1","172.16.0.211","TCP","52","53832  >  80 [ACK] Seq=149 Ack=62009 Win=85760 Len=0 TSval=3284595670 TSecr=292776101"
"156","0.023984057","10.60.0.1","172.16.0.211","TCP","52","53832  >  80 [ACK] Seq=149 Ack=63357 Win=88576 Len=0 TSval=3284595671 TSecr=292776102"
"157","0.024001692","10.60.0.1","172.16.0.211","TCP","52","53832  >  80 [ACK] Seq=149 Ack=64705 Win=91264 Len=0 TSval=3284595671 TSecr=292776102"
"158","0.024001715","10.60.0.1","172.16.0.211","TCP","52","53832  >  80 [ACK] Seq=149 Ack=66053 Win=93952 Len=0 TSval=3284595671 TSecr=292776102"
"159","0.024001741","10.60.0.1","172.16.0.211","TCP","52","53832  >  80 [ACK] Seq=149 Ack=67401 Win=96640 Len=0 TSval=3284595671 TSecr=292776102"
"160","0.024001761","10.60.0.1","172.16.0.211","TCP","52","53832  >  80 [ACK] Seq=149 Ack=68749 Win=99328 Len=0 TSval=3284595671 TSecr=292776102"
"161","0.025016666","172.16.0.211","10.60.0.1","TCP","1400","80  >  53832 [ACK] Seq=91665 Ack=149 Win=65024 Len=1348 TSval=292776106 TSecr=3284595669 [TCP segment of a reassembled PDU]"
"162","0.025034005","172.16.0.211","10.60.0.1","TCP","1400","80  >  53832 [ACK] Seq=93013 Ack=149 Win=65024 Len=1348 TSval=292776106 TSecr=3284595669 [TCP segment of a reassembled PDU]"
"163","0.025048419","172.16.0.211","10.60.0.1","TCP","1400","80  >  53832 [ACK] Seq=94361 Ack=149 Win=65024 Len=1348 TSval=292776106 TSecr=3284595669 [TCP segment of a reassembled PDU]"
"164","0.025066600","172.16.0.211","10.60.0.1","TCP","1400","80  >  53832 [ACK] Seq=95709 Ack=149 Win=65024 Len=1348 TSval=292776106 TSecr=3284595669 [TCP segment of a reassembled PDU]"
"165","0.025078782","172.16.0.211","10.60.0.1","TCP","1400","80  >  53832 [ACK] Seq=97057 Ack=149 Win=65024 Len=1348 TSval=292776106 TSecr=3284595669 [TCP segment of a reassembled PDU]"
"166","0.025090928","172.16.0.211","10.60.0.1","TCP","1400","80  >  53832 [ACK] Seq=98405 Ack=149 Win=65024 Len=1348 TSval=292776106 TSecr=3284595669 [TCP segment of a reassembled PDU]"
"167","0.025103152","172.16.0.211","10.60.0.1","TCP","1400","80  >  53832 [ACK] Seq=99753 Ack=149 Win=65024 Len=1348 TSval=292776106 TSecr=3284595669 [TCP segment of a reassembled PDU]"
"168","0.025115886","172.16.0.211","10.60.0.1","TCP","1400","80  >  53832 [ACK] Seq=101101 Ack=149 Win=65024 Len=1348 TSval=292776106 TSecr=3284595669 [TCP segment of a reassembled PDU]"
"169","0.025128025","172.16.0.211","10.60.0.1","TCP","1400","80  >  53832 [ACK] Seq=102449 Ack=149 Win=65024 Len=1348 TSval=292776106 TSecr=3284595669 [TCP segment of a reassembled PDU]"
"170","0.025139820","172.16.0.211","10.60.0.1","TCP","1400","80  >  53832 [ACK] Seq=103797 Ack=149 Win=65024 Len=1348 TSval=292776106 TSecr=3284595669 [TCP segment of a reassembled PDU]"
"171","0.025201590","172.16.0.211","10.60.0.1","TCP","1400","80  >  53832 [ACK] Seq=105145 Ack=149 Win=65024 Len=1348 TSval=292776106 TSecr=3284595671 [TCP segment of a reassembled PDU]"
"172","0.025216417","172.16.0.211","10.60.0.1","TCP","1400","80  >  53832 [ACK] Seq=106493 Ack=149 Win=65024 Len=1348 TSval=292776106 TSecr=3284595671 [TCP segment of a reassembled PDU]"
"173","0.025229595","172.16.0.211","10.60.0.1","TCP","1400","80  >  53832 [ACK] Seq=107841 Ack=149 Win=65024 Len=1348 TSval=292776106 TSecr=3284595671 [TCP segment of a reassembled PDU]"
"174","0.025241972","172.16.0.211","10.60.0.1","TCP","1400","80  >  53832 [ACK] Seq=109189 Ack=149 Win=65024 Len=1348 TSval=292776106 TSecr=3284595671 [TCP segment of a reassembled PDU]"
"175","0.025254987","172.16.0.211","10.60.0.1","TCP","1400","80  >  53832 [ACK] Seq=110537 Ack=149 Win=65024 Len=1348 TSval=292776106 TSecr=3284595671 [TCP segment of a reassembled PDU]"
"176","0.025267510","172.16.0.211","10.60.0.1","TCP","1400","80  >  53832 [ACK] Seq=111885 Ack=149 Win=65024 Len=1348 TSval=292776106 TSecr=3284595671 [TCP segment of a reassembled PDU]"
"177","0.025279885","172.16.0.211","10.60.0.1","TCP","1400","80  >  53832 [ACK] Seq=113233 Ack=149 Win=65024 Len=1348 TSval=292776106 TSecr=3284595671 [TCP segment of a reassembled PDU]"
"178","0.025292444","172.16.0.211","10.60.0.1","TCP","1400","80  >  53832 [ACK] Seq=114581 Ack=149 Win=65024 Len=1348 TSval=292776106 TSecr=3284595671 [TCP segment of a reassembled PDU]"
"179","0.025304578","172.16.0.211","10.60.0.1","TCP","1400","80  >  53832 [ACK] Seq=115929 Ack=149 Win=65024 Len=1348 TSval=292776106 TSecr=3284595671 [TCP segment of a reassembled PDU]"
"180","0.025316842","172.16.0.211","10.60.0.1","TCP","1400","80  >  53832 [ACK] Seq=117277 Ack=149 Win=65024 Len=1348 TSval=292776106 TSecr=3284595671 [TCP segment of a reassembled PDU]"
"181","0.024999667","10.60.0.1","172.16.0.211","TCP","52","53832  >  80 [ACK] Seq=149 Ack=70097 Win=102016 Len=0 TSval=3284595671 TSecr=292776102"
"182","0.024999751","10.60.0.1","172.16.0.211","TCP","52","53832  >  80 [ACK] Seq=149 Ack=71445 Win=104704 Len=0 TSval=3284595671 TSecr=292776102"
"183","0.024999787","10.60.0.1","172.16.0.211","TCP","52","53832  >  80 [ACK] Seq=149 Ack=72793 Win=107392 Len=0 TSval=3284595671 TSecr=292776102"
"184","0.025183108","10.60.0.1","172.16.0.211","TCP","52","53832  >  80 [ACK] Seq=149 Ack=74141 Win=110080 Len=0 TSval=3284595672 TSecr=292776104"
"185","0.025183247","10.60.0.1","172.16.0.211","TCP","52","53832  >  80 [ACK] Seq=149 Ack=75489 Win=112768 Len=0 TSval=3284595672 TSecr=292776104"
"186","0.025183281","10.60.0.1","172.16.0.211","TCP","52","53832  >  80 [ACK] Seq=149 Ack=76837 Win=115456 Len=0 TSval=3284595672 TSecr=292776104"
"187","0.025183317","10.60.0.1","172.16.0.211","TCP","52","53832  >  80 [ACK] Seq=149 Ack=78185 Win=118144 Len=0 TSval=3284595672 TSecr=292776104"
"188","0.025183345","10.60.0.1","172.16.0.211","TCP","52","53832  >  80 [ACK] Seq=149 Ack=79533 Win=120832 Len=0 TSval=3284595672 TSecr=292776104"
"189","0.025183378","10.60.0.1","172.16.0.211","TCP","52","53832  >  80 [ACK] Seq=149 Ack=80881 Win=123520 Len=0 TSval=3284595672 TSecr=292776104"
"190","0.025183403","10.60.0.1","172.16.0.211","TCP","52","53832  >  80 [ACK] Seq=149 Ack=82229 Win=126208 Len=0 TSval=3284595672 TSecr=292776104"
"191","0.026005968","10.60.0.1","172.16.0.211","TCP","52","53832  >  80 [ACK] Seq=149 Ack=83577 Win=128896 Len=0 TSval=3284595672 TSecr=292776104"
"192","0.026006063","10.60.0.1","172.16.0.211","TCP","52","53832  >  80 [ACK] Seq=149 Ack=84925 Win=131712 Len=0 TSval=3284595672 TSecr=292776104"
"193","0.026006098","10.60.0.1","172.16.0.211","TCP","52","53832  >  80 [ACK] Seq=149 Ack=86273 Win=134400 Len=0 TSval=3284595672 TSecr=292776104"
"194","0.026006134","10.60.0.1","172.16.0.211","TCP","52","53832  >  80 [ACK] Seq=149 Ack=87621 Win=137088 Len=0 TSval=3284595672 TSecr=292776104"
"195","0.026006169","10.60.0.1","172.16.0.211","TCP","52","53832  >  80 [ACK] Seq=149 Ack=88969 Win=139776 Len=0 TSval=3284595672 TSecr=292776104"
"196","0.026006205","10.60.0.1","172.16.0.211","TCP","52","53832  >  80 [ACK] Seq=149 Ack=90317 Win=142464 Len=0 TSval=3284595672 TSecr=292776104"
"197","0.026006235","10.60.0.1","172.16.0.211","TCP","52","53832  >  80 [ACK] Seq=149 Ack=91665 Win=145152 Len=0 TSval=3284595673 TSecr=292776104"
"198","0.027034570","172.16.0.211","10.60.0.1","TCP","1400","80  >  53832 [ACK] Seq=118625 Ack=149 Win=65024 Len=1348 TSval=292776108 TSecr=3284595671 [TCP segment of a reassembled PDU]"
"199","0.027056926","172.16.0.211","10.60.0.1","TCP","1400","80  >  53832 [ACK] Seq=119973 Ack=149 Win=65024 Len=1348 TSval=292776108 TSecr=3284595671 [TCP segment of a reassembled PDU]"
"200","0.027070604","172.16.0.211","10.60.0.1","TCP","1400","80  >  53832 [ACK] Seq=121321 Ack=149 Win=65024 Len=1348 TSval=292776108 TSecr=3284595671 [TCP segment of a reassembled PDU]"
"201","0.027083257","172.16.0.211","10.60.0.1","TCP","1400","80  >  53832 [ACK] Seq=122669 Ack=149 Win=65024 Len=1348 TSval=292776108 TSecr=3284595671 [TCP segment of a reassembled PDU]"
"202","0.027103356","172.16.0.211","10.60.0.1","TCP","1400","80  >  53832 [ACK] Seq=124017 Ack=149 Win=65024 Len=1348 TSval=292776108 TSecr=3284595672 [TCP segment of a reassembled PDU]"
"203","0.027116502","172.16.0.211","10.60.0.1","TCP","1400","80  >  53832 [ACK] Seq=125365 Ack=149 Win=65024 Len=1348 TSval=292776108 TSecr=3284595672 [TCP segment of a reassembled PDU]"
"204","0.027128872","172.16.0.211","10.60.0.1","TCP","1400","80  >  53832 [ACK] Seq=126713 Ack=149 Win=65024 Len=1348 TSval=292776108 TSecr=3284595672 [TCP segment of a reassembled PDU]"
"205","0.027140274","172.16.0.211","10.60.0.1","TCP","1400","80  >  53832 [ACK] Seq=128061 Ack=149 Win=65024 Len=1348 TSval=292776108 TSecr=3284595672 [TCP segment of a reassembled PDU]"
"206","0.027153163","172.16.0.211","10.60.0.1","TCP","1400","80  >  53832 [ACK] Seq=129409 Ack=149 Win=65024 Len=1348 TSval=292776108 TSecr=3284595672 [TCP segment of a reassembled PDU]"
"207","0.027165748","172.16.0.211","10.60.0.1","TCP","1400","80  >  53832 [ACK] Seq=130757 Ack=149 Win=65024 Len=1348 TSval=292776108 TSecr=3284595672 [TCP segment of a reassembled PDU]"
"208","0.027177964","172.16.0.211","10.60.0.1","TCP","1400","80  >  53832 [ACK] Seq=132105 Ack=149 Win=65024 Len=1348 TSval=292776108 TSecr=3284595672 [TCP segment of a reassembled PDU]"
"209","0.027190787","172.16.0.211","10.60.0.1","TCP","1400","80  >  53832 [ACK] Seq=133453 Ack=149 Win=65024 Len=1348 TSval=292776108 TSecr=3284595672 [TCP segment of a reassembled PDU]"
"210","0.027203321","172.16.0.211","10.60.0.1","TCP","1400","80  >  53832 [ACK] Seq=134801 Ack=149 Win=65024 Len=1348 TSval=292776108 TSecr=3284595672 [TCP segment of a reassembled PDU]"
"211","0.027216983","172.16.0.211","10.60.0.1","TCP","1400","80  >  53832 [ACK] Seq=136149 Ack=149 Win=65024 Len=1348 TSval=292776108 TSecr=3284595672 [TCP segment of a reassembled PDU]"
"212","0.027018970","10.60.0.1","172.16.0.211","TCP","52","53832  >  80 [ACK] Seq=149 Ack=93013 Win=147840 Len=0 TSval=3284595673 TSecr=292776106"
"213","0.027019103","10.60.0.1","172.16.0.211","TCP","52","53832  >  80 [ACK] Seq=149 Ack=94361 Win=150528 Len=0 TSval=3284595673 TSecr=292776106"
"214","0.027019129","10.60.0.1","172.16.0.211","TCP","52","53832  >  80 [ACK] Seq=149 Ack=95709 Win=153216 Len=0 TSval=3284595673 TSecr=292776106"
"215","0.028007501","172.16.0.211","10.60.0.1","TCP","1400","80  >  53832 [ACK] Seq=137497 Ack=149 Win=65024 Len=1348 TSval=292776109 TSecr=3284595673 [TCP segment of a reassembled PDU]"
"216","0.028021634","172.16.0.211","10.60.0.1","TCP","1400","80  >  53832 [ACK] Seq=138845 Ack=149 Win=65024 Len=1348 TSval=292776109 TSecr=3284595673 [TCP segment of a reassembled PDU]"
"217","0.028033176","172.16.0.211","10.60.0.1","TCP","1400","80  >  53832 [ACK] Seq=140193 Ack=149 Win=65024 Len=1348 TSval=292776109 TSecr=3284595673 [TCP segment of a reassembled PDU]"
"218","0.028042281","172.16.0.211","10.60.0.1","TCP","1400","80  >  53832 [ACK] Seq=141541 Ack=149 Win=65024 Len=1348 TSval=292776109 TSecr=3284595673 [TCP segment of a reassembled PDU]"
"219","0.028050793","172.16.0.211","10.60.0.1","TCP","1400","80  >  53832 [ACK] Seq=142889 Ack=149 Win=65024 Len=1348 TSval=292776109 TSecr=3284595673 [TCP segment of a reassembled PDU]"
"220","0.028059649","172.16.0.211","10.60.0.1","TCP","1400","80  >  53832 [ACK] Seq=144237 Ack=149 Win=65024 Len=1348 TSval=292776109 TSecr=3284595673 [TCP segment of a reassembled PDU]"
"221","0.027995222","10.60.0.1","172.16.0.211","TCP","52","53832  >  80 [ACK] Seq=149 Ack=97057 Win=155904 Len=0 TSval=3284595674 TSecr=292776106"
"222","0.027995283","10.60.0.1","172.16.0.211","TCP","52","53832  >  80 [ACK] Seq=149 Ack=98405 Win=158592 Len=0 TSval=3284595674 TSecr=292776106"
"223","0.027995307","10.60.0.1","172.16.0.211","TCP","52","53832  >  80 [ACK] Seq=149 Ack=99753 Win=161280 Len=0 TSval=3284595674 TSecr=292776106"
"224","0.028988874","172.16.0.211","10.60.0.1","TCP","1400","80  >  53832 [ACK] Seq=145585 Ack=149 Win=65024 Len=1348 TSval=292776110 TSecr=3284595673 [TCP segment of a reassembled PDU]"
"225","0.029000952","172.16.0.211","10.60.0.1","TCP","1400","80  >  53832 [ACK] Seq=146933 Ack=149 Win=65024 Len=1348 TSval=292776110 TSecr=3284595673 [TCP segment of a reassembled PDU]"
"226","0.029012704","172.16.0.211","10.60.0.1","TCP","1400","80  >  53832 [ACK] Seq=148281 Ack=149 Win=65024 Len=1348 TSval=292776110 TSecr=3284595674 [TCP segment of a reassembled PDU]"
"227","0.029021639","172.16.0.211","10.60.0.1","TCP","1400","80  >  53832 [ACK] Seq=149629 Ack=149 Win=65024 Len=1348 TSval=292776110 TSecr=3284595674 [TCP segment of a reassembled PDU]"
"228","0.029030308","172.16.0.211","10.60.0.1","MP4","428",""
"229","0.028981430","10.60.0.1","172.16.0.211","TCP","52","53832  >  80 [ACK] Seq=149 Ack=101101 Win=163968 Len=0 TSval=3284595675 TSecr=292776106"
"230","0.028981452","10.60.0.1","172.16.0.211","TCP","52","53832  >  80 [ACK] Seq=149 Ack=102449 Win=166656 Len=0 TSval=3284595675 TSecr=292776106"
"231","0.028981473","10.60.0.1","172.16.0.211","TCP","52","53832  >  80 [ACK] Seq=149 Ack=103797 Win=169344 Len=0 TSval=3284595675 TSecr=292776106"
"232","0.029049075","10.60.0.1","172.16.0.211","TCP","52","53832  >  80 [ACK] Seq=149 Ack=105145 Win=172032 Len=0 TSval=3284595675 TSecr=292776106"
"233","0.029049118","10.60.0.1","172.16.0.211","TCP","52","53832  >  80 [ACK] Seq=149 Ack=106493 Win=174848 Len=0 TSval=3284595675 TSecr=292776106"
"234","0.029049141","10.60.0.1","172.16.0.211","TCP","52","53832  >  80 [ACK] Seq=149 Ack=107841 Win=175104 Len=0 TSval=3284595675 TSecr=292776106"
"235","0.029049175","10.60.0.1","172.16.0.211","TCP","52","53832  >  80 [ACK] Seq=149 Ack=118625 Win=175104 Len=0 TSval=3284595676 TSecr=292776106"
