"No.","Time","Source","Destination","Protocol","Length","Info"
"1","0.000000000","10.60.0.1","172.16.0.212","TCP","60","33516  >  8000 [SYN] Seq=0 Win=65280 Len=0 MSS=1360 SACK_PERM TSval=3950220202 TSecr=0 WS=128"
"2","0.001005177","172.16.0.212","10.60.0.1","TCP","60","8000  >  33516 [SYN, ACK] Seq=0 Ack=1 Win=65160 Len=0 MSS=1460 SACK_PERM TSval=1657833932 TSecr=3950220202 WS=128"
"3","0.002980446","10.60.0.1","172.16.0.212","TCP","52","33516  >  8000 [ACK] Seq=1 Ack=1 Win=65280 Len=0 TSval=3950220205 TSecr=1657833932"
"4","0.002980591","10.60.0.1","172.16.0.212","HTTP","190","GET /guide/ HTTP/1.1 "
"5","0.004002125","172.16.0.212","10.60.0.1","TCP","52","8000  >  33516 [ACK] Seq=1 Ack=139 Win=65024 Len=0 TSval=1657833935 TSecr=3950220205"
"6","0.007473978","172.16.0.212","10.60.0.1","TCP","69","8000  >  33516 [PSH, ACK] Seq=1 Ack=139 Win=65024 Len=17 TSval=1657833939 TSecr=3950220205 [TCP segment of a reassembled PDU]"
"7","0.008527189","172.16.0.212","10.60.0.1","TCP","1400","8000  >  33516 [ACK] Seq=18 Ack=139 Win=65024 Len=1348 TSval=1657833939 TSecr=3950220205 [TCP segment of a reassembled PDU]"
"8","0.008543498","172.16.0.212","10.60.0.1","TCP","1400","8000  >  33516 [ACK] Seq=1366 Ack=139 Win=65024 Len=1348 TSval=1657833939 TSecr=3950220205 [TCP segment of a reassembled PDU]"
"9","0.008552806","172.16.0.212","10.60.0.1","TCP","1400","8000  >  33516 [ACK] Seq=2714 Ack=139 Win=65024 Len=1348 TSval=1657833939 TSecr=3950220205 [TCP segment of a reassembled PDU]"
"10","0.008561512","172.16.0.212","10.60.0.1","TCP","1400","8000  >  33516 [ACK] Seq=4062 Ack=139 Win=65024 Len=1348 TSval=1657833939 TSecr=3950220205 [TCP segment of a reassembled PDU]"
"11","0.008570060","172.16.0.212","10.60.0.1","TCP","1400","8000  >  33516 [ACK] Seq=5410 Ack=139 Win=65024 Len=1348 TSval=1657833939 TSecr=3950220205 [TCP segment of a reassembled PDU]"
"12","0.008578755","172.16.0.212","10.60.0.1","TCP","1400","8000  >  33516 [ACK] Seq=6758 Ack=139 Win=65024 Len=1348 TSval=1657833939 TSecr=3950220205 [TCP segment of a reassembled PDU]"
"13","0.008506047","10.60.0.1","172.16.0.212","TCP","52","33516  >  8000 [ACK] Seq=139 Ack=18 Win=65280 Len=0 TSval=3950220211 TSecr=1657833939"
"14","0.009481077","172.16.0.212","10.60.0.1","TCP","1400","8000  >  33516 [ACK] Seq=8106 Ack=139 Win=65024 Len=1348 TSval=1657833940 TSecr=3950220205 [TCP segment of a reassembled PDU]"
"15","0.009492557","172.16.0.212","10.60.0.1","TCP","1400","8000  >  33516 [ACK] Seq=9454 Ack=139 Win=65024 Len=1348 TSval=1657833940 TSecr=3950220205 [TCP segment of a reassembled PDU]"
"16","0.009500744","172.16.0.212","10.60.0.1","TCP","1400","8000  >  33516 [ACK] Seq=10802 Ack=139 Win=65024 Len=1348 TSval=1657833940 TSecr=3950220205 [TCP segment of a reassembled PDU]"
"17","0.010488074","172.16.0.212","10.60.0.1","TCP","1400","8000  >  33516 [ACK] Seq=12150 Ack=139 Win=65024 Len=1348 TSval=1657833941 TSecr=3950220211 [TCP segment of a reassembled PDU]"
"18","0.010500738","172.16.0.212","10.60.0.1","TCP","1400","8000  >  33516 [ACK] Seq=13498 Ack=139 Win=65024 Len=1348 TSval=1657833941 TSecr=3950220211 [TCP segment of a reassembled PDU]"
"19","0.010475812","10.60.0.1","172.16.0.212","TCP","52","33516  >  8000 [ACK] Seq=139 Ack=1366 Win=64256 Len=0 TSval=3950220212 TSecr=1657833939"
"20","0.011489307","10.60.0.1","172.16.0.212","TCP","52","33516  >  8000 [ACK] Seq=139 Ack=2714 Win=64256 Len=0 TSval=3950220213 TSecr=1657833939"
"21","0.011489395","10.60.0.1","172.16.0.212","TCP","52","33516  >  8000 [ACK] Seq=139 Ack=4062 Win=64256 Len=0 TSval=3950220213 TSecr=1657833939"
"22","0.011489429","10.60.0.1","172.16.0.212","TCP","52","33516  >  8000 [ACK] Seq=139 Ack=5410 Win=63232 Len=0 TSval=3950220213 TSecr=1657833939"
"23","0.012501140","172.16.0.212","10.60.0.1","TCP","1400","8000  >  33516 [ACK] Seq=14846 Ack=139 Win=65024 Len=1348 TSval=1657833943 TSecr=3950220212 [TCP segment of a reassembled PDU]"
"24","0.012513467","172.16.0.212","10.60.0.1","TCP","1400","8000  >  33516 [ACK] Seq=16194 Ack=139 Win=65024 Len=1348 TSval=1657833943 TSecr=3950220212 [TCP segment of a reassembled PDU]"
"25","0.012489697","10.60.0.1","172.16.0.212","TCP","52","33516  >  8000 [ACK] Seq=139 Ack=6758 Win=62080 Len=0 TSval=3950220213 TSecr=1657833939"
"26","0.012489748","10.60.0.1","172.16.0.212","TCP","52","33516  >  8000 [ACK] Seq=139 Ack=8106 Win=60928 Len=0 TSval=3950220213 TSecr=1657833939"
"27","0.012489769","10.60.0.1","172.16.0.212","TCP","52","33516  >  8000 [ACK] Seq=139 Ack=9454 Win=59776 Len=0 TSval=3950220213 TSecr=1657833940"
"28","0.012489797","10.60.0.1","172.16.0.212","TCP","52","33516  >  8000 [ACK] Seq=139 Ack=10802 Win=58624 Len=0 TSval=3950220213 TSecr=1657833940"
"29","0.012489819","10.60.0.1","172.16.0.212","TCP","52","33516  >  8000 [ACK] Seq=139 Ack=12150 Win=64256 Len=0 TSval=3950220213 TSecr=1657833940"
"30","0.012489840","10.60.0.1","172.16.0.212","TCP","52","33516  >  8000 [ACK] Seq=139 Ack=13498 Win=64256 Len=0 TSval=3950220214 TSecr=1657833941"
"31","0.012489863","10.60.0.1","172.16.0.212","TCP","52","33516  >  8000 [ACK] Seq=139 Ack=14846 Win=64256 Len=0 TSval=3950220214 TSecr=1657833941"
"32","0.013494422","172.16.0.212","10.60.0.1","TCP","1400","8000  >  33516 [ACK] Seq=17542 Ack=139 Win=65024 Len=1348 TSval=1657833944 TSecr=3950220213 [TCP segment of a reassembled PDU]"
"33","0.013510353","172.16.0.212","10.60.0.1","TCP","1400","8000  >  33516 [ACK] Seq=18890 Ack=139 Win=65024 Len=1348 TSval=1657833944 TSecr=3950220213 [TCP segment of a reassembled PDU]"
"34","0.013480978","10.60.0.1","172.16.0.212","TCP","52","33516  >  8000 [ACK] Seq=139 Ack=16194 Win=64256 Len=0 TSval=3950220216 TSecr=1657833943"
"35","0.013481068","10.60.0.1","172.16.0.212","TCP","52","33516  >  8000 [ACK] Seq=139 Ack=17542 Win=64256 Len=0 TSval=3950220216 TSecr=1657833943"
"36","0.014480026","172.16.0.212","10.60.0.1","TCP","1400","8000  >  33516 [ACK] Seq=20238 Ack=139 Win=65024 Len=1348 TSval=1657833945 TSecr=3950220213 [TCP segment of a reassembled PDU]"
"37","0.014494215","172.16.0.212","10.60.0.1","TCP","1400","8000  >  33516 [ACK] Seq=21586 Ack=139 Win=65024 Len=1348 TSval=1657833945 TSecr=3950220213 [TCP segment of a reassembled PDU]"
"38","0.014503763","172.16.0.212","10.60.0.1","TCP","1400","8000  >  33516 [ACK] Seq=22934 Ack=139 Win=65024 Len=1348 TSval=1657833945 TSecr=3950220213 [TCP segment of a reassembled PDU]"
"39","0.014514040","172.16.0.212","10.60.0.1","TCP","1400","8000  >  33516 [ACK] Seq=24282 Ack=139 Win=65024 Len=1348 TSval=1657833945 TSecr=3950220213 [TCP segment of a reassembled PDU]"
"40","0.014522824","172.16.0.212","10.60.0.1","TCP","1400","8000  >  33516 [ACK] Seq=25630 Ack=139 Win=65024 Len=1348 TSval=1657833945 TSecr=3950220213 [TCP segment of a reassembled PDU]"
"41","0.014531430","172.16.0.212","10.60.0.1","HTTP","581","HTTP/1.0 200 OK  (text/html)"
"42","0.014469018","10.60.0.1","172.16.0.212","TCP","52","33516  >  8000 [ACK] Seq=139 Ack=18890 Win=64256 Len=0 TSval=3950220217 TSecr=1657833944"
"43","0.014469042","10.60.0.1","172.16.0.212","TCP","52","33516  >  8000 [ACK] Seq=139 Ack=20238 Win=63232 Len=0 TSval=3950220217 TSecr=1657833944"
"44","0.016471767","10.60.0.1","172.16.0.212","TCP","52","33516  >  8000 [ACK] Seq=139 Ack=22934 Win=64256 Len=0 TSval=3950220218 TSecr=1657833945"
"45","0.016471843","10.60.0.1","172.16.0.212","TCP","52","33516  >  8000 [ACK] Seq=139 Ack=26978 Win=64256 Len=0 TSval=3950220218 TSecr=1657833945"
"46","0.016471867","10.60.0.1","172.16.0.212","TCP","52","33516  >  8000 [ACK] Seq=139 Ack=27507 Win=64256 Len=0 TSval=3950220218 TSecr=1657833945"
"47","0.016471890","10.60.0.1","172.16.0.212","HTTP","199","GET /guide/features/ HTTP/1.1 "
"48","0.017472099","172.16.0.212","10.60.0.1","TCP","40","8000  >  33516 [RST] Seq=27507 Win=0 Len=0"
"49","1.019786947","10.60.0.1","172.16.0.212","TCP","60","33524  >  8000 [SYN] Seq=0 Win=65280 Len=0 MSS=1360 SACK_PERM TSval=3950221222 TSecr=0 WS=128"
"50","1.020794439","172.16.0.212","10.60.0.1","TCP","60","8000  >  33524 [SYN, ACK] Seq=0 Ack=1 Win=65160 Len=0 MSS=1460 SACK_PERM TSval=1657834952 TSecr=3950221222 WS=128"
"51","1.022780608","10.60.0.1","172.16.0.212","TCP","52","33524  >  8000 [ACK] Seq=1 Ack=1 Win=65280 Len=0 TSval=3950221225 TSecr=1657834952"
"52","1.022780704","10.60.0.1","172.16.0.212","HTTP","199","GET /guide/features/ HTTP/1.1 "
"53","1.023802262","172.16.0.212","10.60.0.1","TCP","52","8000  >  33524 [ACK] Seq=1 Ack=148 Win=65024 Len=0 TSval=1657834954 TSecr=3950221225"
"54","1.024800133","172.16.0.212","10.60.0.1","TCP","69","8000  >  33524 [PSH, ACK] Seq=1 Ack=148 Win=65024 Len=17 TSval=1657834955 TSecr=3950221225 [TCP segment of a reassembled PDU]"
"55","1.024823636","172.16.0.212","10.60.0.1","TCP","1400","8000  >  33524 [ACK] Seq=18 Ack=148 Win=65024 Len=1348 TSval=1657834955 TSecr=3950221225 [TCP segment of a reassembled PDU]"
"56","1.024833814","172.16.0.212","10.60.0.1","TCP","1400","8000  >  33524 [ACK] Seq=1366 Ack=148 Win=65024 Len=1348 TSval=1657834955 TSecr=3950221225 [TCP segment of a reassembled PDU]"
"57","1.024843137","172.16.0.212","10.60.0.1","TCP","1400","8000  >  33524 [ACK] Seq=2714 Ack=148 Win=65024 Len=1348 TSval=1657834955 TSecr=3950221225 [TCP segment of a reassembled PDU]"
"58","1.024851538","172.16.0.212","10.60.0.1","TCP","1400","8000  >  33524 [ACK] Seq=4062 Ack=148 Win=65024 Len=1348 TSval=1657834955 TSecr=3950221225 [TCP segment of a reassembled PDU]"
"59","1.024860155","172.16.0.212","10.60.0.1","TCP","1400","8000  >  33524 [ACK] Seq=5410 Ack=148 Win=65024 Len=1348 TSval=1657834955 TSecr=3950221225 [TCP segment of a reassembled PDU]"
"60","1.024875147","172.16.0.212","10.60.0.1","TCP","1400","8000  >  33524 [ACK] Seq=6758 Ack=148 Win=65024 Len=1348 TSval=1657834956 TSecr=3950221225 [TCP segment of a reassembled PDU]"
"61","1.024884376","172.16.0.212","10.60.0.1","TCP","1400","8000  >  33524 [ACK] Seq=8106 Ack=148 Win=65024 Len=1348 TSval=1657834956 TSecr=3950221225 [TCP segment of a reassembled PDU]"
"62","1.024893142","172.16.0.212","10.60.0.1","TCP","1400","8000  >  33524 [ACK] Seq=9454 Ack=148 Win=65024 Len=1348 TSval=1657834956 TSecr=3950221225 [TCP segment of a reassembled PDU]"
"63","1.024901841","172.16.0.212","10.60.0.1","TCP","1400","8000  >  33524 [ACK] Seq=10802 Ack=148 Win=65024 Len=1348 TSval=1657834956 TSecr=3950221225 [TCP segment of a reassembled PDU]"
"64","1.026784064","10.60.0.1","172.16.0.212","TCP","52","33524  >  8000 [ACK] Seq=148 Ack=18 Win=65280 Len=0 TSval=3950221229 TSecr=1657834955"
"65","1.026784136","10.60.0.1","172.16.0.212","TCP","52","33524  >  8000 [ACK] Seq=148 Ack=1366 Win=64000 Len=0 TSval=3950221229 TSecr=1657834955"
"66","1.027804906","172.16.0.212","10.60.0.1","TCP","1400","8000  >  33524 [ACK] Seq=12150 Ack=148 Win=65024 Len=1348 TSval=1657834958 TSecr=3950221229 [TCP segment of a reassembled PDU]"
"67","1.027818525","172.16.0.212","10.60.0.1","TCP","1400","8000  >  33524 [ACK] Seq=13498 Ack=148 Win=65024 Len=1348 TSval=1657834958 TSecr=3950221229 [TCP segment of a reassembled PDU]"
"68","1.027779481","10.60.0.1","172.16.0.212","TCP","52","33524  >  8000 [ACK] Seq=148 Ack=2714 Win=62848 Len=0 TSval=3950221229 TSecr=1657834955"
"69","1.027779570","10.60.0.1","172.16.0.212","TCP","52","33524  >  8000 [ACK] Seq=148 Ack=4062 Win=61696 Len=0 TSval=3950221229 TSecr=1657834955"
"70","1.027779594","10.60.0.1","172.16.0.212","TCP","52","33524  >  8000 [ACK] Seq=148 Ack=5410 Win=60416 Len=0 TSval=3950221229 TSecr=1657834955"
"71","1.027779616","10.60.0.1","172.16.0.212","TCP","52","33524  >  8000 [ACK] Seq=148 Ack=6758 Win=59136 Len=0 TSval=3950221229 TSecr=1657834955"
"72","1.027779637","10.60.0.1","172.16.0.212","TCP","52","33524  >  8000 [ACK] Seq=148 Ack=8106 Win=57856 Len=0 TSval=3950221229 TSecr=1657834956"
"73","1.027779659","10.60.0.1","172.16.0.212","TCP","52","33524  >  8000 [ACK] Seq=148 Ack=9454 Win=56576 Len=0 TSval=3950221229 TSecr=1657834956"
"74","1.027779680","10.60.0.1","172.16.0.212","TCP","52","33524  >  8000 [ACK] Seq=148 Ack=10802 Win=55296 Len=0 TSval=3950221229 TSecr=1657834956"
"75","1.027779701","10.60.0.1","172.16.0.212","TCP","52","33524  >  8000 [ACK] Seq=148 Ack=12150 Win=55168 Len=0 TSval=3950221229 TSecr=1657834956"
"76","1.028791567","172.16.0.212","10.60.0.1","TCP","1400","8000  >  33524 [ACK] Seq=14846 Ack=148 Win=65024 Len=1348 TSval=1657834959 TSecr=3950221229 [TCP segment of a reassembled PDU]"
"77","1.028805350","172.16.0.212","10.60.0.1","TCP","1400","8000  >  33524 [ACK] Seq=16194 Ack=148 Win=65024 Len=1348 TSval=1657834959 TSecr=3950221229 [TCP segment of a reassembled PDU]"
"78","1.028817116","172.16.0.212","10.60.0.1","TCP","1400","8000  >  33524 [ACK] Seq=17542 Ack=148 Win=65024 Len=1348 TSval=1657834959 TSecr=3950221229 [TCP segment of a reassembled PDU]"
"79","1.028828118","172.16.0.212","10.60.0.1","TCP","1400","8000  >  33524 [ACK] Seq=18890 Ack=148 Win=65024 Len=1348 TSval=1657834959 TSecr=3950221229 [TCP segment of a reassembled PDU]"
"80","1.028840544","172.16.0.212","10.60.0.1","TCP","1400","8000  >  33524 [ACK] Seq=20238 Ack=148 Win=65024 Len=1348 TSval=1657834959 TSecr=3950221229 [TCP segment of a reassembled PDU]"
"81","1.028852895","172.16.0.212","10.60.0.1","TCP","1400","8000  >  33524 [ACK] Seq=21586 Ack=148 Win=65024 Len=1348 TSval=1657834959 TSecr=3950221229 [TCP segment of a reassembled PDU]"
"82","1.029801075","172.16.0.212","10.60.0.1","TCP","1400","8000  >  33524 [ACK] Seq=22934 Ack=148 Win=65024 Len=1348 TSval=1657834960 TSecr=3950221229 [TCP segment of a reassembled PDU]"
"83","1.029814932","172.16.0.212","10.60.0.1","TCP","1400","8000  >  33524 [ACK] Seq=24282 Ack=148 Win=65024 Len=1348 TSval=1657834960 TSecr=3950221229 [TCP segment of a reassembled PDU]"
"84","1.029827090","172.16.0.212","10.60.0.1","TCP","1400","8000  >  33524 [ACK] Seq=25630 Ack=148 Win=65024 Len=1348 TSval=1657834960 TSecr=3950221229 [TCP segment of a reassembled PDU]"
"85","1.029838367","172.16.0.212","10.60.0.1","HTTP","93","HTTP/1.0 200 OK  (text/html)"
"86","1.029789080","10.60.0.1","172.16.0.212","TCP","52","33524  >  8000 [ACK] Seq=148 Ack=13498 Win=64256 Len=0 TSval=3950221232 TSecr=1657834958"
"87","1.029789114","10.60.0.1","172.16.0.212","TCP","52","33524  >  8000 [ACK] Seq=148 Ack=14846 Win=63232 Len=0 TSval=3950221232 TSecr=1657834958"
"88","1.030778713","10.60.0.1","172.16.0.212","TCP","52","33524  >  8000 [ACK] Seq=148 Ack=16194 Win=64256 Len=0 TSval=3950221233 TSecr=1657834959"
"89","1.030778784","10.60.0.1","172.16.0.212","TCP","52","33524  >  8000 [ACK] Seq=148 Ack=17542 Win=63232 Len=0 TSval=3950221233 TSecr=1657834959"
"90","1.030778815","10.60.0.1","172.16.0.212","TCP","52","33524  >  8000 [ACK] Seq=148 Ack=18890 Win=62080 Len=0 TSval=3950221233 TSecr=1657834959"
"91","1.031799245","10.60.0.1","172.16.0.212","TCP","52","33524  >  8000 [ACK] Seq=148 Ack=20238 Win=60928 Len=0 TSval=3950221233 TSecr=1657834959"
"92","1.031799353","10.60.0.1","172.16.0.212","TCP","52","33524  >  8000 [ACK] Seq=148 Ack=22934 Win=64256 Len=0 TSval=3950221233 TSecr=1657834959"
"93","1.031799395","10.60.0.1","172.16.0.212","TCP","52","33524  >  8000 [ACK] Seq=148 Ack=26978 Win=64256 Len=0 TSval=3950221234 TSecr=1657834960"
"94","1.031799421","10.60.0.1","172.16.0.212","TCP","52","33524  >  8000 [ACK] Seq=148 Ack=27019 Win=64256 Len=0 TSval=3950221234 TSecr=1657834960"
"95","1.032779571","10.60.0.1","172.16.0.212","HTTP","201","GET /guide/SMF-Config/ HTTP/1.1 "
"96","1.033784344","172.16.0.212","10.60.0.1","TCP","40","8000  >  33524 [RST] Seq=27019 Win=0 Len=0"
"97","2.036773332","10.60.0.1","172.16.0.212","TCP","60","33526  >  8000 [SYN] Seq=0 Win=65280 Len=0 MSS=1360 SACK_PERM TSval=3950222239 TSecr=0 WS=128"
"98","2.037765908","172.16.0.212","10.60.0.1","TCP","60","8000  >  33526 [SYN, ACK] Seq=0 Ack=1 Win=65160 Len=0 MSS=1460 SACK_PERM TSval=1657835969 TSecr=3950222239 WS=128"
"99","2.039762219","10.60.0.1","172.16.0.212","TCP","52","33526  >  8000 [ACK] Seq=1 Ack=1 Win=65280 Len=0 TSval=3950222241 TSecr=1657835969"
"100","2.039762371","10.60.0.1","172.16.0.212","HTTP","201","GET /guide/SMF-Config/ HTTP/1.1 "
"101","2.040768999","172.16.0.212","10.60.0.1","TCP","52","8000  >  33526 [ACK] Seq=1 Ack=150 Win=65024 Len=0 TSval=1657835971 TSecr=3950222242"
"102","2.041765790","172.16.0.212","10.60.0.1","TCP","69","8000  >  33526 [PSH, ACK] Seq=1 Ack=150 Win=65024 Len=17 TSval=1657835972 TSecr=3950222242 [TCP segment of a reassembled PDU]"
"103","2.041785999","172.16.0.212","10.60.0.1","TCP","1400","8000  >  33526 [ACK] Seq=18 Ack=150 Win=65024 Len=1348 TSval=1657835972 TSecr=3950222242 [TCP segment of a reassembled PDU]"
"104","2.041795490","172.16.0.212","10.60.0.1","TCP","1400","8000  >  33526 [ACK] Seq=1366 Ack=150 Win=65024 Len=1348 TSval=1657835972 TSecr=3950222242 [TCP segment of a reassembled PDU]"
"105","2.041804352","172.16.0.212","10.60.0.1","TCP","1400","8000  >  33526 [ACK] Seq=2714 Ack=150 Win=65024 Len=1348 TSval=1657835972 TSecr=3950222242 [TCP segment of a reassembled PDU]"
"106","2.041813116","172.16.0.212","10.60.0.1","TCP","1400","8000  >  33526 [ACK] Seq=4062 Ack=150 Win=65024 Len=1348 TSval=1657835972 TSecr=3950222242 [TCP segment of a reassembled PDU]"
"107","2.041821812","172.16.0.212","10.60.0.1","TCP","1400","8000  >  33526 [ACK] Seq=5410 Ack=150 Win=65024 Len=1348 TSval=1657835972 TSecr=3950222242 [TCP segment of a reassembled PDU]"
"108","2.041830564","172.16.0.212","10.60.0.1","TCP","1400","8000  >  33526 [ACK] Seq=6758 Ack=150 Win=65024 Len=1348 TSval=1657835972 TSecr=3950222242 [TCP segment of a reassembled PDU]"
"109","2.042756207","172.16.0.212","10.60.0.1","TCP","1400","8000  >  33526 [ACK] Seq=8106 Ack=150 Win=65024 Len=1348 TSval=1657835973 TSecr=3950222242 [TCP segment of a reassembled PDU]"
"110","2.042767687","172.16.0.212","10.60.0.1","TCP","1400","8000  >  33526 [ACK] Seq=9454 Ack=150 Win=65024 Len=1348 TSval=1657835973 TSecr=3950222242 [TCP segment of a reassembled PDU]"
"111","2.042775980","172.16.0.212","10.60.0.1","TCP","1400","8000  >  33526 [ACK] Seq=10802 Ack=150 Win=65024 Len=1348 TSval=1657835973 TSecr=3950222242 [TCP segment of a reassembled PDU]"
"112","2.044749459","10.60.0.1","172.16.0.212","TCP","52","33526  >  8000 [ACK] Seq=150 Ack=18 Win=65280 Len=0 TSval=3950222246 TSecr=1657835972"
"113","2.044749522","10.60.0.1","172.16.0.212","TCP","52","33526  >  8000 [ACK] Seq=150 Ack=1366 Win=64000 Len=0 TSval=3950222246 TSecr=1657835972"
"114","2.044749550","10.60.0.1","172.16.0.212","TCP","52","33526  >  8000 [ACK] Seq=150 Ack=2714 Win=62848 Len=0 TSval=3950222246 TSecr=1657835972"
"115","2.044749571","10.60.0.1","172.16.0.212","TCP","52","33526  >  8000 [ACK] Seq=150 Ack=4062 Win=61696 Len=0 TSval=3950222246 TSecr=1657835972"
"116","2.044749593","10.60.0.1","172.16.0.212","TCP","52","33526  >  8000 [ACK] Seq=150 Ack=5410 Win=60544 Len=0 TSval=3950222246 TSecr=1657835972"
"117","2.044749614","10.60.0.1","172.16.0.212","TCP","52","33526  >  8000 [ACK] Seq=150 Ack=6758 Win=59264 Len=0 TSval=3950222246 TSecr=1657835972"
"118","2.044749636","10.60.0.1","172.16.0.212","TCP","52","33526  >  8000 [ACK] Seq=150 Ack=8106 Win=57984 Len=0 TSval=3950222246 TSecr=1657835972"
"119","2.044749657","10.60.0.1","172.16.0.212","TCP","52","33526  >  8000 [ACK] Seq=150 Ack=9454 Win=64256 Len=0 TSval=3950222246 TSecr=1657835973"
"120","2.044769600","10.60.0.1","172.16.0.212","TCP","52","33526  >  8000 [ACK] Seq=150 Ack=10802 Win=63232 Len=0 TSval=3950222246 TSecr=1657835973"
"121","2.045774658","172.16.0.212","10.60.0.1","TCP","1400","8000  >  33526 [ACK] Seq=12150 Ack=150 Win=65024 Len=1348 TSval=1657835976 TSecr=3950222246 [TCP segment of a reassembled PDU]"
"122","2.045787815","172.16.0.212","10.60.0.1","TCP","1400","8000  >  33526 [ACK] Seq=13498 Ack=150 Win=65024 Len=1348 TSval=1657835976 TSecr=3950222246 [TCP segment of a reassembled PDU]"
"123","2.045799842","172.16.0.212","10.60.0.1","TCP","1400","8000  >  33526 [ACK] Seq=14846 Ack=150 Win=65024 Len=1348 TSval=1657835976 TSecr=3950222246 [TCP segment of a reassembled PDU]"
"124","2.045811254","172.16.0.212","10.60.0.1","TCP","1400","8000  >  33526 [ACK] Seq=16194 Ack=150 Win=65024 Len=1348 TSval=1657835976 TSecr=3950222246 [TCP segment of a reassembled PDU]"
"125","2.045822967","172.16.0.212","10.60.0.1","TCP","1400","8000  >  33526 [ACK] Seq=17542 Ack=150 Win=65024 Len=1348 TSval=1657835976 TSecr=3950222246 [TCP segment of a reassembled PDU]"
"126","2.045831961","172.16.0.212","10.60.0.1","TCP","1400","8000  >  33526 [ACK] Seq=18890 Ack=150 Win=65024 Len=1348 TSval=1657835976 TSecr=3950222246 [TCP segment of a reassembled PDU]"
"127","2.045840619","172.16.0.212","10.60.0.1","TCP","1400","8000  >  33526 [ACK] Seq=20238 Ack=150 Win=65024 Len=1348 TSval=1657835976 TSecr=3950222246 [TCP segment of a reassembled PDU]"
"128","2.045851594","172.16.0.212","10.60.0.1","TCP","1400","8000  >  33526 [ACK] Seq=21586 Ack=150 Win=65024 Len=1348 TSval=1657835976 TSecr=3950222246 [TCP segment of a reassembled PDU]"
"129","2.045761232","10.60.0.1","172.16.0.212","TCP","52","33526  >  8000 [ACK] Seq=150 Ack=12150 Win=63232 Len=0 TSval=3950222246 TSecr=1657835973"
"130","2.046761528","172.16.0.212","10.60.0.1","TCP","1400","8000  >  33526 [ACK] Seq=22934 Ack=150 Win=65024 Len=1348 TSval=1657835977 TSecr=3950222246 [TCP segment of a reassembled PDU]"
"131","2.046774031","172.16.0.212","10.60.0.1","TCP","1400","8000  >  33526 [ACK] Seq=24282 Ack=150 Win=65024 Len=1348 TSval=1657835977 TSecr=3950222246 [TCP segment of a reassembled PDU]"
"132","2.046782942","172.16.0.212","10.60.0.1","TCP","1400","8000  >  33526 [ACK] Seq=25630 Ack=150 Win=65024 Len=1348 TSval=1657835977 TSecr=3950222246 [TCP segment of a reassembled PDU]"
"133","2.046791568","172.16.0.212","10.60.0.1","TCP","1400","8000  >  33526 [ACK] Seq=26978 Ack=150 Win=65024 Len=1348 TSval=1657835977 TSecr=3950222246 [TCP segment of a reassembled PDU]"
"134","2.046800030","172.16.0.212","10.60.0.1","HTTP","454","HTTP/1.0 200 OK  (text/html)"
"135","2.048757039","10.60.0.1","172.16.0.212","TCP","52","33526  >  8000 [ACK] Seq=150 Ack=13498 Win=64256 Len=0 TSval=3950222250 TSecr=1657835976"
"136","2.048757179","10.60.0.1","172.16.0.212","TCP","52","33526  >  8000 [ACK] Seq=150 Ack=14846 Win=63232 Len=0 TSval=3950222250 TSecr=1657835976"
"137","2.048757207","10.60.0.1","172.16.0.212","TCP","52","33526  >  8000 [ACK] Seq=150 Ack=16194 Win=62080 Len=0 TSval=3950222250 TSecr=1657835976"
"138","2.048757231","10.60.0.1","172.16.0.212","TCP","52","33526  >  8000 [ACK] Seq=150 Ack=17542 Win=64256 Len=0 TSval=3950222250 TSecr=1657835976"
"139","2.049771662","10.60.0.1","172.16.0.212","TCP","52","33526  >  8000 [ACK] Seq=150 Ack=18890 Win=64256 Len=0 TSval=3950222250 TSecr=1657835976"
"140","2.049771780","10.60.0.1","172.16.0.212","TCP","52","33526  >  8000 [ACK] Seq=150 Ack=20238 Win=63232 Len=0 TSval=3950222250 TSecr=1657835976"
"141","2.049771826","10.60.0.1","172.16.0.212","TCP","52","33526  >  8000 [ACK] Seq=150 Ack=22934 Win=64256 Len=0 TSval=3950222250 TSecr=1657835976"
"142","2.049771860","10.60.0.1","172.16.0.212","TCP","52","33526  >  8000 [ACK] Seq=150 Ack=28728 Win=64256 Len=0 TSval=3950222251 TSecr=1657835977"
"143","2.049771886","10.60.0.1","172.16.0.212","HTTP","189","GET /blog/ HTTP/1.1 "
"144","2.051782001","172.16.0.212","10.60.0.1","TCP","40","8000  >  33526 [RST] Seq=28728 Win=0 Len=0"
"145","3.053792772","10.60.0.1","172.16.0.212","TCP","60","33536  >  8000 [SYN] Seq=0 Win=65280 Len=0 MSS=1360 SACK_PERM TSval=3950223256 TSecr=0 WS=128"
"146","3.054808914","172.16.0.212","10.60.0.1","TCP","60","8000  >  33536 [SYN, ACK] Seq=0 Ack=1 Win=65160 Len=0 MSS=1460 SACK_PERM TSval=1657836985 TSecr=3950223256 WS=128"
"147","3.056786579","10.60.0.1","172.16.0.212","TCP","52","33536  >  8000 [ACK] Seq=1 Ack=1 Win=65280 Len=0 TSval=3950223258 TSecr=1657836985"
"148","3.056786730","10.60.0.1","172.16.0.212","HTTP","189","GET /blog/ HTTP/1.1 "
"149","3.057799757","172.16.0.212","10.60.0.1","TCP","52","8000  >  33536 [ACK] Seq=1 Ack=138 Win=65024 Len=0 TSval=1657836988 TSecr=3950223258"
"150","3.058799865","172.16.0.212","10.60.0.1","TCP","69","8000  >  33536 [PSH, ACK] Seq=1 Ack=138 Win=65024 Len=17 TSval=1657836989 TSecr=3950223258 [TCP segment of a reassembled PDU]"
"151","3.058820982","172.16.0.212","10.60.0.1","TCP","1400","8000  >  33536 [ACK] Seq=18 Ack=138 Win=65024 Len=1348 TSval=1657836989 TSecr=3950223258 [TCP segment of a reassembled PDU]"
"152","3.058830949","172.16.0.212","10.60.0.1","TCP","1400","8000  >  33536 [ACK] Seq=1366 Ack=138 Win=65024 Len=1348 TSval=1657836989 TSecr=3950223258 [TCP segment of a reassembled PDU]"
"153","3.058839004","172.16.0.212","10.60.0.1","TCP","1400","8000  >  33536 [ACK] Seq=2714 Ack=138 Win=65024 Len=1348 TSval=1657836989 TSecr=3950223258 [TCP segment of a reassembled PDU]"
"154","3.058849529","172.16.0.212","10.60.0.1","TCP","1400","8000  >  33536 [ACK] Seq=4062 Ack=138 Win=65024 Len=1348 TSval=1657836989 TSecr=3950223258 [TCP segment of a reassembled PDU]"
"155","3.058860527","172.16.0.212","10.60.0.1","TCP","1400","8000  >  33536 [ACK] Seq=5410 Ack=138 Win=65024 Len=1348 TSval=1657836989 TSecr=3950223258 [TCP segment of a reassembled PDU]"
"156","3.058869491","172.16.0.212","10.60.0.1","TCP","1400","8000  >  33536 [ACK] Seq=6758 Ack=138 Win=65024 Len=1348 TSval=1657836989 TSecr=3950223258 [TCP segment of a reassembled PDU]"
"157","3.059805577","172.16.0.212","10.60.0.1","TCP","1400","8000  >  33536 [ACK] Seq=8106 Ack=138 Win=65024 Len=1348 TSval=1657836990 TSecr=3950223258 [TCP segment of a reassembled PDU]"
"158","3.059820420","172.16.0.212","10.60.0.1","TCP","1400","8000  >  33536 [ACK] Seq=9454 Ack=138 Win=65024 Len=1348 TSval=1657836990 TSecr=3950223258 [TCP segment of a reassembled PDU]"
"159","3.059832371","172.16.0.212","10.60.0.1","TCP","1400","8000  >  33536 [ACK] Seq=10802 Ack=138 Win=65024 Len=1348 TSval=1657836990 TSecr=3950223258 [TCP segment of a reassembled PDU]"
"160","3.061782438","10.60.0.1","172.16.0.212","TCP","52","33536  >  8000 [ACK] Seq=138 Ack=18 Win=65280 Len=0 TSval=3950223263 TSecr=1657836989"
"161","3.061782559","10.60.0.1","172.16.0.212","TCP","52","33536  >  8000 [ACK] Seq=138 Ack=1366 Win=64000 Len=0 TSval=3950223263 TSecr=1657836989"
"162","3.061782597","10.60.0.1","172.16.0.212","TCP","52","33536  >  8000 [ACK] Seq=138 Ack=2714 Win=62848 Len=0 TSval=3950223263 TSecr=1657836989"
"163","3.061782619","10.60.0.1","172.16.0.212","TCP","52","33536  >  8000 [ACK] Seq=138 Ack=4062 Win=61696 Len=0 TSval=3950223263 TSecr=1657836989"
"164","3.061782640","10.60.0.1","172.16.0.212","TCP","52","33536  >  8000 [ACK] Seq=138 Ack=5410 Win=60544 Len=0 TSval=3950223263 TSecr=1657836989"
"165","3.061782661","10.60.0.1","172.16.0.212","TCP","52","33536  >  8000 [ACK] Seq=138 Ack=6758 Win=59392 Len=0 TSval=3950223263 TSecr=1657836989"
"166","3.061782682","10.60.0.1","172.16.0.212","TCP","52","33536  >  8000 [ACK] Seq=138 Ack=8106 Win=58240 Len=0 TSval=3950223263 TSecr=1657836989"
"167","3.061782708","10.60.0.1","172.16.0.212","TCP","52","33536  >  8000 [ACK] Seq=138 Ack=9454 Win=57472 Len=0 TSval=3950223263 TSecr=1657836990"
"168","3.061800892","10.60.0.1","172.16.0.212","TCP","52","33536  >  8000 [ACK] Seq=138 Ack=10802 Win=56320 Len=0 TSval=3950223264 TSecr=1657836990"
"169","3.061800914","10.60.0.1","172.16.0.212","TCP","52","33536  >  8000 [ACK] Seq=138 Ack=12150 Win=55168 Len=0 TSval=3950223264 TSecr=1657836990"
"170","3.062797538","172.16.0.212","10.60.0.1","TCP","1400","8000  >  33536 [ACK] Seq=12150 Ack=138 Win=65024 Len=1348 TSval=1657836993 TSecr=3950223263 [TCP segment of a reassembled PDU]"
"171","3.062810702","172.16.0.212","10.60.0.1","TCP","1400","8000  >  33536 [ACK] Seq=13498 Ack=138 Win=65024 Len=1348 TSval=1657836993 TSecr=3950223263 [TCP segment of a reassembled PDU]"
"172","3.062819661","172.16.0.212","10.60.0.1","TCP","1400","8000  >  33536 [ACK] Seq=14846 Ack=138 Win=65024 Len=1348 TSval=1657836993 TSecr=3950223263 [TCP segment of a reassembled PDU]"
"173","3.062828217","172.16.0.212","10.60.0.1","TCP","1400","8000  >  33536 [ACK] Seq=16194 Ack=138 Win=65024 Len=1348 TSval=1657836993 TSecr=3950223263 [TCP segment of a reassembled PDU]"
"174","3.062836814","172.16.0.212","10.60.0.1","TCP","1400","8000  >  33536 [ACK] Seq=17542 Ack=138 Win=65024 Len=1348 TSval=1657836993 TSecr=3950223263 [TCP segment of a reassembled PDU]"
"175","3.062845368","172.16.0.212","10.60.0.1","TCP","1400","8000  >  33536 [ACK] Seq=18890 Ack=138 Win=65024 Len=1348 TSval=1657836993 TSecr=3950223263 [TCP segment of a reassembled PDU]"
"176","3.062854135","172.16.0.212","10.60.0.1","TCP","1400","8000  >  33536 [ACK] Seq=20238 Ack=138 Win=65024 Len=1348 TSval=1657836993 TSecr=3950223263 [TCP segment of a reassembled PDU]"
"177","3.062862803","172.16.0.212","10.60.0.1","TCP","1400","8000  >  33536 [ACK] Seq=21586 Ack=138 Win=65024 Len=1348 TSval=1657836993 TSecr=3950223263 [TCP segment of a reassembled PDU]"
"178","3.063802143","172.16.0.212","10.60.0.1","TCP","1400","8000  >  33536 [ACK] Seq=22934 Ack=138 Win=65024 Len=1348 TSval=1657836994 TSecr=3950223263 [TCP segment of a reassembled PDU]"
"179","3.063816310","172.16.0.212","10.60.0.1","TCP","1400","8000  >  33536 [ACK] Seq=24282 Ack=138 Win=65024 Len=1348 TSval=1657836994 TSecr=3950223263 [TCP segment of a reassembled PDU]"
"180","3.063825477","172.16.0.212","10.60.0.1","TCP","1400","8000  >  33536 [ACK] Seq=25630 Ack=138 Win=65024 Len=1348 TSval=1657836994 TSecr=3950223263 [TCP segment of a reassembled PDU]"
"181","3.063834235","172.16.0.212","10.60.0.1","HTTP","892","HTTP/1.0 200 OK  (text/html)"
"182","3.064786287","10.60.0.1","172.16.0.212","TCP","52","33536  >  8000 [ACK] Seq=138 Ack=13498 Win=64256 Len=0 TSval=3950223266 TSecr=1657836993"
"183","3.065796569","10.60.0.1","172.16.0.212","TCP","52","33536  >  8000 [ACK] Seq=138 Ack=14846 Win=63232 Len=0 TSval=3950223266 TSecr=1657836993"
"184","3.065796676","10.60.0.1","172.16.0.212","TCP","52","33536  >  8000 [ACK] Seq=138 Ack=16194 Win=62080 Len=0 TSval=3950223266 TSecr=1657836993"
"185","3.065796716","10.60.0.1","172.16.0.212","TCP","52","33536  >  8000 [ACK] Seq=138 Ack=17542 Win=60928 Len=0 TSval=3950223267 TSecr=1657836993"
"186","3.065796748","10.60.0.1","172.16.0.212","TCP","52","33536  >  8000 [ACK] Seq=138 Ack=18890 Win=59776 Len=0 TSval=3950223267 TSecr=1657836993"
"187","3.065796776","10.60.0.1","172.16.0.212","TCP","52","33536  >  8000 [ACK] Seq=138 Ack=20238 Win=58624 Len=0 TSval=3950223267 TSecr=1657836993"
"188","3.066786253","10.60.0.1","172.16.0.212","TCP","52","33536  >  8000 [ACK] Seq=138 Ack=22934 Win=63232 Len=0 TSval=3950223267 TSecr=1657836993"
"189","3.066786325","10.60.0.1","172.16.0.212","TCP","52","33536  >  8000 [ACK] Seq=138 Ack=25630 Win=63232 Len=0 TSval=3950223267 TSecr=1657836994"
"190","3.066786346","10.60.0.1","172.16.0.212","TCP","52","33536  >  8000 [ACK] Seq=138 Ack=27818 Win=64256 Len=0 TSval=3950223267 TSecr=1657836994"
"191","3.066786368","10.60.0.1","172.16.0.212","HTTP","223","GET /blog/20231115/free5GC_OAuth2_Procedure/ HTTP/1.1 "
"192","3.067792684","172.16.0.212","10.60.0.1","TCP","40","8000  >  33536 [RST] Seq=27818 Win=0 Len=0"
"193","4.073827135","10.60.0.1","172.16.0.212","TCP","60","33542  >  8000 [SYN] Seq=0 Win=65280 Len=0 MSS=1360 SACK_PERM TSval=3950224276 TSecr=0 WS=128"
"194","4.074829200","172.16.0.212","10.60.0.1","TCP","60","8000  >  33542 [SYN, ACK] Seq=0 Ack=1 Win=65160 Len=0 MSS=1460 SACK_PERM TSval=1657838005 TSecr=3950224276 WS=128"
"195","4.076808983","10.60.0.1","172.16.0.212","TCP","52","33542  >  8000 [ACK] Seq=1 Ack=1 Win=65280 Len=0 TSval=3950224279 TSecr=1657838005"
"196","4.076809130","10.60.0.1","172.16.0.212","HTTP","223","GET /blog/20231115/free5GC_OAuth2_Procedure/ HTTP/1.1 "
"197","4.077821980","172.16.0.212","10.60.0.1","TCP","52","8000  >  33542 [ACK] Seq=1 Ack=172 Win=65024 Len=0 TSval=1657838008 TSecr=3950224279"
"198","4.078831600","172.16.0.212","10.60.0.1","TCP","69","8000  >  33542 [PSH, ACK] Seq=1 Ack=172 Win=65024 Len=17 TSval=1657838009 TSecr=3950224279 [TCP segment of a reassembled PDU]"
"199","4.078853975","172.16.0.212","10.60.0.1","TCP","1400","8000  >  33542 [ACK] Seq=18 Ack=172 Win=65024 Len=1348 TSval=1657838009 TSecr=3950224279 [TCP segment of a reassembled PDU]"
"200","4.078863753","172.16.0.212","10.60.0.1","TCP","1400","8000  >  33542 [ACK] Seq=1366 Ack=172 Win=65024 Len=1348 TSval=1657838009 TSecr=3950224279 [TCP segment of a reassembled PDU]"
"201","4.078872350","172.16.0.212","10.60.0.1","TCP","1400","8000  >  33542 [ACK] Seq=2714 Ack=172 Win=65024 Len=1348 TSval=1657838009 TSecr=3950224279 [TCP segment of a reassembled PDU]"
"202","4.078881127","172.16.0.212","10.60.0.1","TCP","1400","8000  >  33542 [ACK] Seq=4062 Ack=172 Win=65024 Len=1348 TSval=1657838009 TSecr=3950224279 [TCP segment of a reassembled PDU]"
"203","4.078889656","172.16.0.212","10.60.0.1","TCP","1400","8000  >  33542 [ACK] Seq=5410 Ack=172 Win=65024 Len=1348 TSval=1657838009 TSecr=3950224279 [TCP segment of a reassembled PDU]"
"204","4.078898129","172.16.0.212","10.60.0.1","TCP","1400","8000  >  33542 [ACK] Seq=6758 Ack=172 Win=65024 Len=1348 TSval=1657838009 TSecr=3950224279 [TCP segment of a reassembled PDU]"
"205","4.079817545","172.16.0.212","10.60.0.1","TCP","1400","8000  >  33542 [ACK] Seq=8106 Ack=172 Win=65024 Len=1348 TSval=1657838010 TSecr=3950224279 [TCP segment of a reassembled PDU]"
"206","4.079830092","172.16.0.212","10.60.0.1","TCP","1400","8000  >  33542 [ACK] Seq=9454 Ack=172 Win=65024 Len=1348 TSval=1657838010 TSecr=3950224279 [TCP segment of a reassembled PDU]"
"207","4.079839366","172.16.0.212","10.60.0.1","TCP","1400","8000  >  33542 [ACK] Seq=10802 Ack=172 Win=65024 Len=1348 TSval=1657838010 TSecr=3950224279 [TCP segment of a reassembled PDU]"
"208","4.081810358","10.60.0.1","172.16.0.212","TCP","52","33542  >  8000 [ACK] Seq=172 Ack=18 Win=65280 Len=0 TSval=3950224283 TSecr=1657838009"
"209","4.081810479","10.60.0.1","172.16.0.212","TCP","52","33542  >  8000 [ACK] Seq=172 Ack=1366 Win=64000 Len=0 TSval=3950224283 TSecr=1657838009"
"210","4.081810508","10.60.0.1","172.16.0.212","TCP","52","33542  >  8000 [ACK] Seq=172 Ack=2714 Win=62848 Len=0 TSval=3950224283 TSecr=1657838009"
"211","4.081810530","10.60.0.1","172.16.0.212","TCP","52","33542  >  8000 [ACK] Seq=172 Ack=4062 Win=61696 Len=0 TSval=3950224283 TSecr=1657838009"
"212","4.081810551","10.60.0.1","172.16.0.212","TCP","52","33542  >  8000 [ACK] Seq=172 Ack=5410 Win=60544 Len=0 TSval=3950224283 TSecr=1657838009"
"213","4.081810577","10.60.0.1","172.16.0.212","TCP","52","33542  >  8000 [ACK] Seq=172 Ack=6758 Win=59392 Len=0 TSval=3950224283 TSecr=1657838009"
"214","4.081810598","10.60.0.1","172.16.0.212","TCP","52","33542  >  8000 [ACK] Seq=172 Ack=8106 Win=58624 Len=0 TSval=3950224283 TSecr=1657838009"
"215","4.082824048","172.16.0.212","10.60.0.1","TCP","1400","8000  >  33542 [ACK] Seq=12150 Ack=172 Win=65024 Len=1348 TSval=1657838013 TSecr=3950224283 [TCP segment of a reassembled PDU]"
"216","4.082836785","172.16.0.212","10.60.0.1","TCP","1400","8000  >  33542 [ACK] Seq=13498 Ack=172 Win=65024 Len=1348 TSval=1657838013 TSecr=3950224283 [TCP segment of a reassembled PDU]"
"217","4.082845741","172.16.0.212","10.60.0.1","TCP","1400","8000  >  33542 [ACK] Seq=14846 Ack=172 Win=65024 Len=1348 TSval=1657838013 TSecr=3950224283 [TCP segment of a reassembled PDU]"
"218","4.082854165","172.16.0.212","10.60.0.1","TCP","1400","8000  >  33542 [ACK] Seq=16194 Ack=172 Win=65024 Len=1348 TSval=1657838013 TSecr=3950224283 [TCP segment of a reassembled PDU]"
"219","4.082863559","172.16.0.212","10.60.0.1","TCP","1400","8000  >  33542 [ACK] Seq=17542 Ack=172 Win=65024 Len=1348 TSval=1657838013 TSecr=3950224283 [TCP segment of a reassembled PDU]"
"220","4.082875508","172.16.0.212","10.60.0.1","TCP","1400","8000  >  33542 [ACK] Seq=18890 Ack=172 Win=65024 Len=1348 TSval=1657838013 TSecr=3950224283 [TCP segment of a reassembled PDU]"
"221","4.082884614","172.16.0.212","10.60.0.1","TCP","1400","8000  >  33542 [ACK] Seq=20238 Ack=172 Win=65024 Len=1348 TSval=1657838013 TSecr=3950224283 [TCP segment of a reassembled PDU]"
"222","4.082893042","172.16.0.212","10.60.0.1","TCP","1400","8000  >  33542 [ACK] Seq=21586 Ack=172 Win=65024 Len=1348 TSval=1657838013 TSecr=3950224283 [TCP segment of a reassembled PDU]"
"223","4.082810525","10.60.0.1","172.16.0.212","TCP","52","33542  >  8000 [ACK] Seq=172 Ack=9454 Win=57472 Len=0 TSval=3950224284 TSecr=1657838010"
"224","4.082810601","10.60.0.1","172.16.0.212","TCP","52","33542  >  8000 [ACK] Seq=172 Ack=10802 Win=56320 Len=0 TSval=3950224284 TSecr=1657838010"
"225","4.082810623","10.60.0.1","172.16.0.212","TCP","52","33542  >  8000 [ACK] Seq=172 Ack=12150 Win=55168 Len=0 TSval=3950224284 TSecr=1657838010"
"226","4.083813432","172.16.0.212","10.60.0.1","TCP","1400","8000  >  33542 [ACK] Seq=22934 Ack=172 Win=65024 Len=1348 TSval=1657838014 TSecr=3950224283 [TCP segment of a reassembled PDU]"
"227","4.083823863","172.16.0.212","10.60.0.1","TCP","1400","8000  >  33542 [ACK] Seq=24282 Ack=172 Win=65024 Len=1348 TSval=1657838014 TSecr=3950224283 [TCP segment of a reassembled PDU]"
"228","4.083832885","172.16.0.212","10.60.0.1","TCP","1400","8000  >  33542 [ACK] Seq=25630 Ack=172 Win=65024 Len=1348 TSval=1657838014 TSecr=3950224283 [TCP segment of a reassembled PDU]"
"229","4.083841446","172.16.0.212","10.60.0.1","TCP","1400","8000  >  33542 [ACK] Seq=26978 Ack=172 Win=65024 Len=1348 TSval=1657838014 TSecr=3950224283 [TCP segment of a reassembled PDU]"
"230","4.083849723","172.16.0.212","10.60.0.1","HTTP","247","HTTP/1.0 200 OK  (text/html)"
"231","4.084808092","10.60.0.1","172.16.0.212","TCP","52","33542  >  8000 [ACK] Seq=172 Ack=13498 Win=64256 Len=0 TSval=3950224287 TSecr=1657838013"
"232","4.085809519","10.60.0.1","172.16.0.212","TCP","52","33542  >  8000 [ACK] Seq=172 Ack=14846 Win=63232 Len=0 TSval=3950224287 TSecr=1657838013"
"233","4.085809584","10.60.0.1","172.16.0.212","TCP","52","33542  >  8000 [ACK] Seq=172 Ack=16194 Win=62080 Len=0 TSval=3950224287 TSecr=1657838013"
"234","4.085809610","10.60.0.1","172.16.0.212","TCP","52","33542  >  8000 [ACK] Seq=172 Ack=17542 Win=60928 Len=0 TSval=3950224287 TSecr=1657838013"
"235","4.085809639","10.60.0.1","172.16.0.212","TCP","52","33542  >  8000 [ACK] Seq=172 Ack=18890 Win=59776 Len=0 TSval=3950224287 TSecr=1657838013"
"236","4.085809661","10.60.0.1","172.16.0.212","TCP","52","33542  >  8000 [ACK] Seq=172 Ack=20238 Win=64256 Len=0 TSval=3950224287 TSecr=1657838013"
"237","4.085809682","10.60.0.1","172.16.0.212","TCP","52","33542  >  8000 [ACK] Seq=172 Ack=22934 Win=64256 Len=0 TSval=3950224287 TSecr=1657838013"
"238","4.085809704","10.60.0.1","172.16.0.212","TCP","52","33542  >  8000 [ACK] Seq=172 Ack=28521 Win=64256 Len=0 TSval=3950224288 TSecr=1657838014"
"239","4.086801899","10.60.0.1","172.16.0.212","TCP","52","33542  >  8000 [FIN, ACK] Seq=172 Ack=28521 Win=64256 Len=0 TSval=3950224289 TSecr=1657838014"
"240","4.087803386","172.16.0.212","10.60.0.1","TCP","52","[TCP Previous segment not captured] 8000  >  33542 [ACK] Seq=28522 Ack=173 Win=65024 Len=0 TSval=1657838018 TSecr=3950224289"
"241","4.293735727","172.16.0.212","10.60.0.1","TCP","52","[TCP Retransmission] 8000  >  33542 [FIN, PSH, ACK] Seq=28521 Ack=173 Win=65024 Len=0 TSval=1657838225 TSecr=3950224289"
"242","4.295704716","10.60.0.1","172.16.0.212","TCP","52","33542  >  8000 [ACK] Seq=173 Ack=28522 Win=64256 Len=0 TSval=3950224497 TSecr=1657838225"
"243","19.017830007","10.60.0.1","172.16.0.212","TCP","60","39874  >  8000 [SYN] Seq=0 Win=65280 Len=0 MSS=1360 SACK_PERM TSval=3950239218 TSecr=0 WS=128"
"244","19.018824345","172.16.0.212","10.60.0.1","TCP","60","8000  >  39874 [SYN, ACK] Seq=0 Ack=1 Win=65160 Len=0 MSS=1460 SACK_PERM TSval=1657852949 TSecr=3950239218 WS=128"
"245","19.020811970","10.60.0.1","172.16.0.212","TCP","52","39874  >  8000 [ACK] Seq=1 Ack=1 Win=65280 Len=0 TSval=3950239221 TSecr=1657852949"
"246","19.020812069","10.60.0.1","172.16.0.212","HTTP","190","GET /guide/ HTTP/1.1 "
